用户ID,用户名,评分,评论内容,点赞数,发布时间,设备型号
8963153,不良原点、,4,累死个人，新入坑，为了抽琼弦死命肝。单抽需要160原石，而一个任务才给10，关键越到后面关卡越长，一队二队各闯三关。为了拿20原石，新角色体验也是久的不行，福利真不行。最后还得氪金才拿下😅<br />补充下：游戏活动很多，但是大部分都进不去，一直连接有问题。要不是老婆们都可可爱爱的，实在玩不下去,1,2025-03-04 11:25,OPPO Find X7 Ultra
47752651,事与夜说,5,真正的服务业,,2025-03-03 23:10,小米24117RK2CC
114087464,Death💀Wish,1,除了说的ml和运营真诚，游戏而言就是一坨。先不说熟悉的米池，我就在想一款主打射击的游戏怎么做到这么无趣的，首先你不是动作游戏操作乐趣本身就少了很多，进图突突突一个弹夹打完boss就掉个血皮，反而把换弹时间突出的特别明显，还有一个射击游戏设计的boss怪还都是近战？你问问哪个射击玩家爱去秒离自己近身的怪，你是需要枪械瞄准的射击游戏，要不你就给我把刀给我套动作模组我上去砍，要不近战boss近身我还得跑还得回头瞄准还得射击换弹夹的，而且boss还带隐身近身这种逆天机制，真嫌我血压低是吧，拿着动作游戏boss的设计设计游戏？<br />10.14  骂归骂，钱包自动充值了400块😭<br />11.17  你是不是又飘了？不说前几天的节奏了，这次活动弄这么干，你又觉得你行了？不想当副游想当主游了？<br />3、3 本来改回4星，看到这史一样的肉鸽还来，直接一星吧。你真以为这模式是因为那20把的任务才被骂的？,19,2024-09-16 15:32,iPhone 11 Pro
678603052,忧郁剑魔,5,个人感觉非常好玩，人物都非常好😁😃,1,2025-03-03 20:43,华为荣耀9X
33075492,tftgutetfy7,1,新版本水弹那玩意，练习模式，我得连赢三把才能过，输一把直接重来，原版游戏怎么着也是三局两胜，五局三胜，概率游戏你整连胜？今天刚回坑第二天，直接卸载。,,2025-03-03 20:20,未提供
625360974,爱玩游戏的咸鱼,4,很好玩，角色很好看，立绘也好看，剧情方面也不错，就是前期没有配音，不过后期就有了，但为啥我的角色黄黄的？,,2025-03-03 18:27,OPPO PFTM20
3955471,osusoer,2,榨尽体力也无法抽取。新人卡池也这么毒吗？？？？武器保底，角色都快一百发了😡,,2023-07-20 10:29,OPPO Find X7 Ultra
59655075,手机用户59655075,4,我不说别的更新为什么不能后台挂着？？我还得盯他看半天吗？？<br />以上是我质疑的问题，但是游戏确实好玩目前71级每天刷刷日常，看看剧情。,4,2025-01-25 17:03,Vivo Y200 GT
638532147,嗨害嗨,5,为什么我下载的显示服务器未开放,,2025-03-02 17:18,Vivo IQOO Neo8
476559501,ζρσο可,2,我玩了应该有1周多了，现在60级，发现有几个问题<br />1、超元链接这个模式里面，联机通关经常是卡崩的情况，就是就算组好队伍了，也进不去副本，直接给你卡死在外面，而且，选择不组队，自己去单人模式，也会是一样的情况，卡崩，也是进不去的，就算你运气好进去了，你的队友可不一定能进去，有好几次，我是能进去了，本来三个人的，结果就两个人在副本里面，这样有什么可玩性呢？<br />2、角色的服装，服装上只能看到自己有的和活动限时展示的皮肤，以往的皮肤是看不到的，你CH本来就是靠角色留住玩家的，你让玩家看到这些服装，提高一下游戏的丰富度不好吗？我也是服了，我看了游戏这么久来来回回就这么10来件衣服。<br />3手游的游戏转动慢，然后视角僵硬，不过角色的动作还是可以的就是视角很难受。,3,2025-03-02 17:10,Vivo IQOO 12
683130618,。,5,求佬解答<br />夜天光的爆发技能不能不换人啊？,,2025-03-02 15:47,未提供
482567271,玉白清灵,1,按键意外的难用。,3,2025-03-02 15:41,Honor Play 6T Pro
414489354,子女抚养权,4,玩法还是很适合喜欢美少女射击游戏的人的 皮肤也好看 角色也算好抽剧情也算中规中矩 但皮肤没活动的话真的很贵耶😓建议官方降个价,1,2025-03-02 15:26,Realme V11 5G
347806433,贵福高,3,能不能用tap？tap？账号登录，能不能不用手机号登录？,,2025-03-02 14:58,vivo Y200i
52043551,手机用户52043551,3,雷电模拟器玩不了是什么 鬼,,2025-03-02 14:41,未提供
57085832,思涵,1,联机模式bug太多,1,2025-03-02 14:14,Redmi  K70 Pro
420878797,阿巴阿巴,1,限时武器和常驻武器全保底还歪了，我只能说，我玩你*呢？我一个新手你给我直接来两把狙，还送一把，开局10天三把金狙，你这游戏也是无敌了,2,2025-03-02 14:13,Blackshark SHARK PRS-A0
420082319,裂⚡开,3,琴诺版本入坑的100级玩家，这个版本是我唯一一次活动不想打满的版本，又肝又无聊，在频道上吐槽甚至还有屏蔽，气的我差点要卖号退坑了。<br />而且我实话实说了， 尘白的角色没有能特别触动我的，剧情演出效果很一般，没感觉有什么感人的，玩这么久了反倒是泳装版本的团圆剧情观感最好，当然现在有语音了会好一些。<br />问卷和工单填了很多，感觉我提的一个都没改，很多老问题也没优化，比如手机端联机bug，常驻后勤本随机掉落，苔丝支援技语音等等，很难不令人寒心。<br />总结建议还是把尘白当个收菜游戏玩，花费太多时间的话后面会发觉不值的。,2,2025-03-02 13:50,未提供
581187212,健康是福,4,太好玩了，画质太棒了，操作细节立绘建模也很好。对手机配置要求也不高。建议大家玩一玩。,,2025-03-02 11:25,小米Redmi K40
607938003,初雪,4,以前我玩的号怎么找不到了,1,2025-03-01 10:53,Oppo A58
589102600,噢噢,5,💃🏻立绘建模：<br />一顶一的建模跟立绘,,2025-03-01 01:49,未提供
36609310,晓梦迷蝶,5,老婆们真的太可爱了😍😘😋😤😡😈🥵😇,,2025-02-28 20:25,OPPO PEPM00
592915109,修狗,4,🎮操作细节：<br />手机玩家有点难受<br />💃🏻立绘建模：<br />不推荐手机玩家，因为最棒的体验没有了😭,,2025-02-28 16:18,Huawei Mate 60 Pro
329133817,阿良,3,新玩家，听说福利好，日常轻松进来的。确实是上来就领两只五星白拿。先叠个甲。玩过上一款第三人称射击游戏。所以对于这种射击游戏的操作敏感的度是有。<br />-----<br />我电脑端，手机端都有玩。但是个人还是喜欢手机端。因为感觉电脑端的智能瞄准做的挺差的。操作上感觉很浮，有延迟拖感。然后也没有办法做出特别灵敏极限的操作，举个例子比如秒开镜摔狙这种。所以我还是在手机上玩比较多。<br />剧情：像这种二游的剧情，我基本跳过的，所以我不想评价太多。二次元游戏共性就是明明想写一个很大的世界观，但是用词特别拖泥带水。且经常用一些游戏世界观的词语。让人一句话完全看不懂。从而失去看的意义。当然你有跳过剧情。已经超过一些其他游戏。<br />基本的第三人称射击玩法：在我看来是有点无聊的。我之前说过了我玩过其他的类似的。人家也是这种。但是人家愿意一直玩就在于基本都射击玩法的多样性可以玩出很多多样性。。但是这个不完全是缺点。我不会认为这个是缺点。只能说有些不足。<br />接下来这个点就真是缺点了。<br />就是新手一开始并不轻松。大量重复性很高的玩法让玩家一开始就没有那么多的精力（不是游戏体力哦）去刷刷刷。特别是你这个游戏还是要人为操作的。没有自动战斗的。有一说一还是蛮累的。新手想要过渡到日常轻松下线的。必须要经历一段时间的肝。（我大概就是在这段时间。）但是在这种一直去打各种新模式的战斗中很容易失去了战斗的意义。然后脱坑。没办法。。这个你们要考虑一下。因为你们游戏和其他二次元卡牌游戏不一样。毕竟要手动过图的。而且前期开荒是没办法用重复按键精灵脚本来打的。像我这种上年纪的玩家打二十分钟就累了。隔壁我玩了一个游戏的也是要我手动的。但是人家有自动战斗和手动战斗做结合。一部分关卡可以全自动。<br />至于抽卡，活动。没啥好评价的。抽卡我才肝了40抽。主角才到30没玩什么。但是老实说这游戏让我真没有肝抽的冲动。隔壁某游戏我3天肝了90抽。资源都挖空了。这里40抽还有很多资源能肝。我都不大想打。活动我也基本上没多少。活动小游戏太多了。。。成就一层叠一层没看懂，就一直没去玩。<br />游戏建模渲染不大好。我感觉人物质量太差了。一点质感都没有。。。<br />总之：这游戏可以玩。但是感觉有点怪，前面一直肝。后面如果能日常躺平，更容易两极分化严重。毕竟你要手动战斗去肝。跟其他游戏只需要可以休闲动动手指肝。更容易出现落差。。。<br />就这样了。卸了卸了。,88,2025-02-14 00:08,小米24069RA21C
537937866,仙,1,登不上进不去,,2025-02-28 14:24,Vivo Y77
540021637,yywx,5,我是阿b的赛博人质!!!电脑端玩家，学生党两三千氪了大概，（资金大部分来自于兼职和余下的生活费）可玩性我觉得有待进步，尤其是后期的话没活动的时候日常就没什么可玩性了，可尘白大部分时间都是活动时间，就体验感还不错。尤其是当你有事情的时候，完全不用为了日活要挤出来一个半个小时的时间而急急忙忙<br />能说道说道的就是这各个玩法逐步解锁，偶尔想库库爽玩的时候全是小游戏，， ，<br />官方我认为服务态度不错 至少到现在我也算是经历过爆雷事件的（当时刚做完手术没几天躺到床上睡不着等直播回应）到现在看来，玩家说了官方真的会做!比如摇摇车（禅境蜗牛什么时候上线!!!😏😏）<br />至于画面，抽卡体验，皮肤，配音什么的我玩着舒服!<br />什么宣发啊，配音用新人啊之类之类的，你管他干什么!玩的舒服不就完了<br />还有社区，至少我觉得哪里不合适，游戏频道里我会和老哥们商量某某地方是不是做的不太好，要不要提个工单（我b服不好提，会有老哥主动说他去提的），总有些个觉得哪哪不好，上来就上下嘴皮一碰像是那憋了三天的然后缸赛被拔出来了一样开始喷，这种人不挨骂谁挨骂？还美名其曰“提建议”（比如小老师期间就有个频道里上来就说觉得小老师皮肤不行，我不喜欢巴拉巴拉的，提工单呐!这种人不挨骂谁挨骂对吧）,2,2025-02-28 14:08,未提供
640650374,半盏流年,1,多余的话我不说，这个就是价值100的皮肤,1,2025-02-28 12:12,小米Xiaomi 12S Pro
20716619,尘,5,新版本简直完美，剧情全配音非常不错，不亏是影视圈的cv。<br />晨星芬妮的皮肤也是顶中顶，版本福利也是多得很，送角色送皮肤，月卡党一个角色不漏，抽完角色和专武还有1.4w多石头，真的爽啊。<br />宿舍温泉非常不错，就是打水枪没有二倍速有点难受，被乐不思蜀加酒杀给秒了。<br />小老师滑滑车真的搞，太🍬太欢乐了，氛围感不错，就是宿舍太多交互点，小老师随机到滑滑车很少，只能自己召唤了。<br />新星开拓保持水平稳步进步，好评，就是对于老玩家来说，新帕鲁没新的用处。<br />糖豆人新关卡挺好玩，一如既往的好评。<br />还有月子中心的按摩什么时候更新啊，尘白的玩法挺多，就是都刚起步，有点浅。lhm继续加油<br />🔖运营服务：<br />游戏福利真的很足，双新UP版本都送其中一个角色，零氪都能角色出一个就能拿下一个。氪金都是皮肤或者月卡专武。<br />游戏没有强度焦虑，所有抽卡资源都是随便拿的（就像原深渊12满星不用限时，崩铁深渊不限回合一样），只要你打过去（四星都能过，正常练度基本都是90s左右过，低级刮痧也是过）就抽卡资源奖励全拿。<br />🧝🏻‍♀️角色人设：<br />剧情专注ml，不掉凯子，没有男角色，杜绝CP和同。<br />这可能是我体验最好一款国产二游，制作组很用心，虽说前段时间内鬼文案暴雷了，但是直播道歉态度很好。玩了半年充钱一千多（原神崩铁加起来玩4年才氪500左右），都是忍不住买皮肤。<br />💃🏻立绘建模：<br />建模水平越来越好，茉莉安幽潮简直了，吊打一直走下坡路的少前2，这次pv角色和立绘都快一模一样了。<br />✍🏻建议：<br />目前就玩法欠缺深度，虽然经常出新模式，但都浅尝辄止，过个版本就没了，老模式更新也太慢，没新意。<br />目前渲染还是欠缺，局内角色靠墙看很好，但远了有种纸片的单薄感，我认为pc端应该加上环境遮蔽光，草地没有环境遮蔽光一片绿，加上角色面部介于二次元和三次元之间，所有从其他二次元游戏过来会有怪异感觉，习惯后就舒服多了。,6,2024-04-27 00:03,Vivo IQOO Neo9
686171098,虎骨防护镜,5,这是我玩过福利最好的2游了，单凭限定角色抽奖不会歪就超越很多游戏了<br />💃🏻立绘建模：<br />只能说哟西😔,,2025-02-27 20:53,华为ADA-AL00
83380718,GoldenFIsh,3,建议每个版本那些重复刷的活动，比如要玩十次才能完成成就，减少到6次就差不多了，重复玩真的会疲劳，有时候玩一次就不想再刷了。其他都不错的。,,2025-02-27 16:41,未提供
107073836,手机用户107073836,1,玩了快一年了，官方作死好几次了，今天的PV演都不演了，直接抄的少前2（黛烟），这游戏魔怔人太多了，说ml仙人都侮辱仙人这个词，总之就这样吧，官方作死，玩家魔怔，都有光明的未来。,6,2025-02-27 15:49,Vivo IQOO 10
550158861,星萌,4,建模挺不错的 玩法一般 希望多开发基地玩法 和角色互动 基地皮肤和人物基地服装等 可以适当出一些新的四星角色 多深化主线剧情 注意小故事小冒险的设计 祝尘白蒸蒸日上！,,2025-02-27 12:58,Redmi Note 12 Pro
492986318,咸鱼.,5,两分钟清完日常，好👍,,2025-02-27 02:55, iQOO Neo7 SE
648402222,惟晚,4,5星给福利，<br />-1星给玩法，活动,1,2025-02-27 00:00,Huawei Enjoy 20 Pro 5G
22208359,晴天,4,手机玩进副本老是断线,1,2025-02-26 19:50,未提供
507487201,爱莉,5,各位大佬我问问是开新号好还是用老号回归号,2,2025-02-26 18:29,Redmi K50
687500678,呆戴代,5,福利很多，不氪也能玩,,2025-02-26 18:23,小米24117RK2CC
495504694,寄生insect,4,战斗中出个自由拍摄功能就更好了,,2025-02-26 15:49,Redmi K70 Ultra
527258547,YY520JJW,3,做的很好，不过我觉得作为雷总公司的游戏，我用红米居然不能玩所有的联机内容的部分，所以星数不高，但是挺推荐去玩的,,2025-02-26 14:04,Redmi  K70 Pro
82532631,RyoAska,4,游戏为什么最近两天会启动不了,,2025-02-26 10:22,华为Mate 70 Pro+
322198522,战鬥暴龍獸,5,从1.5版本玩到现在2.5，可谓见证了尘白的复活和崛起，这是唯一一款我对其评价越来越高的游戏。,5,2024-01-25 19:26,iPhone 14 Pro Max
4371959,dj泰坦肩撞你,4,除了活动重复度太高了以外，其他的就没什么大的缺点了,1,2024-07-12 02:44,未提供
15473325,皆空,1,今天回坑了，发现居然多了虚化，直接又卸载了,2,2025-02-26 01:01,OnePlus Ace 2
19717659,伊修利特,5,刚入坑，体验非常好，情绪价值拉满。晨星莫名像阴阳师里的白狼，巨戳我。不过游戏这么多玩法，给的奖励又太磕碜，钻石给多了逼肝，给少了蚊子腿没动力，完全可以弄点成就或者头像框啥的不影响强度又满足收集癖，点名就是新球开拓，地图全收集就几百钻完全没动力。,2,2025-02-26 00:53,iPhone 15 Pro
524981596,不规律人.,4,云玩了一会儿，为什么我更新到一半就闪退,1,2025-02-25 22:08,Vivo Y77
122427261,DPOU,4,这游戏建模以及设计都不错，这就有点氪金 你现传图是挺好的，玩的像幻塔 卖皮肤增加互动,,2025-02-25 20:24,Vivo IQOO Neo7
480453623,猫娘,3,我是双端玩家目前手机端体验确实比较好，虽然有点问题但是不影响游戏体验，主要说一下pc端的优化是真的有点垃圾了，我240多平均帧玩战地五，120帧玩地平线4，96帧玩荒野大**2，但是玩尘白就会特别卡，图形设置调了也没有用，掉帧严重，还占我42个G，我建议游戏还是要多优化一下。,,2025-02-25 15:06,未提供
25100223,暗梓,5,什么时候心动水弹这b活动失败也加经验值，什么时候再打好评<br />好，心动水弹回炉重做了，奖励后续直接领，为运营态度点赞,2,2025-02-24 01:55,Vivo IQOO Neo9
582436673,聪明的老派,4,还不错，就是我不知道怎么培养角色，希望能多出一些免费皮肤什么的,,2025-02-25 12:15,Redmi K60
57327303,CoNNeR,5,2025更<br />时隔两年，我回坑了，这游戏变得越来越不错了。干脆直接注册了个新号，基本上新角色每一期都可以拿到，武器就抽强力角色。皮肤返现那一波赚了一年月卡，应对各种突发情况官方的态度也很端正。没有理由不成为我的电子榨菜。还有就是ml，dddd喽。<br />-------------------------<br />福利扣扣搜搜，困难本2-2有恶性bug刷不出来敌人。<br />0.7的概率80抽小保底确实难崩，非氪佬还是别随便入坑比价好<br />-------------------------,1,2023-07-24 18:36,小米Xiaomi 14 Ultra
634670561,",",2,一联机就这样。,,2025-02-24 19:57,Oppo K9s
8965737,零歧零识,5,好玩，好看。,3,2024-11-08 18:49,未提供
705037968,ciellenne,5,喜欢，谁不想和18个美少女同时谈恋爱呢,,2025-02-23 22:24,未提供
57050507,ツギハギスタッカート,5,服务态度我给五星，但是抽卡歪的我是真红温了😠<br />等这壁米池改了再补回来<br />给了,2,2024-04-22 22:25,未提供
641846693,？？？,5,总之就是非常非常的好有点崩三的那感觉了,,2025-02-23 20:31,OPPO Reno3元气版5G
447727537,绍江,4,首先呢，我是一个手机端玩家，比较喜欢注重于玩法，基本各种玩法的游戏都接触过，但却在此之前从来没有接触过射击类游戏的，那么接下来我将从，活动福利、新手入坑福利，关卡难度、剧情方面（包括剧情插图），玩法方面（包括活动），射击体验，建模方面说一下（以下皆为个人观点）<br />1.新手入坑福利和活动福利（综合评价很好）<br />（1）尘白对于新手还是很友好的，确实像大家说的那一样，在福利这一方面真的是没得挑，新手卡池保底50抽，后面打完第2章还会送常驻五星之一，分析员升级，也会送上常驻十抽，后面打到5-12章，送10抽（可能有遗漏，但是新手入坑，打打主线，领一下奖励，攒个50抽以上是没问题的，差不多第1周就会攒起5星的配队。）<br />（2）尤其是最近新年搞的活动，签到也会送几抽限定卡池，而且尘白这次又送了自选五星，发送到邮箱里面了，后面又送了肴.夜天光，限定卡池五星说送就送尘白你是这个👍就差把晨星一起送了，而且官方听劝程度和鸣朝有的一拼。<br />2.关卡难度和剧情方面：（综合感觉良好）<br />（1）关卡一般情况下，只要角色正常拉（角色打关卡也会有经验和好感，角色的升级材料都可以通过打关卡获得，甚至天启不用通过抽卡也能获得）很少出现卡关的情况，之前玩代号鸢卡关基本能卡我两三天，而玩尘白没有这种现象<br />（2）剧情方面，主线剧情插图插画都是比较不错的，玩游戏不骂美工组，但是很可惜，主线剧情居然没有语音，打主线关卡的时候，都会有角色语音，其次就是主线剧情确实有点让人感到无聊，确实有点推动缓慢了，但是有一些关卡剧情做的还是很不错的，然后就是活动剧情，也确实有大家吐槽的媚宅，但是我认为这次活动剧情简直是太棒了，什么媚宅，尘白这叫坚持自己的本心，以玩家体验为主，尤其是夜天光肴的那部分剧情，或许有点肉麻，但是我喜欢，这才是真正的二次元皇帝<br />玩法方面：综合感觉一般<br />（1）主线玩法没有什么说的，就是打怪射击<br />（2）活动玩法丰富了一些，有点类似于小游戏的趣味关卡，但是还是觉得单一，综合体验一般<br />射击方面体验：在操作设置里面确实能找到陀螺仪，各方面的灵敏度也都可以调，但是狙击枪还是对于手机端玩家不太友好，我和我的手机端朋友都有反应这一点，他比较喜欢玩射击类游戏，但是对于尘白的射击体验，也是感觉一般。<br />建模方面还是可以的，还原度也行，但是角色衣服还是像纸片一样贴上去的，安卡西雅体现的并不明显，夜天光体现就很明显了，但是也没得挑，毕竟已经比（除了米哈游，网易，腾讯，库洛）的游戏建模好一些，但是我好奇，关卡局内的光影是不是有问题，真的有点奇怪啊，尤其是小太阳的战后总结动作就能体现的特别明显，以及建筑物的建模，局内的光影有点暗，尤其是手机配置一般的，就可能会导致手机端有一点糊，反正我就是这样，希望官方优化一下。<br />总结下来，缺点方面就是玩法略微单一，部分手机端画质有点糊，但是是非常值得来体验一下的，之后有电脑肯定会来再次体验，相比于手机端，电脑玩起来会更舒服，我会随时来补充优缺点方面<br />我是女玩家，可能上面说的都会有一点片面，毕竟我是玩法党，还没玩过射击类游戏，像和平精英，三角洲，暗区突围等，因为现在入坑太晚，再加上个人认为这种游戏风气有点差，尤其是和平，与火影忍者、三国杀有的一拼（这几款游戏我都有体验过），所以才入坑了尘白，也清楚尘白是男性向游戏，并无引战意思，但是我想一款游戏能让所有玩家都感到满意，那就应该是没问题的，也希望尘白这款游戏能够越来越好，坚持本心。,58,2025-02-08 10:50,Vivo V2068A
486896911,梦华,3,三星给运营服务，可玩性和画面音乐各扣一颗。<br />全凭这游戏有真正倾听玩家声音的策划，再加上对射击类游戏有兴趣而玩下去的，但游戏的玩法和画面说实话属于下等。希望游戏团队再接再厉，赚够钱开发个尘白禁区2弥补一下画面和玩法这两个遗憾吧,1,2025-02-23 13:06,未提供
632334711,王子,4,怪的打断能力真的是太弱了，Boss都击倒不了角色,,2025-02-23 07:28,荣耀 60 5G
111059657,User111059657,4,四个池子，四种卡，长见识了，两分给美工吧<br />1.6可算是找到赛道了，不枉哥们从开服玩到现在，现在运营也做的很不错，给你加两分吧，然后米氏抽卡再扣一分<br />一直玩到2.5版本了，有了不歪池，加一分，制作组和运营都不错，坚持做服务业，加一分，但2.3爆雷让我再次回忆起1.1的赤石体验，扣一分,3,2023-07-21 21:36,一加手机10 Pro
360632775,鼻世拌饭,4,好坏参半，主线没有配音，角色养成加个角色定位就好了，那个新活动很水，很不好玩，光那个塔防一个关卡就要十几分钟,,2025-02-23 03:05,一加手机Ace 5
633231911,eiszknz,4,买皮肤送不送角色,,2025-02-23 02:26,Vivo IQOO Neo10
452393122,幻,5,💃🏻立绘建模：<br />建模非常精美 每个细节都是可以值得观察的 尤其是各个角色 肤白貌美<br />然后他的玩法就类似于养成和射击的结合体 就有点像在CS go里面打枪战原神,,2025-02-22 22:37,小米Mi 11 Lite 5G
441712088,YA丶76,4,好家伙，这下彻底不想玩了😭之前就是因为安卡CV换了导致退游好久，现在回游发现最喜欢的芬妮CV也换了😵这游戏现在对我而言已经没有任何可留恋的了😫,2,2025-02-22 20:05,OPPO K12 Plus
696749614,xn,5,良心游戏 二游福利天花板<br />剧情从11章开始还算精彩 前十章黑历史了😂<br />💃🏻立绘建模：<br />全女游戏 这方面不用多说<br />🎮操作细节：<br />老年人也能玩,,2025-02-22 19:17,华为 Mate40 Pro
564505755,༒,5,活动有点少，可玩性也有待提升，其他还好,,2025-02-22 16:11,联想L71061
518023001,dong,1,手机玩了大半年，电脑玩了一年半，就两个月没登。你告诉我身份证未绑定，我登不了，那你刚进去的成年验证是什么？,,2025-02-22 15:22,一加手机Ace竞速版
65631242,走神怪,3,💃🏻立绘建模：<br />建模挺好，但是语音很少，游戏模式也很单一<br />🎮操作细节：<br />就那样吧，数值游戏，没什么游戏性,,2025-02-22 13:48,未提供
16245800,储却,5,这年头纯爱后宫+没强度焦虑+玩法轻松+不逼氪还瑟瑟的游戏几乎找不出几个。,,2025-02-22 02:07,OPPO Find X8
583170730,朴氪金,4,零区游戏可以玩几年,,2025-02-21 21:29,OPPO PFGM00
703897553,鳄鱼,4,值得就是好友之间不能一起玩和没有一样,,2025-02-21 20:52,OPPO PFTM20
