用户ID,用户名,评分,评论内容,点赞数,发布时间,设备型号
682987072,jiang,5,💃🏻立绘建模：<br />嘻嘻嘻，好玩<br />🎮操作细节：<br />嘻嘻嘻，非常好玩<br />🔫枪械还原度：<br />还是很好玩<br />🎮可玩性：<br />你就玩儿吧,,2025-04-05 21:59,OPPO PKA110
432598262,灭绝223,5,游戏好玩儿，角色好看，活动也很多(虽然说没有被抽中过)非常推荐😘,,2025-04-05 21:23,Vivo V2057A
696787482,好运的达人,1,社区管不了正常，游戏频道就不管一下吗，天天都是串子来反串一点措施都没有吗，你开个直播暗区都来了也不管一下吗，作用呢,,2025-04-05 20:56,一加手机Ace 3 Pro
536647424,赫卡特,5,😋看到我评论的兄弟们，今天八点前瞻直播,3,2025-04-03 23:48,OPPO A92s
687330787,泪冠哀歌,5,满分，真正的服务员,,2025-04-05 20:19,iQOO Neo 5 活力版
563803988,忧郁高少,5,非常舒服，任务建模其人物建模和美术表现较为出色，服装设计复杂精细，但在渲染上存在平衡问题，导致部分角度人物观感不佳[^0^]。玩法上，作为TPS游戏有较大拓展空间，但现有玩法较为单一，联机玩法缺乏新鲜感[^1^]。剧情方面，前期较为平淡，活动剧情稍有亮点，但整体印象不深[^2^]。养成模式借鉴了成熟模式，但数值策划在养成数值上存在不合理之处[^3^]。此外，游戏存在较多bug，影响体验[^4^]。总体而言，游戏潜力较大，但需要进一步完善优化。,,2025-04-05 19:14,OPPO PGGM10
1385665,避嚣习静,4,多出点能联机的娱乐玩法  目前可玩性还是不高,,2025-04-05 17:12,Vivo IQOO 13
494768947,神宁,1,我就退游几个月给我号弄没了？找不回来了,,2025-04-05 11:50,未提供
322122934,ご沉默菋噵ご,3,烧退后要重新加载资源是什么情况😡加载很长时间,,2025-04-05 08:35,华为 Mate40 Pro
9111625,手机用户9111625,3,游戏处处肉眼可见的粗糙，包括但不限于UI、游戏内场景、敌方建模等等。去年出过几次大节奏也都被狸花猫救回来了，没有强度焦虑再加上有不歪池好评。主要的消费大头还是角色皮肤，但渲染又差点意思。目前除了涩度爆表可玩性还是太低了，每期活动基本都是老几样，重复度极强。,,2025-04-05 02:35,Redmi Note 12 Turbo
640614582,Y.mean,5,很不错，玩了挺长时间的，剧情用心，玩法也很有趣，十分推荐,,2025-04-05 01:33,iQOO 9
421149049,花火同学,1,本来兴冲冲想入坑，结果打到 2-6 出现了恶性 bug，无法通关，网上一搜，这 bug 2 月份就出现了，这么长时间过去都没修，那这开发团队不能要了，再见，直接删除游戏，西山居你是活该手游做一个凉一个。,1,2025-04-05 00:46,未提供
39132312,一条懒狗,5,官方要是能重置一下某些角色的好感剧情就好了，以及基建语音（今天进肴宿舍，听到那句“聊天也算加班哦”感觉有点生分，虽然清楚是人设，但毕竟剧情里都结婚了）,,2025-04-04 23:16,Blackshark SHARK KSR-A0
699956464,贝利亚大王,5,这款游戏全是女皮肤<br />没有考虑到成都人差评,4,2025-04-04 18:58,华为 nova 6 5G
425026937,维他命,5,省时间的附游，新手可以氪点，有俩c后直接毕业躺平，氪金点只剩偶尔买买皮肤,1,2025-04-04 18:37,未提供
537727009,。。。,5,可以,,2025-03-07 00:31,Vivo IQOO Neo10
635345213,西柚,1,不重氪的话体验感很差，真的，后期基本没啥资源，没什么可玩性。慎入，这游戏大明白太多了，一堆洗的。没啥操作就是开枪。,,2025-04-04 15:42,未提供
674846885,夏夜拌醉梦,5,话说我听说这个游戏公司就是这个西山居，是雷军投资过的是真的还是假的？,,2025-04-04 12:28,红米K70E
367000327,gsnoir,5,男性向，服务明确。,,2025-04-04 12:23,Vivo S16e
608772550,sjskss,5,为什么我更新了手机系统后进游戏很慢还很卡，之前都挺流畅的,,2025-04-04 11:12,小米Xiaomi 14 Pro
62533175,看（？）,5,遇到黑二创，造谣，节奏一定要工单你不工单上面的人永远不知道，发生了什么,13,2025-01-25 11:49,未提供
56615637,...,5,好玩每天上线两分钟，不占用其它的游戏时间，喜欢中式婚服，期待策划多出中国风的人物皮肤，已经入坑3个月了，目前91级。<br />副游，有的活动刚开始十分坐牢，消耗大量时间，给蚊子腿的奖励，比如蜃梦怪谈这活动第一次出的时候，最快一把都要10多分钟，一般15分钟一把，消耗了我大量的耐心与精力😤，但是，最近的一个版本，策划优化了这个活动，大大节约了玩家在这个活动上的游戏时间，提升了玩家的游戏体验，确实有让我爽到了😝<br />总结：策划是能听取并积极改进游戏内容，提升玩家游戏体验的。<br />我总感觉晨星E技能被砍了一刀，没有过年那段时间用起来流畅了，E起来卡卡的😨,5,2025-04-04 05:50,Vivo IQOO Neo9 Pro
534263160,动物园魔法师,5,这游戏真是我最近玩得最上头的一款。刚开始被朋友安利进来，还以为是那种普通的“老婆收集游戏”，结果真玩起来发现不仅能收老婆，老婆还一个比一个能打，关键是还能操作出花来！<br />像佐助那种操作手感，拉扯感、技能的连贯性，真的是有手就能玩的那种吗？不，完全不是！那是得练，不练一天都不好意思上场的那种！我在训练营练双刀卡时机练得脑壳痛，但一旦成型，那感觉是真的帅，输出直接爆炸。<br />游戏剧情的话一开始确实有点懵逼，说实话我前面那几章全跳了，看得我跟不上节奏，感觉分析员跟角色感情发展就像“今天刚见面，明天就结婚”那种，啥过程都没。但从十一章之后剧情就不一样了，像14章，我真觉得自己是在看轻小说，感情线写得细腻，演出也很顶，甚至让我感觉“哎呀，我是不是后宫文男主”。<br />角色剧情也有高低起伏，有些像新出的恩雅就写得挺细的，老角色的就有点赶场的意思，不过整体还是能看。Live2D和演出细节是真加分，能看出来制作组是认真搞这个剧情氛围的，不是随便糊弄。<br />画质这块就很微妙。PC上是真的帅，老婆脸一个比一个好看，皮肤画质细节拉满，建模也是精细得不行。说到福利，那是真的香。我现在坚持每天上线做任务，月卡也氪了一张，角色基本都能慢慢拿齐。活动送的抽卡券也不少，运气好的话都能白嫖老婆，前阵子我还抽到了限定角色，心情直接爆棚！<br />再说客服，效率真的是神速。有一次我漏领了某个补偿，去提了个工单，本来想着得等两天，结果中午提交的，晚上就到账了，真就理个发的时间都没用完，操作一气呵成。<br />整体来说，这游戏有点冷门，但真的值得更多人入坑，剧情做好了、角色香、福利还行，操作系统也不是纯无脑的那种，愿意花时间练的玩家能打出很高的上限。如果能早点优化移动端，剧情前期节奏理顺一下，那我估计就不是“只氪月卡”，是真的会为老婆“倾家荡产”那种了！,14,2025-04-03 16:35,未提供
122063472,Halo.清涟暮雨,5,🎮操作细节：<br />很适合我的操作手感,,2025-04-03 13:01,华为MediaPad T2 8.0 Pro
567121344,覆雪之下,5,这游戏氪金吗？,,2025-04-03 09:17,Vivo V2072A
634641648,迷失,5,🎮操作细节。初玩时会感到枪有点不好控，后来已经人枪合一了<br />💃🏻立绘建模：尤物,,2025-04-03 01:01,Vivo IQOO Z9
710916705,冰影,5,🎮操作细节：<br />感觉操作上设置非常好，不仅有剧情，而且还可以一起进行射击，动作感觉非常炫酷,,2025-04-02 21:29,Vivo V2156A
52394536,雾烟,5,玩法还是差点事<br />—————————<br />现在感觉都挺不错的了。<br />🔖运营服务：<br />非常好,2,2024-05-07 07:51,Honor X50i 
452438049,宝,5,可以,1,2024-04-29 20:42,OPPO Pad 3 Pro
67447069,音音了,2,体力少，养角色困难，还卡角色等级，我记得好像是第八章，还是第几章来着，一个有雪的地图，给试用的角色弱得像史还不能换，活动福利挺好的，日常福利就不怎么样了，因为大部分都需要练度，但是养成困难，所以前期就不要想了，“不要有强度焦虑”是我听过最S13的一句话，而且只要你去问新手应该抽什么角色，大部分玩家都会对你说这句话，等你主线卡着过不去，看你焦不焦虑就完事了，而且打到后期你必须得带一个奶妈，不然的都怪多的时候，你一下能秒他们，他们一下也能秒你，而且一个养成困难的游戏，竟然连资源回收都没有，而且有类似圣遗物词条的装备，词条全随机的,1,2025-04-02 02:27,华为GOA-AL80
647623005,椰羊,3,要爆死认清楚自己位置和受众转变色色的代表，也是难得走通的几个，这也是他几乎全部的优点了，剧情还行吧演出挺一般的比较作坊不大指望高质量演出不可能时间也是，二游虽然要卖相好看要人设要剧情但是也不能说完全不能玩，这游戏问题就在这没啥意思玩起来很无聊。,,2025-04-01 22:57,Vivo IQOO 13
346952159,让我再A你一下,2,皮肤互动和宿舍确实很好，这个没得黑。但我想说一下，<br />1.抽卡体验太差了，虽然尘白抽一只就行，但我新年入坑开始，抽了3角色，一个87，一个100大保底，这次又给我干到90了还没出(叠甲:我都攒十连的，没单抽），体验感太差了，千分之一的概率我就笑了，抽那么多啥都没，就只能最后出一金，太折磨了。不是标榜着不卖卡么，那你干脆减少产出，改70保底必出行不行？<br />2.联机掉线的bug也是，都一个多月了，还没修，时不时掉线，要退出重登才能联，这个bug这么困难么？那麻烦把联机从任务中删掉好不好<br />很遗憾，我卸载了，矿都懒得挖，不想被折磨，再见。,3,2025-04-01 21:13,红米 K70
708435277,557268,2,移动端不能修改分辨率，屏幕越大越糊，平板都糊成马赛克了。,5,2025-03-31 01:45,iQOO 9
705188792,刘逍遥,4,还不错 好玩  有木有一起玩的,1,2025-04-01 10:34,iPhone 15 Pro Max
639264367,hkYM,3,💃🏻立绘建模：<br />退坑了，玩了好久还是不玩了，以前还是挺期待越更越好，现在越更越差，新角色也差点意思,,2025-04-01 10:17,Huawei Nova 11
699734940,该账号已注销成功,5,游戏是好游戏，就是每次的活动重复度100%😂,4,2025-03-30 22:00,未提供
39089270,HoShiNo,5,讲实话，真的可以，我玩的端游，剧情方面还行，操作方面也丝滑，刚玩三天就拿下99抽然后抽到了当期up之一，主线关卡难度还可以，也不是很肝，总体来说还是不错的,2,2025-03-30 17:55,未提供
513977840,布响丸辣,2,好样的这歪率，开个新号角色三连歪，武器也歪下次麻烦把歪率写明白点，别写50%了怪假的,1,2025-03-30 15:03,小米Xiaomi 14
5313633,摸鱼池棠,2,PC玩的游戏性能没问题没卡顿掉线等情况，画质就双端的水平了。建模立绘没抽到几个不太清楚。<br />新手福利差到无话可说。7日任务给一把冰狙你好歹给个老橙武自选呢😓<br />至北初星这个系列7日任务加起来凑不到20抽还是锁天数解锁的。<br />14日签到加起来才10抽还是普通池子一堆时代眼泪橙。说到这个我有3老橙卡推图挺累去看了下攻略视频，一堆下水道被UP一笔带过怎么配装都懒得提负反馈拉满了。新手期没有自选池子这种让萌新抽一两个推图轻松点的。<br />指挥速升也就给一些角色武器升级材料。还不如闲情逸致送的那些好感度相关的资源呢。<br />花钱赶进度我也乐意但商场太良心了嘛没新手相关的礼包啊。就一个当期的特殊池子包。<br />就这样了新手福利太差不论后期体验如何我都玩不到后期了。福利好的游戏那么多为什么要牢你这个。<br />两星给人物立绘和人物剧情了，作为游戏很耐看但不好玩挺难评价的。😓,3,2025-03-30 11:22,未提供
684365004,？。。。,1,你这buff赶紧给老子修了。,1,2025-03-30 09:33,Vivo IQOO Neo9S Pro
777457,月灯り,1,二测有点无聊，完成度不高，体验了一下丢技能就完事了，没啥tps的感觉，不能翻越和躲掩体。没测完就卸载了，看看下次测试如何。百分制暂定60分<br />防云图<br />更新<br />没啥好说的，祝大麦,5,2022-04-28 13:46,HONOR PTP-AN10
43536611,阿巴啊吧,3,考察期中,9,2024-04-14 19:05,Vivo IQOO Neo7
689094402,莱芜（游戏号）,3,加载时间太长，整整两个小时没进去,,2025-03-29 23:40,华为畅享10s
591105798,001,4,谁知道第二章的，第六关还是第九关，怎么过，护盾根本打不掉,,2025-03-29 23:09,OPPO PFGM00
438366191,Jay,5,二游中的清流，入就对了😋😋😋,2,2025-03-29 22:30,未提供
481083509,再见凤源,5,神中的神，无敌中的无敌，美丽中的美丽，最良心的运营，最色气的角色！二游中的运营天花板，王中的王,,2025-03-29 22:05,Realme真我13 Pro
710569708,手机上_不是_世界手机版宿舍,1,我可以直接玩黄游为什么好要用脑子玩尘白禁区😂,1,2025-03-29 20:09,HONOR JDY-AN00
497522213,一介代号而已,5,可以的，非常好游戏，令我改观,1,2024-01-11 05:40,Honor X10 Max
54199261,           ,5,很不错的游戏，不肝不氪能全角色还是很不错的,2,2025-03-29 08:52,未提供
444254185,⺗灬,4,好玩，就是没人带我玩😚,,2025-03-29 08:49,Vivo IQOO Pad Air
709294321,楼上的老张,5,游戏内容还好，音画制作估计是下功夫制作了，挺不错的。<br />再者就是抽卡机制，跟别的大差不差，爆率还是合理的。<br />要说缺点，就是服装设计的太漂亮钱包扛不住。<br />（日常生活里的过场动画尤其是浴池那里为什么要给角色强制穿衣服，这一点强烈反应一下。）,14,2025-03-29 03:49,未提供
28790979,白鹤诺曼,5,这里是二游的最后一片净土，欢迎来到尘白禁区的世界各位分析员,3,2025-03-28 13:12,HONOR 100 Pro
16274501,ThankJack,5,不恶心玩家，不整阴湿操作的运营已经不多了。<br />涩涩也是满分，确实让人找回玩二游的意义了。<br />不过移动端操作确实僵硬，爽完还是要电脑。,1,2025-03-28 07:32,未提供
59334080,PRC红与蓝,1,又是在卡池里打水漂的一天。,1,2025-03-28 00:51,HONOR Magic6 Pro
38045031,Nevena,5,什么神仙运营啊！爱你们！回归了！,6,2025-03-27 16:23,小米24117RK2CC
691690468,光影逐风,5,虽然游戏性和前十章剧情不太理想，但是人物建模 后期剧情 游戏福利之类的都是拉满的。1.抽卡想体验抽卡的意义有米池，不想体验抽卡意义的也有不歪池。2.角色天启（可以认为是星级或者命座）可以每日免费获得，满命不是梦。3.游戏没有强度焦虑，T0玩家只会为了一星期的特效去凹。4.抽卡资源基本能满足每个版本一个新角色，另外一个版本双新角色up会免费送一个。5.官方听劝，工单必回复。,7,2025-03-27 10:47,HONOR PTP-AN10
346366932,忧郁的风,1,都开服多久了，闪退的问题都解决不了,,2025-03-26 15:56,Vivo Y77
687368717,二十三木,4,除了没游戏性其他都好,1,2025-03-26 12:49,Redmi Note 10 Pro
602276422,北风予南笙,4,可以丰富玩法,,2025-03-26 12:41,OPPO A72
451356152,彭很帅的哇,5,游戏官方不出问题的话，有女朋友前我一直玩,,2025-03-26 00:53,Vivo V2162A
12485855,DDDDDecade,5,狸花猫不在了，走好不送<br />哈哈回来了,5,2024-11-08 12:59,Redmi K70 Ultra
631590789,114514,5,🎮操作细节：<br />操作真滴C，很喜欢这种的半第三视角射击游戏，还能换兵种，移动举镜射击做的都很好<br />🔫枪械还原度：<br />这个倒是不怎么觉得还原度高，但毕竟自己有一套剧情的就看建模好了<br />🎮可玩性：<br />可玩性是挺高的就是我手机配置问题，半小时50％的电，但是综合她的画面音乐建模剧情什么的感觉还是很不错的<br />🌃画面音乐：<br />画面高清度很高，音乐没听到<br />💃🏻立绘建模：<br />立绘建模也是很用心去做的，做的也是很好的,8,2025-03-25 21:47,三星Galaxy S9+
708910064,范海辛,5,情绪价值拉满，如果老婆们的脸能再写实点就更好了。,,2025-03-25 21:04,iQOO Neo 5
21769611,金猴奋起千钧棒,5,可玩性类似三国无双，就一个字爽，三个字战斗爽，割草，持续不断的割草，枪战能玩出割草的快乐<br />建模精度极高，全是细节<br />有live2d+galgame式剧情演出，前十章剧情直接跳过，后面几章越来越有看头可以认真看，音乐神中神<br />运营服务非常好，制作团队不唯利是图<br />玩家社区非常和谐，玩家的认知不低，一群男人聚集在一起其乐融融的氛围，没有强度焦虑，都是认真讨论游戏和二创的玩家，一个网络游戏社区氛围能接近单机游戏社区的氛围真的很逆天,9,2025-03-25 10:00,华为Mate40 RS保时捷版
44444242,生命$,5,官方听从玩家的意见。说改就改。抽卡纸抽人物每版本都溢出资源。这不比某些看别人脸色的游戏强。这里有你喜欢的美少女。还不快跟我一起玩<br />💃🏻立绘建模：<br />在同类游戏中也是数一数二的<br />🧝🏻‍♀️角色人设：只喜欢分析员（就是玩家）一个人。,1,2025-03-25 01:47,华为 Mate40 Pro
506095095,米斯林魅力时刻,2,手机端联机bug怎么还不修?今天联机匹配五次，四把掉线显示重连提示进不去，整的人很红温。,2,2025-03-25 00:32,OPPO Reno12
380446120,汐希ξฅ۶•ﻌ•♡,1,为什么会一直闪退,,2025-03-24 17:20,Vivo Y77
672133683,淳于晚瑜,4,立绘建模拉满要不是国家队拉卡着绝对吸引你的眼球，我最喜欢的一点是这个游戏不肝，当然强度党除外，专心囤老婆就是了。关卡方面完全不用担心，完全不肝也少不了多少资源的。任务方面每天点几下，没有打卡时间的任务轻松自由，这点非常人性化，不会出现你上完班还要在游戏这上班打卡的感觉。😁,,2025-03-24 14:00,荣耀 50 SE
17844376,手机用户17844376,4,这游戏前期可玩性很高，但是到后期伙伴岛也做完了，就没什么可玩性了，望出更多新模式，新玩法增加后期玩家可玩性。,8,2025-03-10 05:25, iQOO 11 Pro
638468959,にょたいか,1,这周周本太恶心了，被控到死，这就是神吗，我跪了,1,2025-03-24 02:12,OPPO A9中国版
12524846,迷茫的豌豆,5,100级老登评论<br />💃🏻立绘建模：<br />十分完美，各有各的特色，皮肤十分带劲。<br />🧝🏻‍♀️角色人设：<br />饱满，而且每个角色对主角都有特殊的感情<br />🎮可玩性：<br />游戏玩法需改进,2,2024-07-15 00:34,Vivo IQOO Neo10
699612647,凄你美地,3,感觉新手福利不太够,,2025-03-23 16:23,Vivo V2426A
67361704,愚,5,现在来说可以是一款非常好的玩戏了，但玩法上还是欠缺<br />💃🏻立绘建模：<br />满分建模,2,2023-07-20 13:37,Vivo IQOO Neo9
699041350,从头再来,5,我真的超级喜欢尘白😍😍😍，以上包括星级由我主观推荐，不重要。<br />以下是我的理性评价：<br />剧情方面、<br />个人剧情：各个角色的个人剧情，质量参差不齐，具体在配音，剧情细节，前因后果等。比如最新出的恩雅-澜风，对比最初角色恩雅的个人剧情，简直不像一个游戏的。个人剧情方面，我觉得可以适当的再长一些，表达的再详细一点，让玩家充分感受到这个角色和我（分析员）的情感发展。<br />主线剧情：主线剧情，从极夜行动这一章开始，慢慢变好，但是前面的剧情可以说是不怎么好；前面的剧情不好的地方在于，情感表达方面。我（分析员）和各个角色的互动，显得生硬，感情没有一种水到渠成的感觉，好像是突然从认识就到了结婚，（热恋期）中间这一段一笔带过。<br />但是从极夜行动开始，感情表达方面就慢慢变得水到渠成，不再那么生硬了，特别是第14章，有一种看后宫文的感觉，非常不错。<br />而且前面的剧情有点乱，不是很清晰。<br />个人好感度剧情：由于我的人物好感度没有拉满，剧情的话看的没有多少，但从已知的来看，还是不错的，但是还不够。<br />剧情方面总结：一些不怎么好的剧情，有一个共同的痛点，那就是急，感觉就像是篇幅有限，不得不省略某些不重要（重要）的，导致产生割裂感。                   就是故事情节的推进，和玩家与角色的剧情互动兼容性太差，推动了故事发展，却不能顾及玩家与角色的剧情互动。<br />我希望官方能注重剧情这方面的制作，做好了也能作为这个游戏的一大亮点，不是吗？当然必要的时候，主线剧情也可以适当的收费。比如说做一个提前看（玩），就是最新剧情需要收费，而旧的剧情不需要。当然这必然伴随着更大的压力，做不好肯定要被骂，这也是一场机遇与挑战。看官方的选择。,18,2025-03-23 13:55,小米24117RK2CC
344169693,刘轩轩,4,目前是67级，不怎么玩，但是作为一名新手，我只能说虽然剧情前面十章比较乏味，但从第十一章开始质量就上来了，可能是我没吃过细糠吧，从后面我就觉得很神中神的感觉了，角色数值控制的也还算好吧，一些老角色到现在还能打，一些角色的战斗机制也很好，一种非常新颖的感觉，这游戏要充钱的地方可能也就是体力或者皮肤吧，体力虽然说新手比给的比较多，但是大部分都是不能存很久的，有个时间限制，算是这游戏美中不足中的一点吧，然后到中期体力基本上就不够用了，皮肤质量呢也很好，让我觉得值得入手，角色人设也很饱满，大部分战斗都是不吃操作的，对于我这种手残党来说很友好，再谈谈建模吧，现在的建模还有渲染，很好啊，但是我了解了一下以前的只能说是一言难尽，只能说现在我们的游戏正在蒸蒸日上，游戏比较冷门，可能是前期的运营导致的这个结果，但也是恰恰冷门造就这个游戏，社区环境也很好，起码没有那么多狗叫，这么说可能让别人觉得我是小众哥，有点壮。游戏活动也还算行，只希望游戏越来越好吧，体力稍微提一提吧，体力时间限制，改一下吧，我一般玩游戏是不给游戏打评分的，但是这个我必须得给，虽然离完美就差一点了,8,2025-03-23 10:30,Redmi Note 10 Pro
98504182,火神,5,开局因为芬妮皮肤立绘的玉足直接氪了六块，然后玩了没几天感觉无聊就卸载了，服了，这游戏是不是玩到中期才好玩？想要涩涩要不要到中期,1,2025-03-23 00:48,Vivo IQOO Neo8 Pro
628476505,慧,4,已经一百级了，来说说我的游戏体验。<br />💃🏻立绘建模：<br />做的在二次元游戏里算好的了每个角色都有自己的特征，钱都花在买皮肤上了，如果不充钱也是有几个角色值得入手的，就好比这最新角色<br />🎮操作细节：<br />自我感觉在操作上没有多好，射击体验也不好，全都是数值怪，毕竟咱不是来玩这个的就不多谈了。<br />🎮可玩性：<br />这款游戏适合休闲的时候玩，不适合主玩，很容易腻作为副玩还是强烈推荐的。<br />✍🏻建议：<br />角色动作做的太少了希望多做点，就比如跳舞和攀爬的，就更能体现皮肤的价值。<br />新星开阔空气墙太多了，就挺希望加个攀爬然后那都能去，而且新地图景色还可以做得更好，这样才有欲望探索。,4,2025-03-22 22:24, iQOO Neo7 SE
