用户ID,用户名,评分,评论内容,点赞数,发布时间,设备型号
389601901,User389601901,1,新活动纯浪费时间,5,2025-01-24 14:50,Vivo IQOO Neo9
349697277,User349697277,3,新出的琼弦0+1一个大招够我上版本的T0 3+1水凯打2分钟的 平衡太烂 就这样吧,1,2025-01-24 13:15,未提供
378317244,闲余,4,遥遥领先其它二游<br />把渲染画质帧率提一提,6,2024-07-05 01:18,Vivo IQOO 12
430759595,幻梦三千,5,新剧情难崩，听说木木被换了，打差评。<br />因为凯西娅，所以给五星。<br />无话可说，无敌<br />红包封面1s无，尘友们逆天了啊😂,10,2023-10-02 16:11,华为 Nova 8 Pro
1972507,Crystalblue.八云,4,玩了弃坑弃坑再玩。<br />尘白黑历史其实没啥好提的。愿意看的也有赛博史官总结。<br />但是尘白他愿意改。<br />这是隔壁雨中比不上的。<br />（挠头）但是我玩不下去。没啥可玩的。上线晃一晃，点一点看板娘看一看汝窑这就是最关键的内容了。日常减负随便扫荡下就能完成。周任务要花点时间打一下。<br />一周年的花嫁其实是准备买的。无限之视的角色和武器都抽到了。然后犹豫了一晚上。买了第一后裔的两个女仆皮肤（兔子和水妹的）。<br />如果说战双对我来说是月更小说，交错战区对我来说是铯铯加收菜的盆栽游戏。我不清楚我玩尘白是为了什么。或者说尘白对我的吸引点是什么。<br />就拿前两天的“和谐”节奏来说。其实我也不在意尘白到底是自宫，还是大手，亦或者友商针对。节奏真真假假，官方也不敢明说。这波运营下来，尘白是赢麻了。但是让我更加摇摆了。我只需要拿下花嫁皮肤或者任意商店月卡皮肤，应该就能白领一个自选s角色“福利”补偿（啊，是的，不氪金不能领这个“福利”），箱子我可以开一个蓝闪，蓝闪专武我也有。但是不知道为什么我犹豫了。我觉得不值。所以我氪其他游戏去了。<br />有人说:别的游戏可能两年，三年，甚至七年才能完成的女角色陪伴然后才出花嫁，完成感情戏。尘白开服暴雷，滑轨半年，一周年立马花嫁皮肤收割，剧情真空，结果玩家还得谢谢他，不觉得搞笑吗？<br />我只能说:你可能懂二游，但是你不懂麻辣。快餐式加速收割资本那是必然的。麻辣只是路径之一罢了。<br />当然并不是说尘白哪里不好。可能只是电波对不上。<br />我之前总和群友说。少女前线2做成尘白这种操控类型的，然后滑轨的及时点。我可能就玩了。隔壁那游戏战棋模式我是挺难绷的。<br />只能说各自有命，人生精彩。<br />这里祝尘白越来越好，尘白玩家各个单抽出货吧。<br />我撤了。,5,2024-09-02 15:31,Nubia NX712J
3788544,艾雅法拉,5,赌米池又歪了，一定是三国杀干的！！我要去给三国杀打差评😡😡😡,22,2024-07-29 18:20,小米Xiaomi 14 Ultra
698417245,小急狐,5,不错不错，官方是知道我们喜欢什么的😆,1,2025-01-24 11:17,OPPO Reno12
568663029,就比较麻烦了,5,官方会听取玩家意见，新的剧情也非常有意思，主要是不肝，希望尘白禁区越来越好,1,2025-01-24 11:09,Vivo IQOO Neo8
9821103,唐老鸭,5,真的是射击游戏😍😍，🐍的不行了,2,2025-01-24 09:52,Vivo IQOO 13
645907598,月圆,5,虽说大部分剧情没有配音，但其战斗环节和人物塑造情节可谓引人入胜，体验感很好。,2,2025-01-24 08:56,Redmi Note 12T Pro
583295094,无胜之洲,5,为什么我抽那个活动的时候，为什么会有未中奖呀？,1,2025-01-24 08:54,华为 Nova 5 Pro
649134935,维罗妮卡,4,昨天更新之后，联机玩不了了，一直提示是否重新连接游戏，怎么回事啊,2,2025-01-24 07:53,RealmeGT Neo5
590652049,人偶公,4,游戏官方态度可以，游戏偏单调，角色基本等于直接送，不过原皮一般，皮肤只有直售，送的一般感兴趣可以玩玩,1,2025-01-24 07:43,Vivo IQOO Neo7竞速版
61535195,手机用户61535195,5,这个游戏甚至都可以不氪金。就算氪金了，也只是买皮肤。别的买不买问题都不大的。而且还可以进基地和老婆们互动，现在新版本还有温泉可以和老婆们一起泡澡，泳池水弹的玩法和恶魔转盘一模一样。,2,2025-01-24 06:45,Honor X50 
698941520,不知道,5,没得说，二游圈的净土，老婆们都爱你，你是主角而不是摄像头,4,2025-01-24 02:54,Honor 90
3383527,无人海域,5,好多老熟人的评论啊🤣点进主页一看“最多互动”“二次元最爱”怎么都是熟的不能再熟的,2,2025-01-24 02:18,Realme真我GT6
8546056,Kitorin,5,2024.11.24<br />伊切尔版本入坑的，之后的每一场突击直播也都看了，服务确实到位嗷，能听进玩家尖锐的声音。<br />美中不足的是玩法，缺一个能让玩家常驻的玩法。<br />其实比起将重心放在配音，lhm更需要把产能放在玩法的开发上。在不重置前10章剧情内容的情况下，等级高的玩家应该不太会特地回到前面重新听一遍配音，入坑的新玩家也对尘白前10章剧情有所耳闻，选择跳过人生（）。不如在后续的新版本的剧情中增加全配音。<br />期待lhm会在之后带来更好的体验。<br />2025.1.24<br />刚刚打完春节版本的剧情，正好时隔2个月回来修改一下评分和评价:<br />给我玩爽了。,27,2024-11-21 11:29,小米Xiaomi 14
434956087,清梦压星河,5,一个字好，有点难受的是皮肤只能现金买不能通过累计月卡什么的购买，但也能理解，这次攒了不少抽，角色和婚皮一举拿下😘,1,2025-01-23 23:29,Redmi K60
549571044,心海,4,看到说要送自选就入坑了 今天更新完发现说28号才送光速退坑 新手没角色操作手感真的巨史,4,2025-01-23 23:03,未提供
102635418,日月为明,5,都得给我玩<br />你永远可以忍受市面上二次元手游的🔨福利和质量，直到你玩了尘白禁区。<br />就是说，就是所有有名字的NPC，包括游戏策划，官方，周边，都在围着你转，你就是唯一的主人公，你明白吗？你知道这是什么感觉吗？你提的工单每一份都会直达天听，你试过吗？<br />你可以来试试。相信我。,2,2025-01-23 23:00,HONOR PTP-AN70
529288904,施施施,1,太好玩了，新版本更新优化资源，更新半个小时才一半，不小心退出去了又重新更新，太好玩了,6,2024-09-06 22:00,小米2312CRAD3C
651978622,空冥,5,满分，有一个听劝的厂商就值满分了。<br />厂商挣得钱用来提升游戏产能<br />从最初劣质手办风到如今的精致画质，新版本添加的主线全语音。<br />独特且丰富的宿舍内容。<br />我能看到lhm把玩家的钱用来提升游戏产能，而不是把玩家当做韭菜，足以让我给这款游戏满分。,33,2025-01-23 22:31,iQOO Neo 5
478825754,Отказано,5,我打完第二章之后不让我玩了是怎么回事？,2,2025-01-23 21:15,OPPO A35
418847867,沉默，那笑容,5,希望官方能看得到，封面既然做了互动场景，但角色的语音呢？我希望能添加一下。,1,2025-01-23 21:11,Huawei Mate 50
3085079,兵 戈,5,搞得不错现在比开服时期强多了,4,2022-04-16 19:30,红米 K70
586749550,wwe,1,翻越键跳跃键离奇消失，走不到如何开启跳跃翻跃键,2,2025-01-23 20:59,Tianyi TYH632M
670132510,烟花,5,想玩尘白的建议也玩玩深空之眼。上线一分钟的事。<br />无意拉踩，两个都很喜欢😘,1,2025-01-23 20:52,Redmi K50 Ultra
640899114,二重構造 儚い,5,这婚得太爽啦,2,2025-01-23 20:46,未提供
98880863,云祁倾,5,喜欢老阿姨，孩子们这里是老婆党的天堂😋,6,2025-01-23 20:42,HUAWEI Mate 40 Pro
5956366,旧梦~初醒○—の,1,小游戏又臭又长，还没有快进,4,2025-01-23 20:38,未提供
591473374,大型作文,2,我的设备是可以把画质全开到最高的，不知道为什么一进游戏画质特别糊，我已经把渲染精度和抗锯齿拉到最高了,4,2025-01-23 20:33,未提供
16072625,元子,5,好玩护肝补逼氪，你兄弟一定喜欢玩,4,2025-01-23 19:36,小米MI 8
33448091,加菲是头熊胖子,1,不懂，回归之后邮箱里的东西都领了，又都消失了，什么意思？,3,2025-01-23 19:03,小米Mi 10
410835045,じ浅夏ゞ初雨,5,建议使用处理器高一些的，不然会卡的，但是游戏体验还是非常的满意的，值得玩😋😋,3,2025-01-23 18:38,Vivo X200 Pro卫星通信版
466581270,凯,5,非常好玩建模好看,1,2025-01-23 18:05,未提供
108732858,抬头仰望满天星河,1,卸了，上次抽完又多抽几抽，抽错了池子了，50%池子今天你给我160抽出，你也太好了吧,4,2025-01-23 17:49,小米 15 Pro
68586150,D,5,麻辣火锅好吃捏<br />我怎么进会员制餐厅了？<br />这事你们今天不开个直播要死的<br />原来是呆瓜😓。直播时问题也都说了 希望是真吸取教训了,7,2024-11-07 17:13,Redmi K60
10323688,庆少,3,这个谁能拿到的到啊 ，，，不送个十连我不删😂😂<br />🎮操作细节：操作不了一点,6,2025-01-23 17:12,未提供
73403354,香草龙舌兰,5,沉迷澡堂，无法自拔😎,3,2024-04-27 22:56,红米 K70
498735357,我这人心善。,4,就28号登录。之后6号把任务肝一下。某些玩家尘白禁区春节版本,1,2025-01-23 15:59,Realme X7 5G
439926753,愿羽不遇小雅,5,挺好的游戏，但我碎了……,1,2025-01-23 15:57,Huawei Enjoy 20 Pro 5G
2044041,(ᇂ_ᇂ|||),4,80抽捞到小小老师<br />小小老师的pv做的很有趣。服务态度没的说，情绪价值给的太足了。游戏质量在稳步提升，希望越来越好。<br />不是哥们，得亏我昨天没看剧情，你怎么整了个大活啊?<br />这大蜈蚣boss做的真是一坨啊，智能瞄准克星。<br />重做的剧情也只能说及格，可能是因为我对小老师不怎么感兴趣。<br />卜卜活动的琴诺皮肤很不错。<br />还是需要换血，枪战pve题材的二游实在是太吃亏了，不能挂自动，游戏性再一般光靠瑟瑟感觉长久不了。被NIKKE全方位爆杀啊😔，希望能汲取一些nikke的长处，nikke这次圣诞活动写的很不错。<br />你游又经历了cv大更换，河蟹和这次极其严重的内部失误，可以说刚有起色又负重伤。改成全女npc太极端了，内部问题不清理照样出节奏，要不就干脆改成主要反派变成泰伦虫族或者莱彻那样的无性敌人，全女npc太抽象了。<br />需要走出自己的路，在国内搞瑟瑟不够长远，得找到自己的赛道。<br />游玩起来倒是没什么压力，角色几乎白送，给玩家让利，我这零氪玩的蛮舒服的，就是不知道氪佬们玩的咋样，感觉除了皮肤之外没啥可买的。<br />还是有很多可以改进的地方的。<br />90抽捞出来卜卜<br />确实可以从NIKKE那吸取一下优点，1.5和二周年剧情，今年圣诞和界拉毗的剧情相当不错。牢芬的配音也换了😟明显不如以前的了。天呐，听的越多越绷不住，牢芬的新配音太拉了，赶紧多提升水平，磨合磨合吧。模仿原版指定是不行了，让她走自己的路吧。<br />唉，外芙的配音也换了。<br />不过我还是愿意给你机会的，因为这个二创BV1FZCeY5Ewn，希望你能成为大雪后的第一株绿芽吧，快快长大。<br />干!90才捞出来晨星,23,2024-11-07 19:18,Vivo S18
556973990,半疯狂客,5,2.3版本入坑的小登，到2.4结束已经主线过完开始长草了。<br />个人感觉的优点：剧情不雷，里面的天启者都喜欢爷感觉很爽（而且是很自然的，没看到什么降智情节），建模很漂亮也很清凉（懂得都懂），清体力还能速战，不用一遍遍刷。最主要是福利拉满，比如2.5送一个夜天光，还能自选一个1.8以前的限五，还能自选一个2.1以前的限五来抽。本来2.3尘白道歉信给的自选限五不小心选了强度不高的云篆，但在我的猛肝下外芙+大猫+水凯都有了。下版本直接拿个苔丝+婚芬爽到起飞。作为某款角色能500天不复刻的二字游戏玩家，都给我整不习惯了。<br />个人感觉的缺点：平时可玩的内容还是太少，重复性太强。悖论迷宫目前没有打的欲望，新星开拓也很烦。每次把体力清完之后就没啥可干的了,16,2025-01-23 15:11,一加手机Ace竞速版
47501229,兵长一米六,5,哇，小老师版滑板鞋,1,2025-01-23 14:59,红米 K70
601686835,一流的狂战士,5,只能说这款游戏太棒了，一开始就玩过,2,2025-01-23 14:22,Vivo IQOO Neo9
329682372,極端,5,（补一下时间23-07-20）这里没钱请水军啦？自己游戏做成什么用没点数？破站请刷分7.8，tap没钱现在6.5，还能降，一关给20，一抽要160，祝你公司像你这游戏一样蒸蒸日上，三测给的东西比现在多多少，<br />23-08-07啥帽版本活动，又扣又难还是4种卡还不改，直接停服吧<br />25-01-23回来玩了大半年将近一年了改的确实很不错，比开服那会好多了，就是过完版本主线又开始咸鱼了可玩性目前还是一般般，没体验完，不过说会改进,10,2023-07-20 22:30,Redmi K50
19235434,JaneLin,4,产能还是得多提上去，总是那些玩法来回换真挺无聊的。之前画的饼也没落实多少。<br />（1.23）温泉实装了，文案实名也加上去了，新出的角色也挺轮椅，一定程度上弥补了枪械射击手感一坨的缺点。总的来说可以给四星。,1,2025-01-11 16:23,未提供
15915247,embers,5,伟大无需多言，把沪圈底裤都爆了,3,2025-01-23 14:12,红魔9S Pro+
354148388,渡边星我老婆啊！,4,都是玩pc，继续努力,2,2025-01-23 13:57,华为NOH-AN50
44034824,手机用户44034824,5,刚入坑不久 相比于之前接触的游戏确实很良心 尤其奖池的保底机制可以保证真实的游戏体验 皮肤很精美 感觉得到官方的用心 希望可以一直入坑下去 也希望尘白越来越好,1,2025-01-23 13:55,小米Xiaomi 12 Pro
696855102,ephnel,2,不是哥们，pc端玩到70级全是保底吃满，但凡你让我提前出一次我都不会这样😔就一个手机号换个号都换不成，皮肤月卡党也是难以触及我真是乐了呀,2,2025-01-23 13:35,Huawei Nova 11
417349838,飞,5,我是送恩雅的版本入坑的，出事那天我有事没更新，看了B站才知道，就决定先停一段时间，结果一直到现在才有点时间玩游戏，希望这版本的活动好一点吧,1,2025-01-23 13:32,Vivo Y78+
506751889,皇尊丿龙少,5,伟大无需多言，点满⭐,1,2025-01-23 13:19,HONOR 90 GT
392468234,长歌墨留,5,2.5版本很满意，继续保持，。,5,2024-11-07 23:23,Realme真我GT NEO 3
74735359,无叶奈何,4,***小游戏每人加滴血吧，要不每轮给道具后都是玩家先手，不然太容易被斩杀了。后手道具比较多，第一次不被秒反而胜率感觉高。而且电脑选对的概率是不是有点高,1,2025-01-23 13:11,三星Galaxy S22
11517816,猪猪大人,5,比原神方便太多了，每天一分钟就搞定,1,2025-01-23 12:59,小米Mi 10S
63522327,负责养家,2,更个新更一万年,2,2025-01-23 12:53, iQOO Neo7 SE
16233914,谁的胖次,3,纯涩涩游戏，福利挺多，限定角色好拿，然后命座可以白嫖，皮肤很涩，还挺不错<br />就是游戏玩法确实太拉胯了，半夜打给我打困了,4,2025-01-23 12:48,红米 K70
103636658,◟(.öˬö.)◞来份🍉,1,不想玩了，卸载了，50级一个up没有，就两个白送的5星，武器池也30抽没出,4,2025-01-23 12:35,一加手机12
598857596,汤樊,5,每次进去都要更新,1,2025-01-23 12:35,OPPO PFGM00
26859105,花绕北ovo,5,前几天入坑，对新手福利很好，游戏的养成系统很简单，不用肝,1,2025-01-23 11:58,未提供
1028437,崔悟丑,4,一直玩的pc端，不习惯手机fps，下面是深度体验的感想和总结<br />建模和原画无愧于18+，谈不到全程立着玩😎，但是确实害怕那天突然河蟹那种。居然敢做第一个禁止未成年进入的游戏，先生大义<br />射击手感非常棒，狙击，喷子，手枪，步枪，还有十字弩和弓箭，各有各的手感，每个角色一个技能一个大招，在后台可以用1个支援技，后台放大招每个角色都可以设置放完了驻场还是继续待在后台，非常人性化😸<br />技能 大招 支援技，技各2个科技树，过路点给属性，点满了给效果，两种科技点，蓝色和橙色，日常产出蓝色科技点，周常和活动兑换橙色的<br />前天回坑，送的充值货币抽出了现在2池子里的2个限定角色和她俩的专武，直接组出第2队打深渊，爽！都没吃保底，也没歪，可能是回归红利😆已经决定常玩了！<br />角色80抽保底，橙色出率0.7％，歪率50％，大保底是抽出第2个橙色，我抽出4个橙色角色，其中3个限定，吃了1个保底（歪了），角色抽出1个就够了，在日常-个人故事里扫荡4次，每次给3个碎片（每个角色每天最多2次），慢慢升就满命5命了，如果有人说拆分强度，那这等于白送强度，现在每天邮件送打4次个人故事的次数恢复道具，我直接同时拉2队😍<br />专武60抽保底，只需要抽出第2把就可以满破，蓝色武器前期过度，紫色武器效果后台角色放支援技给前台加增伤buff用，所以蓝紫武器满破一共要1*4=5个，攒攒都有了，紫色出率8％，十连保底1紫，剩下是蓝武器91.3％，其实我觉得还不如匀出来点蓝色武器的概率，改成紫色橙色材料😊<br />抽卡卷有4种，限定角色 限定武器 常驻角色 常驻武器，签到 邮件 活动 新手任务 回归任务送的都是限定的，主线和部分周长送的常驻，大多周常都送的抽卡货币，想抽啥抽啥😇<br />武器升到50级给配件，每把枪4个配件位置，活动兑换也给橙色配件，配件没有强化功能，属性2条固定的，提升很小，有时候紫色配件属性不对不如上蓝色的，后期当然是全橙色，但是还没出全呢都😏<br />等级刚过60，角色和武器在努力拉到70级，养成资源不怎么卡我，就是体力有点少，自回上限240点，主线一关14点，日常最后一个难度刷紫色材料40点，刷蓝色材料多的20点，每天送的不太够玩的，溢出要是能保留就好了😖（我说，贵游和崩铁谁先取消体力限制谁称雄称霸）<br />感觉评分低了，至少有7.5-8分以上，不知道为啥这么低，可能开服的时候出啥事了吧😟<br />打开角色，我看到一张装备的精2圣痕的立绘被河蟹了，气得我立马打开百度去找，然后发现是个男的，然后一看，男的圣痕都变成了女外型的黑色人影，才知道官方删除了男立绘了，估计是准备以后换图，看来也不可能出现男自机角色了，怒气值100％转化了属于是😂<br />剧情有少量刀子，但是最后都发糖，所以看完剧情感觉刀子也就是萝卜刀的杀伤力，没有谜语人，正派反派智商都在线，没有牛，角色塑造几句话就刻画出来了，最关键的是，爷不是摄像机，也不是不出场的博士，也不是说话字数不超过选择按钮的长度的，爷是真主角，要说就是 和神明下国际象棋也行，在坍缩液里游泳也行，扶贫支教抗洪抢收第一线也行，和八国联军坐一起对着骂也行，当然把妹也行的那种的😝<br />感谢你看我的评论，我嘴笨，总之，推荐入坑哦！😘<br />=更新<br />现在来看<br />只有『好看的』，不够<br />不过，要是只有『好玩的』，那也不够<br />这是一个天『秤』，不是一个天『平』<br />为什么长得帅不适合说相声？<br />为什么说相声不能戴表，而唱大鼓就能戴手镯？<br />这是思考题，不用做😈,34,2024-05-05 21:43,小米Xiaomi 12S Pro
82956182,剑随心动,5,好大的雾呀，老婆这是为何😡,5,2025-01-23 11:13,Realme真我GT7 Pro
404762992,墨落,5,我是昨天才入坑的这游戏谁玩谁知道太好玩了,3,2025-01-23 10:57,Redmi  K70 Pro
691935247,子墨,5,牛逼，太牛逼了，可玩性很高，对新手很友好，抽奖爆率也很高，打击感很优秀，不过大狙散布可以再缩小一些,1,2025-01-23 10:53,Honor X50 
456590485,青空,5,圆规吧友强烈推荐,1,2025-01-23 10:51,Honor 80 GT
4163456,小仓朝日,5,内测删档玩的，当时建模很差，手感不行，现在好多了，建模画质好点了，就是嘴还是有点怪怪的，pc最高画质都有点怪，操作性手机不太舒服端游爽的，手机打活动困难过不去，pc端简简单单,1,2025-01-23 10:38,Redmi K50
670678762,qqqq,4,好玩，好看，好听，好爽，四好游戏不多见了，玩了这么长时间耶是96级的人了，从刚开始用四星角色刮痧的小萌新变成了副本随便过的老玩家，对官方只有一个提议，瑟瑞斯的皮肤再出双马尾就审美疲劳了😓,2,2025-01-23 10:23,Vivo X100 Pro
13511794,江锋,5,真正的服务业，ml赛高,1,2025-01-23 10:07,未提供
697952209,喜欢微尔莉特,3,感觉他那那个角色看起来很怪，操作也比较麻烦。,3,2025-01-23 10:01,未提供
46899950,时崎凛,5,兄弟们新婚快乐！,2,2025-01-23 09:58,Vivo IQOO Neo9 Pro
697960942,王,4,我觉得还可以，角色动作丰富，打boss也很好玩，建议多玩玩,2,2025-01-23 09:06,华为Nova 4e
43462088,半城暖,5,目前来说我玩过的唯一一款没啥意见的游戏，作为一款二游做的很不错了，我很喜欢，老婆党的安心之处,1,2025-01-23 08:26,未提供
690924343,沐枫,5,太好玩啦啦啦～希望制作组再接再励，只要别出暴雷剧情，我就会一直玩下去，支持尘白！,2,2025-01-23 07:25,一加手机13
4862995,.。.。.,5,目前唯一一家运营满分的游戏,1,2025-01-23 07:03,三星Galaxy S10
57957065,阿晴san=0,5,好吃爱吃多吃,2,2023-10-05 11:20,OPPO A2 5G
522302404,茶倾城,5,我这号真黑好歹是开服卡点创的啊,1,2025-01-23 06:13,未提供
669286661,白起,5,麻烦审核一定要认真点，大伙都希望这么一款好游戏，能健康成长。转眼就2025了，从测试到现在我一次都没有离开过，希望尘白能越来越好。,1,2025-01-23 04:46,Vivo IQOO 12
690830408,y,5,数据金给的太少，衣服可以更暴露，,1,2025-01-23 04:38,小米23090RA98C
70557819,风尘,5,唯一一款能相信的二游,2,2025-01-23 04:10,HONOR VER-AN00
407500294,楠枨,4,怎么回事啊？老是让更新客户端，这APP也没显示更新啊？,4,2025-01-23 03:51,iQOO Neo 5
103445745,手机用户103445745,5,游戏性一般，但服务一流。,4,2025-01-23 02:50,Xiaomi Redmi K60 Ultra
365599118,方羽,4,入坑半天感觉挺好玩的，然后晕3D退坑了,2,2025-01-23 00:56,Vivo IQOO Neo7
678906668,陈楚生,5,good游戏2025.1.23娶媳妇,4,2025-01-23 00:15,Realme V11 5G
59517659,某某目录,1,oppo find x3，下完后进游戏所有点击都是错位的，根本改不了设置，也不能正确互动，已经下过两次了，都是同样的情况，玩其他游戏都是正常的,2,2025-01-22 23:45,OPPO Find X3中国版
609902516,AIcheney,4,救命啊，赛博人质的日子怎么才能结束啊😭,1,2025-01-22 22:42,Vivo IQOO Neo9
697563370,月月,5,非常不错，剧情不拖拉，人物建模深得我心，技能和人物设计在末日的背景下毫无违和感，比我之前玩过的二游要好玩,2,2025-01-22 22:30,华为STG-AL00
366964155,User366964155,5,凯西亚入坑的，在b站看到凯西亚的视频，直接光速入坑买了皮肤，只要能带给你情绪价值的游戏就是好游戏，其他的都是次要的<br />💃🏻立绘建模：在一点点的变好，起码有看出来了<br />🎮操作细节：要什么操作啊，直接射射射😋😋<br />🧝🏻‍♀️角色人设：角色总会有符合你xp的<br />🔫枪械还原度：枪械就算了，二游不强求，就是手感能不能加强点<br />🔖运营服务：很听劝，能分辨好坏声音,1,2025-01-22 18:09,OPPO Reno12
10002864,卡斯特梅的夏季,5,伟大，无需多言，我是用PC端玩的，体验很好，高清建模视觉享受！<br />新春版本惊喜连连啊！,2,2024-04-23 23:08,HUAWEI Nova 9
647922173,是大V叫我去接你,5,体验拉满，这就是最适合老婆党的游戏,2,2025-01-22 17:36,Vivo IQOO Neo7
667127857,合唱的嘛,5,人物做的非常好,2,2025-01-22 17:10,OPPO A32中国版
374974304,User374974304,4,八月初入，十二月淡。没啥游戏性，但作为瑟瑟养老游戏还是可以的，运营服务态度也还不错😝,1,2025-01-22 16:01,未提供
566765444,黍离,5,喜欢爺指环王分析员一只手上四戒指的含金量嘛😋,8,2024-12-27 19:30,Vivo S16 Pro
341721717,社废会人,5,哟西，早就想玩这种fps的二游了，之前出的时候我还以为像其他游戏那种自瞄，没想到真的可以当枪战玩，不戳不戳,1,2025-01-22 12:29,Redmi K50
109350076,手机用户109350076,5,不错,2,2024-07-17 00:12,一加手机Ace 3 Pro
543375485,老6,3,首先这个二游是很推荐玩的、但是这个游戏的陀螺仪很有问题。,2,2025-01-22 11:19,华为畅享10 Plus
4535276,浪赦,5,超喜欢里芙无限还能返厂么☹️☹️☹️☹️,2,2025-01-22 05:26,华为 Nova 8 Pro
24634417,仟梦,5,这满分，是对比出来的,4,2025-01-22 03:01,未提供
