用户ID,用户名,评分,评论内容,点赞数,发布时间,设备型号
631915244,Ark,5,2.6<br />今天更新的皮肤互动啥的已经全部拿下了😋，而且今天更新的肉鸽打的是真的爽歪歪🤓👍🏻已经爽打了一天了<br />1.27<br />婚皮豪堪，互动豪堪，剧情豪堪🤓👍🏻<br />1.18<br />2.5前瞻看爽了，希望平稳落地🤓👍🏻<br />12.20<br />2.4新版本神中神，建模立绘皮肤剧情全部顶中顶😋👍🏻👍🏻👍🏻我吹爆😋👍🏻<br />----------------------------------------<br />二次元pve射击游戏独一家吧，从大概1.6被朋友拉进坑全勤到现在，刚好100级，随便写一点评价<br />💃🏻立绘建模：<br />刚入坑那会（1.6末期）其实感觉一般，但是这段时间玩下来无论立绘还是建模还是渲染都有肉眼可见的进步。除了移动端有点糊。现在无论是角色原皮还是皮肤，建模都很精美，很少见有人体彩绘，这方面在我看来已经不输目前市面上任何一款二游了，而且够涩🤓👍🏻最主要是有不歪池，每个新角色基本上都能稳拿，官方还跟不要钱一样嘎嘎送自选（感觉生怕“出了对你xp的皮肤但你没角色结果就不买”这种情况一样），现在已经全图鉴了😋<br />🎮可玩性：<br />首先没有任何强度焦虑，深渊宝宝巴士，随便拿满数据金，拟境每周无脑扫荡*8; 材料关卡都可以一键扫荡，所以做每日任务的时间基本上还没有启动游戏花的时间长。属于是想玩一玩的时候有东西玩，不想玩的时候基本上不占用时间这样。<br />一直以来游戏性其实饱受诟病，但游戏性真的很差吗？哪怕是小版本基本上也是新玩法+老玩法翻新+老三样这样。大版本东西更多。不仅是基于pve+射击游戏衍生的各种玩法，最近几个版本也在出一些尘豆人，小游戏这些玩法，明显能感觉到制作组在尝试创新。<br />💰氪金体验：<br />零氪：靠每个版本送的抽+不歪池，拿下当前版本的所有新角色（官方明确表示，如果出两个新角色的话会送一个）是不成问题的。入坑的话主线给的抽卡资源很多，而且剧情可跳过，还有些什么战术考核等一些乱七八糟的，抽角色的话基本上不成什么问题。<br />小氪：大概是小月卡+部分皮肤。在下刚入坑的池子歪了，后面多出了个不歪池，再加上命座可以扫荡刷，每个版本给的抽卡资源也很多，相当于角色+命座全部可肝了。因为我基本上不抽专武（毕竟没有强度焦虑，开卡池还会活动白送一把适配的四星武器），现在已经全图鉴了，囤一囤数据金还可以补几把专武，后续停了月卡只买皮肤也不失为一个好选择。总之，小月卡体验非常不错，角色原皮建模也很精致，皮肤挑喜欢的买就行<br />重氪:你游有什么可以重氪的东西吗🤔皮肤拉满也没多少钱，礼包一堆溢出的小垃圾，武器两把满精+不歪池也花不了多少，也就本身就可以刷的角色天启，如果想捞快一点可能能多氪一些了吧hhh<br />🧝🏻‍♀️角色人设：<br />角色塑造还是很不错的，每个角色都有鲜明的人设特点，而且全都打直球，不会搞得拐弯抹角暧昧不清地吊🐢，爷在剧情里还是龙傲天，老爽了😋<br />官方还会发一些官方一创，例如asmr，情书之类的，情绪价值拉满🤓👍🏻<br />🔖运营服务：<br />顶中顶，工单很有用。现在社区与官方打成一片，官方高强度刷社区，社区内的官方人员不会装死到ip消失😋。现在很多社区梗已经成游戏里的底层逻辑了（例如小老师🤓），听清楚社区玩家的声音自然不在话下。<br />皮肤和谐过几波（手动修改游戏文件卡一下bug可以取消和谐，相当于没影响），后面甚至不退皮肤的情况下退了等价比特金，然后比特金又可以买新皮肤，相当于买一送一了。之前玩其他游戏碰见和谐可没有过这种待遇🤓👍🏻<br />2.3剧情出了点在某些别的游戏根本算不上问题的小问题，结果成都的一批老哥直接组团家访了，从节奏爆发到直播完时间也没超过24h🤔，后续还给老哥们送了周边。<br />🔪社区氛围：<br />社区可比游戏好玩多了🤣<br />新人入坑的话建议少说多看，毕竟现在二游圈麻辣战争打了很久了，有许多历史遗留的问题，mmr估计不太了解，带着过去玩某些游戏的习惯发言可能会踩雷。多逛一逛主力社区（贴吧为主），后续逛熟了可以一起战斗爽（补全了游戏内缺少的pvp内容😋）;不逛社区安心打游戏，麻辣仙人对内对外的战斗力有目共睹，社区氛围绝对安全感拉满的🤓👍🏻,135,2024-10-02 16:05,未提供
657198147,天童,4,可以，非常好玩<br />要是加个跳跃键就更好了,,2025-02-06 14:34,vivo X60 Pro＋
694276810,该用户已注销,5,剧情太甜了，多来点！,,2025-02-06 14:23,Redmi Note 12 Turbo
325728797,灏蓝。,1,我下了一晚上，不知道为什么这游戏更新包这么大，15G！！！然后！！我就玩了个开局动画，进游戏被弹出，再次进去就卡在登录界面一直显示等待资源优化，优化了15分钟都进不去游戏界面，我真服了，没试过一个2025年的游戏渣优化卡成这样……,,2025-02-06 07:40,华为 Mate40 Pro
483536988,通工,3,如果是新人，自己玩的开心就好了，不要去了解相关节奏,2,2025-02-06 11:45,未提供
431731310,重明,5,射击节奏感特别强。,,2025-02-06 11:20,vivo Y3
492328,醉卧听竹,2,活动联机玩法不忍直视,5,2024-01-07 17:30,Vivo IQOO 11S
65723267,手机用户65723267,5,💃🏻立绘建模：<br />顶级 剧情也是,,2025-02-06 03:12,小米24117RK2CC
355738454,堇瓜快乐水,5,就玩了两天，给米游的氪金全歪到尘白了，以前过得什么苦日子啊<br />不歪池+扫荡+跳过，剧情很辣很满足,1,2025-02-05 23:57,未提供
31569987,白夜,4,服了，心跳水弹的小道具进阶枪管，女角色打我极大概率都是水而我则是彩😓😓😓,3,2025-02-03 23:41,vivo Y3
535664495,清云冷颜,4,体力回复的快点或者多给点就好了,2,2023-12-18 23:29,HONOR Magic6
382588015,端木诗雨,2,为什么超元链接我进不了？连自己单匹配也进不去,,2025-02-05 22:52,小米24117RK2CC
58426951,冬景,5,买了里芙花嫁所以什么时候返厂角色，官方呜呜呜呜,1,2025-02-05 19:35,OnePlus 10T
685596826,杨戬怕狗咬,4,挺不错的，但是听说过游戏剧情有点不太好的事情，就四星吧，手感不错,,2025-02-05 17:09,Redmi K70 Ultra
436764478,时尚A华,5,好玩，但修复一下,,2025-02-05 16:06,Redmi K70 Ultra
340871953,下一站,5,无敌，孩子们，快玩,2,2025-02-05 15:21,Vivo IQOO Neo8 Pro
501991986,不请假我不弃,3,我只能说这个游戏纯纯靠建模来吸引玩家，游戏的操作手感不好评价，打击感跟手感肯定是没有别的射击游戏好的，命中反馈感觉跟没有差不多，就算是互动系统也是少得可怜，并不能跟角色日常聊天，互动很乏味，只有那几样，总的来说，如果不是看中建模的话就别入坑了😂😂,3,2025-02-05 14:16,Vivo V2417A
14652447,手机用户14652447,1,不好玩，太肝了，叫色建模也没宣传那么好看,2,2025-02-05 14:00,Vivo V2166A
635396358,那由多,5,一般很少评价，来点主观但中立的<br />声明：我是主要以电脑操作为主，偶尔用手机玩玩<br />🎮操作细节：用手机玩的体验是没法和电脑比的，毕竟尘白还算是射击类游戏，还是键鼠更加合适（包括其他需要灵活转动视角的游戏，搓玻璃是肯定比不过鼠标的）如果打算用手机玩的话，角色的选择就很重要了，每期出新角色都有试玩，这个要结合自身的实际情况（例如冬至-肴）就极度不适合在手机上使用。<br />💃🏻立绘建模：立绘建模个人觉得是很精良的，是可以和绝区零，战双排在一个档位。<br />皮肤方面：我的审美比较传统，像里芙的婚纱，芬妮的甜蜜统治，还有恩雅的护士其实我不是很欣赏的来，就是感觉很别扭，但是很精致（这个是个人主观，勿代入自身），像琼弦的嫁衣和安卡的旗袍，还有云篆的小龙女，我只能说神中神<br />🎮可玩性：游戏就真的很拉了，重复度高，虽然里边有很多小游戏，但是我是真觉得没啥好玩的。特容易就长草，加上有体力的限制，并且版本更新很少有什么玩法的革新，且玩法大多是以单机为主，联机不仅单调且少的可怜（不过我相信狸花猫后续可以带来更多好玩的内容）<br />游戏强度这方面，无非就是肝不肝，难不难。<br />先说肝的问题，因为有扫荡功能，基本上5分钟就可以把体力刷成你想要的材料，所以我是认为对于养成方面来说是完全不肝的。然后就是蛋池资源获取，基本也是小游戏玩一玩，各种活动本打一打，正常人一天30分钟足矣打完今天需要打的量，但是偶尔会有一些比较恶心人的任务（像上版本梦魇）反正我是每天玩不超过1小时就可以全勤下线，对于我来说在这游戏肝度在中下左右<br />再说难度问题，只要有一个咎冠（常驻的五星，好像是可以在通关主线第五章时可以免费领一个）+一把不协和音（四星武器）另外再组俩辅助，一个四星免费的奶妈肴和四星的安卡，基本能打穿这个游戏80%的关卡了，我开服就是这么过来的。只有去争拟境（类似崩三深渊）才需要去无限优化配队，要是只做休闲党，可以不用考虑强度问题，并且可以通过快速扫荡拟境也能吃满蛋池奖励（我只能说究极良心了属于是）<br />🔖运营服务：这个都可以算是游戏的核心了，制作组对玩家是真的好，合理的建议他们会采纳，不傲慢，不装死，出问题了可以第一时间去设置里的反馈中提交，并且前段时间因为和谐问题，项目组居然可以在不回收皮肤的前提下返还比特金（类似原神的创世结晶）<br />福利方面：没有具体统计过，我氪金都是买皮肤的，而且我还是那种抽卡比较霉的人，基本都是70-100抽出，但是我也能拥有绝大部分的角色，没有的角色是因为我不喜欢所以没有去抽，福利这一块我是觉得没什么问题的，并且角色的天启（类似原神的命座）是可以通过每日刷取的（每天可以刷2个碎片）从0-5天启需要8个月左右。,57,2025-02-05 07:04,HONOR 90 GT
669402288,宁宁～,1,我不认识辰星，他和我结婚了，我们洞房了，她很涩，但是我不认识她啊，皮肤很涩，买了，洞房很涩，脚底板有点黄，但是她是谁？,2,2025-02-05 02:10,Huawei Mate 50 Pro
444671612,Faeou,5,2025.02.05.<br />不歪池的含金量还在上升。<br />把玩家当人的含金量还在上升。<br />2024.10.12.<br />双角色固定送一个真的举世无双了，动态优化+泳装派对绝杀，这个版本五星好评了！<br />2024.05.24.<br />因为坑爹的后勤词条对其评分降至四星；<br />高强度玩了两天我觉得已经很满意了；为数不多的画面和枪战质感；手游端虽然操作不便但也能玩（毕竟自带瞄准，这个和以前cod单机手游有点类似），当然我还是推荐pc游玩；然后这里建议可以把手机端的几种自动射击整合一下吧（开火、腰射开火，掩体开火），界面会更整洁🥹，然后优化一下视角和自瞄，毕竟怪飞来飞去已经很难操作啦，有的时候手机端真的就只能站撸。<br />抽卡中规中矩，我还是一如既往的非酋，第一个金就是缄默，大家都说不行🥹，但是小太阳人设我实在喜欢，普罗米修斯！所以还是继续玩了下去。<br />所以说人物塑造和文案真的很重要！尤其是现在的二游！少前2的画面就不输啊，但是那个文案……（冇错我就是光明正大拉踩）<br />福利还是中上游的，毕竟送的五星真的不弱。<br />玩了两天之后果断月卡支持一下，就当作是门票了，不管以后还会不会继续游玩。<br />就算撇开颜色成分，也是一款值得一玩的游戏！就在这里祝大家小保底不歪吧！,7,2024-05-07 17:32,未提供
69247253,User69247253,5,尘白禁区非常非常非常适合做为一款副游<br />对于我来说这就是个很好很好的恋爱游戏，所以我的评价就是关于这些方面：<br />一 剧情没得说，无论是主线没问题（但算不上很优质），特殊故事和角色个人感情线做的都很好。<br />二 然后角色方面，立绘个人觉得都好好看，是几乎所有。但是建模存在一些问题（比如辰星的脸和立绘的区别），不过问题确实不大，但对于部分人应该还是有一些影响。<br />三 然后是战斗系统，虽然这是个射击游戏当然不可能真的做成真正的射击游戏，手感不能说特别特别好但是玩着也没有任何问题，部分技能打着还很爽（无限之视的终结技），当然也有不那么好的（如凯茜娅瞬刻的常规技）。<br />四 接着是游戏的肝度，福利程度，氪金程度，抽卡方面。首先尘白的限定不会歪，无论武器还是角色。保底是100，当然一般保底就是90出，爆率嘛——感觉因人而异，我就比较非每次都是85以上出但是我看大部分人都比我好，所以略过爆率。况且尘白在卡池期间弄一个大保底出来还是很简单的，因为它给的多而且卡池时间长 2.肝度 辰白就像我前面说的一样它很适合做副游，肝度很低（当然你也可以很肝只是这里从它作为一个副游的角度来讲）这么说吧对于游戏内容你就只做版本的活动就可以拿一个保底，对于角色养成家具币——奥普奖券，也很容易获得。3.游戏福利 对于有什么特殊节日官方的福利挺好的的（但是也没有多到逆天），一般的版本更新邮箱不会送很多东西，但是!你游的真正福利不是这些，你游是个16+（17.9999）所以——真正的福利有两种，文字型（剧情）和角色互动。大部分的角色互动都是家具效果而家具都是免费的，而角色互动我觉得可以算福利的有两种一种是角色的结算动画，还有就是场景互动。这里随便进入最后一个板块氪金程度，前面说的结算动画和场景互动都是要买皮肤的，结算动画要角色皮肤，场景互动要买场景和角色。我觉得在辰白氪一下真的可以给你更好的体验角色皮肤108场景60还有武器皮肤20但我觉得没有必要（纯爱党当我没说），真的，有一个皮肤和场景（同角色同系列）真的超级超级舒服！！！！！我自己是有里芙的婚皮和场景（顺便说一下准备买辰星的qwq）每次上线就看到老婆穿着婚纱说“接下来，我会一直陪着分析员的”。你就可以想象有多舒服了。<br />五 游戏里面还有许多好玩的小游戏（辰豆人qwq）也都很好玩，还有的有点瑟<br />最后总结，辰白禁区很适合做一款副游，建议微氪，带耳机玩，一个人玩，角色个人线和特殊剧情用自动播放,8,2025-02-05 00:45,未提供
25036192,手机用户25036192,3,最近这移动端优化的是什么狗屎，进都进不去,1,2025-02-05 00:16,小米13 Pro
327261089,Asphyxiate,4,现在四十五级，小氪200，说一下吧，福利少得跟个嗨那样。出货率...反正我次次保底，打好几天凑不出一发十连（你刚刚开服啊大哥）卡池开得又多，资源又少（就纯纯逼氪），剧情没看，不是很感兴趣。建模...闭上眼就还过得去吧，就立绘挺好的（虽然几乎所有国产二游美术都挺好）操作手感的话，只能说稀烂，不像是射击游戏，玩法就纯纯缝合怪，（危机合约，深渊，肉鸽...）挺无聊的，而且如果你只想推主线，嘿，您猜怎么着，要五十级才能开第八章，逼你长草（你才刚刚开服啊大哥）。优化也是稀烂，这几天用电脑办公，用的手机玩的，红魔8pro，游戏性能不用说，画质都拉到最高，糊成马赛克，放个支援技能，还能卡一下。害，再玩两个星期看看，实在不行就跑了😓<br />第三年了，孩子们蒸蒸日上😤,4,2023-07-25 22:38,未提供
652592674,陈晨,3,为什么我的注册不了？验证码一直发不过来???,1,2025-02-04 22:38,OPPO A2x 5G
463803455,logo,4,这个角色怎么换个别的武器？背包里有，可是换的话咋不显示？,,2025-02-04 22:25,华为ADA-AL00
16347081,手机用户16347081,3,为什么画质已经拉满了，大厅还是给我一种很模糊的感觉。按理来说是分辨率的问题，找了半天没找到分辨率的设置。练字和贴图都是模糊的，应该是分辨率的问题？客服能不能解决？,1,2025-02-04 22:20,小米Xiaomi Pad 6
457553921,路过的刘某人,4,听劝，不乱搞，运营组不犯病，超越市面上90%的游戏制作组😃😃😃,2,2025-02-04 21:32,Vivo IQOO Z9 Turbo
24614252,终末,5,男性向游戏，最棒的游戏评价，请看图片↓↓,104,2025-01-04 15:12,Vivo IQOO Neo7竞速版
24442944,澜沧江刘能,5,可玩性上还有很长的路要走 但我可以等,,2025-02-04 20:59,小米Xiaomi 14 Pro
368281998,马子玩意,5,这里下的是渠道服还是官服,,2025-02-04 20:39,Vivo IQOO Neo10
480521766,H,4,打一周了，来评论<br />总体上很好，肝度比战双低一点，七天肝一个“高招S”是可以的，我玩了七天，现在有五个金。<br />立绘建模：<br />跟原神差不多，有时会穿模（怪也是有碰撞体积的，可能会被壁咚）皮肤也还行<br />主线：剧情可以，人物故事基本全是刀😂，第四章尤弥尔要注意点，比较难打,1,2025-02-04 20:21,未提供
27772966,寂寞，孤独,1,那个策划做的水弹，又难打又臭又长,3,2025-02-04 18:55,未提供
16032913,Lion,5,除了玩法还有待提升，其他都五星,,2025-02-04 17:58,Vivo IQOO 10
580230182,超级润,3,不是哥们，我号呢？？？我号就这么没了？？？,1,2025-02-04 17:33,iQOO 9
38900819,天天是我,5,一个让我矛盾的游戏<br />可玩性：2星<br />崩三玩多了再玩这种游戏总有一种疲倦感，让我起不了太大性趣，对刚接触的人或许会好很多<br />福利：5星<br />好，就一个字，多说无益，除了皮肤不能嫖其他都可以嫖<br />画面：3星<br />我手机端玩家感觉还行，但还是像1一样，有疲倦感<br />涩涩：6星<br />超了一星，大伙应该也没什么意见。<br />卡池：4星<br />比米好太多太多，我甚至白嫖出了不少角色<br />总结：良心是良心，但可玩性让我感到大大的疲倦，即使出了什么养成怪物我也觉得麻烦而不是有趣，可能是崩三玩多了的后遗症，见到这种游戏感觉跟上班了限制了自由，游戏是好游戏，可惜不适合我。,8,2025-02-04 17:29,Vivo IQOO Neo8
537222954,Chinese good,4,修复一下没有恒约吧,,2025-02-04 16:15,华为BLK-AL80
507953530,乌鸦,5,偉大無需多言（玩法除外）<br />角色1.7以後的全有，之前的慢慢補中<br />基本衹要日常全滿就能保底一個新角色，小月卡3個月還能賭一下武器。,,2025-02-04 16:05,小米24122RKC7C
104133950,hh,5,应该就是我玩的最后一个二游了，立绘建模优秀，官方态度好，月卡党每个版本都稳拿一个限五，另外可玩性也不差啊，海姆向前冲禁区协议这些不好玩吗？,,2025-02-04 15:05,小米22101320C
9349542,你被强化了，快送！,4,官方这次版本对于后勤词条保底的改动基本没有任何意义，希望再次优化。<br />新版本定向词条所刷取到的定向重修类型词条（保底）的数值仍为随机，且难以获取足够的后勤额度、以及需要多次随机铺垫才能得到的保底定向重修机会，使得定向词条极难获取、门槛极高，又因为仅1/5概率能够随机到玩家所需要的最高数值，因此显得该词条保底机制的改动基本上是毫无意义。<br />如若随机到的指定词条不能是最高数值的话，那么定向重修就是完全无用（因为非最高数值的指定词条我普通定向就能出，压根就不需要你那保底发给我）。<br />大量资源投入、大量重修过后所获得的仅为1/5的机会，未能随机到则需要重新投入。这种高额的投入与产出的概率回报实际上相较之前的词条随机机制提升效果简直是微乎其微，若非一点那甚至就能忽略不计，只是给玩家画了一张“定向重修”的大饼，看似益处颇多，实则效果微乎其微。<br />而且这种改动会无意识地让玩家们把希望都寄托在所谓的“保底”定向重修上，当玩家辛辛苦苦刷出定向词条后数值却歪掉了需要重新刷，这则会使玩家的挫败感更加强烈，这反而会造成玩家的负面情绪效果。<br />后勤词条重修最令人诟病的是高额的资源投入、零回报、无底洞。因此我认为官方的优化方向完全错了，玩家们所需要的所谓的“保底”机制，是要看得见摸得着的东西，是能一眼望到头的、有结果的努力，那才叫“保底”，而不是从一个无底洞机制改变成另一个无底洞机制。,1,2025-02-04 12:12,Honor 50 Pro
546396393,小杰,5,好玩，玩了好久，一点都不腻，就是感觉策划是不是针对我，别人50发出金，我90发都没出，什么意思,1,2025-02-04 11:15,魅族PRO7S
568542352,避尘,3,提个意见，就是琼弦这个角色的调整，希望大招玉阙纷雪调整成释放此技能后可以在一段时间内无限发射惊蛰箭且以此方式发射的惊蛰箭伤害一定程度减少，这样调整个人觉得会舒服一些。还有一个希望，希望出一个城镇模式，可以在不同风格的城镇休憩，当然这是我个人的一个奢望，不过希望角色技能修改修改吧……,1,2025-02-04 10:00,OPPO Reno 4 SE
48345787,泡泡,4,💃🏻立绘建模：包牛逼的<br />🧝🏻‍♀️角色人设：包可以的<br />🎮操作细节：差点意思<br />🎮可玩性：不知道该说什么我觉得可以加一些竞技类的模式像PVP 还有提高自由度因为地图设计很精美我就想去探索比如水池里等有空气墙,1,2025-02-03 23:35,未提供
326974479,跳落之猫,4,运营可以，能听进去玩家的话。不歪池甚至比过去日式卡池更舒适，再配合着高福利真的舒适。全女角色且超直球，ml玩家福利。现阶段完全没有强度焦虑，给抽卡的资源的本新人两礼拜就能全拿了。<br />唯独可惜的是玩法太无聊，不过好在可以快速上下线，做个副游当gal玩还可以，如果能把每日任务改改两日上一次就更好了，摆脱班感。,15,2025-02-03 17:18,未提供
536987095,归心,5,很精致诶！可玩性也特别高（除了长草期），场景的各处细节也做的特别好，但是呢美中不足的地方就是服装设计的还是不够好，不过还是给予支持，希望越做越好，步步高升，超过某哈游！😄,,2025-02-03 14:46,Vivo IQOO Neo9
3111514,鈜mOu,5,pc端启动器都打不开了<br />速速处理<br />😇😇😇😇,2,2024-04-28 19:03,Vivo X200 Pro卫星通信版
353666304,游戏人生,5,玩了20多年游戏，市面上主流的游戏基本都玩过，这个游戏是最把玩家当人的。虽然我抽卡不是很欧😔😂,,2025-02-03 12:26,Vivo IQOO 12
507101554,王雨轩的好朋友。,5,很值得玩，里芙，无限之视很可爱,,2025-02-03 12:04,Realme V3 5G
320606706,User320606706,5,唯一一款把玩家当爹的游戏,,2025-02-03 04:15,iPhone 13
21150870,zaro,3,很久没玩过二游了，b站看到pv来玩一下，100抽保底拿到up，感觉玩不下去，养成什么的玩不动了。二游可能好玩，但二游好玩不太可能,3,2025-02-03 01:37,未提供
511478945,魔王,5,请问一下，三个月前凯莤娅的沫浪倦姿不是被和谐了嘛，当时我因一些事，那段时间没上线，我今天更新后发现被和谐了，我去找了原因，说你们有退还比特金，看到后面才知道有时间限制，所以能不能给一下补偿呀，我觉得挺遗憾的😔😔😔,,2025-02-03 01:34,未提供
440795095,_Flatline,5,水枪模式给个加速吧。<br />出众点是运营态度可以，游戏内工单反馈有效不会虚与委蛇打太极(b站渠道服没有工单)，以及明确了 本游戏是男性向大后宫游戏 的赛道。<br />手机端的体验会比较差，画质拉满光速发热，调低画质会有些糊，优化做得一般。有条件可以考虑去pc玩。,16,2025-02-02 23:01,小米Mi 10S
427343447,Oliver,5,建议是别光出大姐姐 小的不说 出些妹妹系的少女很有必要 从我的和不少人的角度来说 大🐻姐姐不是很戳 多来点贫瘠少女罢 这样一来又可以吸引另一种阿宅了💪,3,2025-02-02 22:57,未提供
2122224,天王电竞,5,能不能优化一下图鉴系统啊！我有的你给我看，没有的就看不到，那我还要图鉴干什么,1,2025-02-02 22:14,Vivo V1950A
