用户ID,用户名,评分,评论内容,点赞数,发布时间,设备型号
26047144,靴靴靴靴子呀,3,2021.6月底，退坑了，三星给那四个男人，机制真是太辣鸡了，吃相也太难看了<br />———更新<br />10.20抽到陆总跟夏彦小天使啦～满足ww<br />———————更新—————<br />希望能抽到陆总还有夏彦小天使呜呜呜呜呜<br />——————更新————<br />异常第五章下也太难了叭！呜呜呜呜呜<br />七夕卡池太难受了呜呜呜<br />关卡我也打不过，卡养得也慢（还老抽不到需要的属性呜呜呜），材料刷得也累<br />—————————分界线——————<br />玩了几天，不是开服玩家，打算继续玩下去(⑉°з°)-♡<br />总体来说，游戏体验还不错|･ω･｀)<br />优点：剧情比较有趣，我也难得都看完了hhh（玩其他游戏我都跳过剧情的）<br />声优我太可了！！！人设什么的都很喜欢！卡的画面也挺好看哒（希望多出点卡，悄咪咪说一句）<br />而且不是很氪！(○ﾟεﾟ○)<br />需要改进的地方：进化刷材料有点累hhh希望掉材料多一点<br />卡的掉率一般般吧<br />希望出一个扫荡功能，一次次等比较花时间(º﹃º )<br />希望继续做下去，而且能越做越好！（别太逼氪，氪是可以的，就别割韭菜就行ヽ(｡･ω･｡)ﾉ）,2,2020-08-15 12:40,未提供
703265548,砂海,4,💎资源获取：升级卡和经验书一类还是比较麻烦，前期建议主要升几个不同属性的卡就行了，常识，令我惊讶的是升卡所需的材料居然和米家ys副本一样有固定时间才能打，不过都是小问题<br />💘恋爱感：看到有人说恋爱感不强，其实我感觉还行，这游戏主打暧昧吧，但是能感觉到主控是很有魅力的，就我而言我会很喜欢，玩过其他乙游都会给我一种憋屈感，无论我是设计师还是物管局局长，几乎在男主面前天然是下位者，我不喜欢这种感觉，但是未定的主控和男主直接可以让我感觉到我的“自我”<br />不说有多女凝吧，至少男凝少了，这就是我希望的，可以给我应有的尊重，我是一名未定市的律师，很有代入感<br />🎮可玩性：很强，玩法不算多出众，但是能让人静下心来看剧情了，挺有意思的，逻辑比较强，我其实不喜欢那种在剧情中加入毫无意义的玩法，不过未定做的还不错<br />🌃画面音乐：卡面很精致，美术挺好的，没什么好说的<br />这游戏优点就是我很主动的同时没有倒贴感，更没有男主（目前我玩到现在没有）和我说什么“因为我不能允许别人欺负你，所以只好我来欺负你了”这种一看就知道我处于下位并且pua我的文案，玩到后面再有感想再补充吧，目前愿意给四星推荐,1,2025-04-05 08:46,Vivo V2417A
611113670,青果,4,来来来未定事件簿我问你点事。<br />就论最近几个月夏彦的卡，可以说除了SSS全是侧脸。<br />你把绮思背景换成甜心服饰被骂还不够，新出的兑换mr卡又是什么鬼？<br />那张图我都不敢看第2遍，腿和胳膊是正常的体型吗。把那张卡和千灯卡放在一起对比瞧瞧都不敢相信是同一个人，夏彦是生物大学毕业的吧，不知道的还以为是体育生呢，拒绝夏彦和体育健身捆绑哈。<br />不是端水吗，怎么其他几个都穿上西装了，夏彦还在穿旧衣服，夏彦的西装呢？我们夏彦也想穿西装。不敢想象这是一个系列的mr，夏彦卡面的精细度和创新度落后的不是一点半点。未定事件簿不要在区别对待夏彦了😇<br />生日放在右上角生怕被人看见吗，四个人只有夏彦的生日字体大小不同，这就是米哈游最会端水的伟大生煎包吗？<br />恭喜夏彦四缺一西装🎉恭喜夏彦全场唯一旧衣服旧卡2.0🎉  恭喜夏彦喜提除【全员】SSS【统一正脸】外的连续大侧脸kpi🎉恭喜夏彦2025又拿下一张丑侧脸🎉恭喜夏彦全场精度【再一次】倒数第一<br />端水事件簿 端端又水水啊👍<br />在大超发被拉黑了，未定事件簿是不敢听玩家意见只会捂嘴吗？夏彦欠你的吗，侧脸侧脸又侧脸，夏推是不配看夏彦的正脸吗？<br />这就是你游对待看板郎的态度吗？🖕⚠️这就是你游对待看板郎的态度吗？🖕⚠️这就是你游对待看板郎的态度吗？🖕⚠️这就是你游对待看板郎的态度吗？🖕⚠️这就是你游对待看板郎的态度吗？🖕⚠️这就是你游对待看板郎的态度吗？🖕⚠️<br />📣未定事件簿无偿归还夏彦【正脸】📣未定事件簿无偿归还夏彦【西装】📣未定事件簿无偿归还夏彦卡面【精度】📣未定事件簿无偿归还夏彦四人活动【适配性】及【创新度】<br />📣未定事件簿无偿归还夏彦【正脸】📣未定事件簿无偿归还夏彦【西装】📣未定事件簿无偿归还夏彦卡面【精度】📣未定事件簿无偿归还夏彦四人活动【适配性】及【创新度】<br />📣未定事件簿无偿归还夏彦【正脸】📣未定事件簿无偿归还夏彦【西装】📣未定事件簿无偿归还夏彦卡面【精度】📣未定事件簿无偿归还夏彦四人活动【适配性】及【创新度】,,2025-04-05 03:34,未提供
44683380,有靈,2,画风很好 男主人设没有魅力 玩到现在 也不知道自己喜欢哪个男主 我也不是all推。现在上游戏 完全是想把主线看完 只能说剧本确实挺吸引我<br />主控的造型完全日本女团的感觉 发型斜分然后戴多大花 不感冒。<br />最后 特别讨厌米忽悠这个公司😁,,2025-04-04 17:56,Huawei Mate 60 Pro
537997371,阿离,5,之前下的渠道服丢了，重新在官方养一个。<br />但是……为什么！又是莫弈！重开的号也是莫弈！新手池是莫弈！活动池也歪莫弈！我！推！小！陆！啊啊啊啊啊！不要再来了莫弈……,,2025-04-04 14:26,未提供
651221798,暖月,5,新入坑的，我不知道是十六加游戏错过一年好可惜,,2025-04-04 01:42,未提供
590233370,云间梦璃神,5,还算可以的，刚玩三个多月，因为战力不够好多都打不过，莫弈单推，抽卡资源还是够用的，我抽了三个池子——周年庆，单人和莫弈生日，我是次次满保底的那种，月卡党单推会真的很舒服，莫弈生日池子我满保底还可以剩下三十抽，我也只充了月卡，邀请函和衣服另算，后面玩资源比较紧缺（米游社的那个是懒得打😣）<br />唔……玩了两百多天了，每天也就上线神速做个日常，两分钟时间也就搞定了，还有就是大活动上线肝一下，主线什么的也打完了，不是很肝，也不氪，我目前月卡➕半年卡单推还是很舒服的，我抽卡的规则就是莫弈的卡必抽，另外三个男主看想不想抽，莫弈抽不到就氪，大活动就是先把莫弈的卡抽了，其余男主看剩下的多不多，多了六七十抽就会去抽其他男主<br />我也算是非酋本色吧<br />2.04我能坚持玩下去的游戏真的好少再过三个星期左右就要满级了，希望满级之后还有玩下去的动力吧<br />4.3<br />好了姐妹们，我也是来更新了，简直是非与大保底！！！今天莫弈的SSS满保底出了，绝望了好吧，五一还有一个活动，我拿命抽吗？我问你呢米忽悠，你觉得我很好忽悠是吗？最近我看你也是缺钱了，事情一堆，一年不挨骂还是来找骂了,10,2024-07-10 15:40,Honor X50 
102842087,娅渲,3,二月底三月初被吸引过来玩的，以下是目前比较影响本人体验的几点，供参考<br />1.是体力方面卡的比较紧，不太够用，容易卡关。琢磨了一下获得体力的方式有三种，一种是自动回满一种是每日任务有60，还有一种是等级提升。想提升等级，刷材料什么的根本不够用😵如果每天分早晚上线应该是够的，但那会很累😢<br />2.是升级材料方面，研修可以刷但次数只有两次，工作证可以提次数但少不够用，兑换以及可以换比较低等级的材料，限时卡池可以换高级的材料。总结：不够用。<br />3.是陪伴感较差，短信要抽卡，电话要花钱，没有朋友圈。主页有男主互动but没有声音，看了一下要好感30级才能解锁，日常好感经验1000，玩的时间短没有特别偏好的男主而且没抽卡资源的情况下，较难升级。<br />4.是本人比较看重剧情以及代入感的，这一点真的😟😟 代入感可能是比较主观且抽象的东西，不太好形容。比较有深刻印象的点在男主的心理活动，在他们的心理描述里的那个形象性格太具体鲜明了，这一点在卡面剧情中尤为明显。<br />还有就是卡面剧情中男主有声台词原来只有几句，第一次点开以为是我没开声音。<br />5.是薛定谔式的社区环境。像本人一样不混社区但上网的话还是慎入，不知道是不是有什么信息茧房，没下载游戏之前刷到相关帖子以及视频表面一片祥和，一段时间后被大量女主党创飞。<br />本人目前42级（今天应该能到43叭），主线卡关，单人剧情随好感等级解锁，能看的看完了。目前打算继续再玩玩看，或许后面我真香也说不定捏,,2025-04-03 13:17,未提供
710017044,阿萨Aza的狗,5,就是很好啊！！！！<br />其实也有不好的的地方？我是陆推，结果他给我狂出夏彦！咋的！？我的陆景和是橙毛啊！！！！<br />✍🏻建议：<br />专业出人！我要陆景和！！！！啊啊啊啊啊啊啊啊啊啊啊陆景和啊啊啊啊啊啊啊啊啊,1,2025-04-02 04:14,联想启天K10 Pro
470677384,一只柠檬,5,爱了，铁血夏推,,2025-03-31 16:36,荣耀 X30
514370470,悦悦,4,你好，为什么我登不进去了啊,,2025-03-31 14:31,华为CET-AL60
708282208,熙熙,3,入坑一个月，简单说几句我的感受。（只讲不好的，介意慎入）<br />1.带入不了，有割裂感（能带入的就划走，别喷）<br />2.恋爱感不强（感叹一句：主控超绝钝感力啊）<br />3.有点汁无聊（一直在卡关，过不了，主线剧情不太能吸引我，当初听朋友说是推理探案的才决定入坑的，但是主线剧情我并不太想过😐不过太无聊还是过了5章。喜欢过个人剧情，为了寻找恋爱感😘）<br />4.辩论的环节更是无聊至极😅（希望有10倍速通关）<br />5.游戏体验怎样主要看个人，自己玩了才知道好不好，对于新人想要入坑的，我不发表任何意见。<br />6.这是我这一个月的体验，如果带有片面性，勿喷。（不认同我的观点的可以走了，别在底下评论，我想清静清静，谢谢配合😘😘）,3,2025-03-31 01:56,小米24090RA29C
574022476,恒念,5,主线剧情感情线有点少，但是别的恋爱感还是较强的，四个男主互相是朋友都是挺新颖，总而言之，喜欢就好՞˶･֊･˶՞,,2025-03-30 23:41,Vivo V2059A
355198691,User355198691,3,先给个3星，自适应做不好,,2025-03-30 21:30,Vivo IQOO Neo9
647535966,最爱格蕾修,5,em...玩这么多米哈游的游戏第一次给评价，先说一下我本人是学生党，多坑，但是未定是我见过的新手里较为友好的，也不是说其他的不友好，只是我更适应他这种吧。相信玩乙游的多多少少听未定的端水能力，确实是这样该好的好，差的也不差。角色特点鲜明，主控的情商真的很好！没有傻白甜女主！在一些案件里，该反驳反驳，不会因为对面是帅帅的男主而手下留情，很对自己的辩护者负责。虽然刚入坑，但是米哈游的抽卡没让我失望！第一次十连双金！比较建议学生党入，因为他目前并没有什么比较氪的地方，周边下个米游社就好了，虽然到货慢，但是好在工艺好啊<br />💘恋爱感：<br />直接满分怕米哈游骄傲扣一分<br />💎资源获取：<br />em....没什么瓶颈<br />☄️成长体验：<br />唯一不足的点，可能就是对于只想获取资源的姐妹来说过主线有点慢（反正我是为了找线索，一字一句看完了的）赶时间的话，可能就不太得<br />反正不崩卡，端水，轻松恋爱，顺便考个律师证，都没问题,5,2025-03-01 01:58,Vivo V1836A
58860682,呜呜又薯了,3,米哈游，你想干啥😄给我号干成新号了？,,2025-03-30 00:43,vivo Y200i
602793047,mebujeooo,1,你丫的 未腚你想钱想疯了吧,,2025-03-29 20:22,未提供
537934766,发家致富,5,今年是玩的第三年了，从最开始的喜欢夏彦，到现在依旧最喜欢夏彦，中间也有卸载过几次，但都在几天后又下回来了，主要是因为日常任务真的很轻松，大活可能会做久一点，但小游戏还是挺好玩的，玩家也很友好，以后也会继续玩下去。希望可以多出日常陪伴的功能。,,2025-03-28 22:24,小米 Redmi Note 9 Pro 5G
449591273,淼淼,5,我是很喜欢的推荐,,2025-03-28 19:34,Honor Play 40 5G
3140148,正在接受治疗,2,恭喜你抽到差评卡，加油叠满5星好评哦。<br />好好的周年庆搞成这个样子，真有你的啊资本家。<br />——————<br />25.03.19<br />才发现原来当初退坑时还特地来给了1星啊。<br />我又回来了，依然大保底，我又退下了，还在玩没跑。<br />未定卡面太稳定，感情循序渐进，单看剧情，依旧是我的快乐老家。<br />没有什么硬要抽的卡，重要设定主线，单人线都有说明，这点非常好，至少不会让我成为☁️。<br />单推资源也很好攒，虽然我是all推……<br />左然配音问题各位律师小姐应该都已经反应了，马哈鱼你看着办哈😄。<br />每次活动的小游戏我都很喜欢，除了故城的小车和大富翁。<br />然后话又说回来，为什么次次大保底？马哈鱼！looking my eyes！！！tell me！why baby why！<br />——————<br />25.03.28<br />又来了又来了是吧，搞个高贵的MR卡，红豆又吃多了？<br />上次就是因为SSS卡退坑，这次回坑给你好脸了是吧。<br />为SSR氪200多我认了，一张MR搞这个价？还是纯语音卡，有这个钱我干什么不好。<br />还有那个甜心系统，没有任务我点都不想点，衣服还要用晶片买，我宁愿留着抽卡，沙龙虽然也废但是好看多了，还能看小人……<br />越改越差，真是没意思。,1,2023-07-18 14:21,未提供
498741884,Yiiii,2,我们未定是这个👍，全年无崩卡，一心只搞纯爱，单人卡池。只是一直保底呵呵，生煎包过来吃我两掌<br />二编：去年还夸你呢，今年就开始犯贱，吃相不要太难看，一张mr最少要160，还要肝满三个月。你是借了高利贷还是什么，想钱想疯了。客服改口也是快啊，本来是说能免费拿，周期长一点也没事。后面又是只能充绮思啊，你这绮思有根毛啊别人会想买，有点看头的背景也改成了无人在意的娃衣。另外我是夏推我觉得夏彦360度无死角的帅，但这次大家都是西装正脸就别给其中任意一人搞特殊了吧,,2025-03-13 07:58,Honor X50 
605314585,你好,1,捂嘴最严重的游戏，你问为什么？因为我发了两次评价全被投诉了😅,3,2025-02-20 16:17,三星Galaxy Z Fold3 5G
16820035,顾怀词,3,左然，嘿嘿*:ஐ٩(๑´ᵕ`)۶ஐ:*<br />我就是贱的，狂吃谷，游戏退游了，结果吃谷依旧能花5k+的（  ）,44,2023-08-30 13:57,Honor 80
406722903,清醒夢,5,明明四个宝宝都很萌！这个生煎包你明年一定要去拜一下好吗好的,,2025-03-27 00:43,OPPO Reno10 Pro+ 5G
104658375,手机用户104658375,5,不管是剧情还是立绘美工都很OK，少看点代三党的言论，自己代入不进去就不让别人代入女主是吧？别太离谱，都不玩了还来秀智商，能不能离正常玩家远点？<br />😅还有好多吐槽主角立绘太难看，不是阿Sir，你自己代入不进去无差别踩其他玩家呢？<br />以及还有一些人，这就是你们说的美术不行？前两张是游戏里面插画截图，后一张是官方的生日贺图😁,7,2024-03-09 21:40,Honor Play 40 5G
318719742,流泪luca头,5,非常非常好！虽然有一些小瑕疵但是夏左莫陆真的好萌好萌,,2025-03-25 20:22,OPPO Reno10 5G
61156319,泠汀,5,2025年重新改分 把3分改回5分了<br />啥也不说了，什么时候把游戏做得更好了再来改分，什么时候能认真听取玩家意见了再改分，什么时候主线和个人线更新速度提上来了再改分<br />有幸参与三测的玩家回来补个分～<br />对游戏的建议和意见都在问卷里写了，写了超级多，这是我第一次那么认真写游戏评价<br />还有！希望能有个短信迎接一下参与过测试的玩家们啊！<br />最近广告这么多，是不是要公测了？我准备好了！<br />官方竟然回复我了！那我就再多写点儿评价吧。<br />1.女主性格很好，还有智商在线，会吐槽我很喜欢，请继续保持这样智商在线的女主！不要因为恋爱而变成傻白甜之类的<br />2.卡面画风不用说，都是非常精良的。而且sr动态卡面卡竟然有独特的背景音，这点真是十分惊喜<br />3.配音我觉得很合适啊，就是希望sr卡也能有语音，不用全语音，只要男主们有就行，嘿嘿嘿<br />4.剧情三测时还很少(4章)，不过铺垫应该很多了，期待以后的发展。<br />问题的话，我相信官方那边已经收集的差不多了，我就不说了，只有一个问题很重要，我想再提一下:<br />就是莫弈的人设。在这里我也不多赘述了，有很多大佬们的分析都很精彩也很到位，相信官方也都看见了<br />目前，这是我最期待的游戏了，相信公测时，可以给我们一个惊喜，最后感谢制作组给我们带来这么优秀的游戏，辛苦啦～,8,2020-06-26 13:57,未提供
63488059,若我诗织,5,很早之前大概两年多前开始玩的，那时候只玩过光夜这一款乙游，再接触到这款游戏时，感觉主线玩的好累，而且美术我很不喜欢，再加上抽卡实在是太非了，所以就玩了一两个晚上退游了，后面断断续续回归过两次，每次都是上线看一下就退了，有幸抽到了陆景和的第一张3s卡！我后面正式回游后看了剧情也是超级喜欢，但是那个时候其实也没有去看卡面剧情，每次来都是匆匆离开了。<br />直到去年12月中下旬我才正式回了游，其实还是因为没有游戏玩了，所以跑了回来（这时候早已经退游了光夜和刚退游深空）。我感觉其实美术真的进步很大，很多卡面都好好看，这也是留下我的一大原因。<br />玩到现在我感觉未定真的给我一种很不一样的感觉，就是那种很温馨很安心的感觉。有一张夏彦的卡，就是那个铲雪吃饺子那张，剧情是说我和他在回去的路上遇见了大雪封路，然后我和他一起帮助工作人员安抚群众和缓解状况，我本来觉得其实以我的性格我肯定会烦死，哪还有心情来帮助别人，但我这个想法一冒出来我就觉得这样或许也不对，因为如果说陪伴在我身边的是夏彦，他这么好的一个人我当然愿意去向他靠近。还有很多我觉得很好好甜蜜的剧情，有些时候看到了真的会热泪盈眶，未定文案还是太厉害了！<br />再加上未定是法律题材主线，本身就比较有意义，但是我时常觉得自己好蠢，这个真的是对不住了。但是有时候真的会给我一些震撼，就比如说，一个受害者在长期遭受迫害的时候一般很害怕施害者的报复，而害怕对施害者进行反抗，我记得有一个男主说（真的记不清是谁了，到底为什么我记性这么差），他说应该让施害者更加害怕如果我再次犯罪犯法会受到更加严重的惩罚（应该就是这么个意思哈）。我真的那一瞬间感觉到的是原来还有这个角度吗，这一刻我感觉真的好悲哀。<br />再就是我感觉未定真的是一个很和谐的家庭，我觉得不仅是男主们，我们玩家也一样都是一家人。我感觉好像没有什么各推之间的矛盾，没有什么玩家间骂来骂去的事情（也或许是我不关注？），我平时不怎么关注游戏之外的事情，但是某游我不关注也常常刷到各推之间骂来骂去的事情，好像环境有点不太好呢。<br />最后真的很喜欢未定，最喜欢小陆总，感觉言语总是匮乏，无法道出你的好，只希望你越来越好，我要玩一辈子未定事件簿！（当初退游真的很后悔，现在补卡想死，我真的知错了꒦ິ^꒦ິ）,16,2025-03-23 17:49,Vivo Pad Air
548339153,枯枯菌,5,未定我一开始就是奔着律政手游来的，加上四周年联动看到米家各大官号在下面评论（感动好有爱的一家人）啪的一下就来玩了，也没考虑乙女游戏，这也是我第一次玩乙女游戏。<br />我觉得主线真的超级好看，每一章节，每一案件都是环环相扣的，节奏我认为比较快，（但是它主线更新的有点慢-`д´-我要看主线！！！！男主卡似乎是一个男主一个月左右出一张）案子对于人性的讨论真的很棒，让我不自觉的去思考当事人的想法，因为是现实题材吧，有时面对改变不了的事会有种无奈感，但也更坚定地告诉咱走在这条公平正义道路的意义，玩这款游戏我真的学到了很多。主线恋爱感确实不多，四个男人是在同一个背景，一个团队里的。我觉得很可贵的是，我从开始对他们都不熟，到认识，到最后的信任，我们一起经历了许多许多事，我们是互相信任的伙伴。男人们大事团结一致，小事修罗场~(＾◇^)/。<br />我中间有事退了三个月没玩，大概四个月的时间把主线和dlc过完了，卡没几张，云了几张 ，个人线和在一起的卡面剧情真的有在好好解决情感和实际问题！<br />男主的卡面真的很好看！美术超级好，对比开服的卡进步好大的！<br />未定不肝，平时没啥事可以做，每天就把体力清完，有时有小活动就做一下，主线过完就已经开始养老了－O－<br />抽卡需要的晶片前期还好攒一点，但后面没事做就没什么地方可以掘点了，靠清每日任务和活动获取。<br />游戏外，各位游戏好不好玩，都要靠自己去试试看，社区言论少逛一些，对身心健康！我个人体验没有不适，希望大家玩得开心，如果不开心那咱就不要玩了，你自己！你自己的感受最重要！,4,2025-03-23 13:09,未提供
429181984,ggggg,5,我超喜欢的啊，卡面真的米爆了，推理剧情也很有感觉！o(≧v≦)o,1,2025-03-23 12:37,iPhone 6 Plus
438656676,diporzo,4,live2d真的好看，可惜没有特别吸引我的男主，只是没有属于我的恋爱类型啦，属于每年看到好看卡面都会回来玩玩的，感觉夏彦塑造的还是很用心的，但我比较吃莫弈这一挂，结果玩下来又感觉莫弈塑造的我不是很难get到点，遗憾……而且抽卡资源有点难攒啊，之前微微氪也感觉不是很好攒出资源，没什么继续氪的动力了就，剧情也不错，不过逆転裁判玩法哈哈……我选择玩switch……唯一扣一⭐只是因为mhy，求mhy解绑任天堂教程……,1,2025-03-23 02:34,Huawei Mate 60 Pro
