用户ID,用户名,评分,评论内容,点赞数,发布时间,设备型号
606154545,谈苏,5,超喜欢！！！内测到现在虽然淡坑过但从未退坑过呜呜呜🥹<br />昨晚把新主线过了，好难过啊陈霆，一步错步步错，你过得实在是太苦了，作为父亲，陈金辰看起来似乎还有救，看起来似乎还值得期待，他会在赢钱后把你们接到城里过好日子，也会为了鼓励你好好学习买昂贵的奖励，但可惜的是，他是一个赌徒，良心是赌不起的，尤其是赌徒的良心，他们就像巴洛甫夫的狗，只要听到摇骰的声音就开始流口水，你赌了一辈子，还是赌输了，满盘皆输。最让人难过的是，你拼命挣扎的人生，饱受良心煎熬的一辈子，最后只要短短四段录音就能概括。你只能信仰柏拉图，相信“人的灵魂本来纯洁，住在天上的理念世界”，并以此审判饱受良心煎熬的自己，希望你能得偿所愿上天堂。唯一的慰籍是小周姐姐没事，她还有希望，她还活着呜呜呜呜是我们未名市少有的活下来的美人姐姐了，小周姐姐，你脸上的不是碎裂的蛛丝、束缚的蛛网，而是盛放的玫瑰。,,2024-04-29 19:01,Vivo X100s
696052721,CC呀,5,这款游戏整体来说是比较推荐玩的，剧情方面没的说，律师破案，内容很吸引人，个人非常喜欢，过关还是游戏中常见的抽卡什么的，资源获得不算难，其中还有一些小的内容的体验，总体还不错，里边内容剧情设计走向是抓人眼球的，还有跟各个男主的互动方面都是挺好的。,,2025-01-07 16:33,HONOR 200 Pro
33908156,多肉粉桃,5,小游戏好玩，美工不错,,2025-01-07 11:34,未提供
604119650,LwaiN,5,💘恋爱感：<br />莫推非常爱啊 卡面越来越好看了哈哈哈,,2025-01-07 00:02,未提供
552362601,邶,5,未定真的是细水流长的感情戏，个人很喜欢。,,2025-01-05 21:54,OPPO PGW110
695954263,林花谢了春红,4,本人是2024年七月中旬入的坑莫弈激推动态卡面挺美的，但爆率是真的太低了，刚开始抽，还好，后面就是100抽保底要吃死，缺点就是没有陪伴系统，一直跟官方反映，官方也没上，但画风还是挺美的，恋爱感一般，剧情不是很刺激,,2025-01-05 13:38,未提供
45763609,捏捏小鱼,5,2024.12.14入坑，目前入坑一周<br />震撼到我了，一上去12个复刻池，全部，都是，单人！！！！！！！（被某游戏一个接一个混池搞残的我又可以了）<br />一年一个混池，而且仅仅是双人混，据说是历史遗留问题需要端水才出的…<br />立绘，动画，live2d绝美，四个人都绝美<br />声音很贴，贴到震撼，四个人都很贴<br />我为什么才玩到这个游戏啊！！！为什么！！！！为什么！！！！！！！！<br />陪伴感巨强…活人感巨强…<br />45元解锁永久打电话功能！（点名有20小时cd的某传声筒，对就是你）<br />剧情量巨巨巨巨大…三观一秒钟都没崩过！！！！！<br />搜证破案什么的巨好玩！！！巨好玩啊！！！！！<br />不卡关！！！一点都不卡！！！<br />资源巨多！！！目前三张ssr，还攒了一万钻+20个泪，我才入坑一周啊！！！还零氪了三天，第四天开了个小小月卡！<br />未定事件簿，我不允许任何人忤逆你！！！<br />二编:<br />活动池居然前20抽八折…<br />通行证升级就可以获得下次通行证的折扣券…<br />然后还有半年卡，天杀的，125元15600钻…不是…不是…😭😭😭<br />大富翁太好玩了啊啊啊啊啊啊<br />三编:<br />单人池居然前10抽也是八折！<br />而且这个池子我的天哪，一般歪卡是不是会重置保底数？（反正我目前玩的其他游戏都是），但是这个游戏！重置保底数的前提是，你如果拿到新卡才会重置！！！<br />也就是说，如果你有了陪跑卡，无论怎么歪，歪到满星，保底数都不会充值！！还是100！！！<br />在隔壁四人周年庆混池狠狠吃了三个大保底还开箱子才叠1星的我现在就是想哭，我会永远爱你未定事件簿！<br />mr卡复刻翻牌子2200钻立得，好香,27,2024-12-21 15:36,三星Galaxy Z Fold6
567158467,金叶榆,5,伟大生煎包我不允许任何人忤逆你😍,1,2023-08-28 18:53,未提供
544052326,逸点点,5,卡面是不崩的，官方是会端水的未宝继续加油😙😖,,2025-01-04 17:58,Honor Play 5
420806854,可乐喵,2,50抽下去5个sr，剧情也好寡淡，女主一会勇一会畏缩，一会智商在线一会不在线，也不能跳过，自动也不能倍速。也就卡好看还抽不到。,8,2025-01-03 12:49,小米13
435122262,六个核桃,5,我要玩一辈子伟大生煎包！（发电）,,2025-01-02 23:45,华为FIN-AL60
636135620,待到风起时,4,这游戏 咋说呢 (个人觉得)耐玩性不高<br />我是夏推 当时刷视频刷到夏彦 比较感兴趣 就下载了 刚玩那几天 恨不得24小时不间断的玩<br />后面就淡游了<br />原因:每次夏彦的卡都很戳我 但那个晶片(好像叫晶片吧 退游太久记不清了)真的好难获得!!!(个人觉得)只抽到过一张彦子的限定卡。。。剩下的每张都没抽到。。。而且一直卡关 。。。剧情没法推进 感觉可玩性不高<br />差不多每天都是这样 慢慢就淡游了<br />几乎每天上线做做任务就光速下线了 后来有段时间由于比较忙就没有上线 再之后就没玩的欲望了 然后就删了<br />总体来说 它算在好玩与不好玩之间吧 可以稍微氪一点 不然资源根本不够。。。(本人学生党 没钱氪)可以尝试玩一下<br />最后<br />愿夏彦长命百岁 平平安安,17,2025-01-02 21:05,未提供
126219262,Polaris,5,真的特别特别棒，米家的游戏我就没有不玩的。<br />🌃画面音乐：<br />美炸了，每张卡我都很爱。<br />💘恋爱感：<br />我爱夏彦，我爱夏彦，我爱夏彦。,,2025-01-02 19:20,未提供
480586217,再睡一夏,5,玩了很久的未定了，真的觉得未定是一款很好的乙游，并且今年还有全年无崩卡的伟大成就！超级无敌端水，卡面超级无敌精致，棒棒棒！！！！伟大生煎包！！！！,,2025-01-01 23:01,未提供
543585460,苏叁碎,5,卡面精度很高，除r卡全是动态卡面，nxx合家欢，喜欢证律推理题材可以入(σ′▽‵)′▽‵)σ,1,2024-12-31 12:04,Honor X20
605972844,洛灵,5,伟大生煎包！我要一辈子缠着你<br />NXX是个温暖有爱的大家庭，友情，亲情还有爱情，都能够体验的到，那种生活的细水长流，淡淡的温馨感真的很戳我  哈特软软，还有QQ人我吃   谷子价格也很美丽   社区氛围很好，有粮吃的我就是个幸福的小女孩,,2024-12-30 22:41,Vivo X90s
428408398,改了名能中奖吗？,5,细水长流的感情线，对单推人特别友好的卡池机制，不断进步的卡面，有趣的活动，除了早期卡面外无崩卡，我就一句话，与其听他人评价，不如亲身体验,,2024-12-29 20:06,Honor X50 
565675486,拾明,4,是萌新。。 七八月份暑假入坑的 游戏还是很不错的 不过就玩了一个月就退坑了 现在才37级<br />本人因为探案悬疑的点入了坑 刚开始还好 过剧情特别爽 一个一个案件看的很舒服 一天能泡在里面好几个小时 但是后面卡关特别难受 我本身就是偏剧情党 对剧情很执着。。看不完就很难受 但是养卡用的东西为什么一天只能刷两次？？？练度也提不上去 一关要跨几百的练度让我这个卡着最后28点血过的雪上加霜。。我一直练也提不上去。。后面卡的太难受就退坑了 求大佬指点！！！！！<br />这段时间有点闲又回坑了 活动给的东西还是挺多的 一个卡池的时间能把卡给肝出来 单人池真的加分。。<br />本人比较喜欢陆景和 但是陆景和是不是中间换过配音了 感觉现在陆景和的声音有点怪怪的。？陆景和和夏彦真的很戳我。。每一个男主都特别好！！！<br />不得不说剧情有点小刀 悬疑很戳我 剧情很缓慢 有种慢慢认识慢慢了解的感觉 在另一个游戏中（没有说他不好的意思！！！）感觉还没怎么熟卡上就已经谈上了？？？总之有点怪怪的 未定这个点很戳我 没有快餐式恋爱的感觉<br />0氪党 后面可能会入月卡 目前只有两张陆景和ssr 但是感觉福利都挺不错<br />最后 有没有哪位大佬教教我怎么才能不卡关！！！我现在还卡在伥鬼（下）那里。。真的卡的我好难受 剧情都快忘光了还没有过关。。,11,2024-12-29 16:57,未提供
418535768,nana,2,重新下载后，我的记录全没了，算了,,2024-12-29 14:56,小米Xiaomi 14
423028101,夜,5,伟大的生煎包!我不许任何人忤逆你!<br />💘恋爱感：是所有国乙中进展最慢的（最正常的—个人认为）是一种细水长流的恋爱感，慢慢了解喜欢上男主<br />💎资源获取：<br />可以到达零氪的，对单推人非常友好，但是每个男主都会有死亡排期（男主生日前后会有活动或者新卡）<br />🔖运营服务：<br />非常友好，运营淡淡的玩家也是淡淡的，社区氛围超级好（入坑一年多了除了女主党事件，3周年插画奇怪视角都挺好的）<br />总的来说未定事件簿是冷热门，流水正常，排期正常，每次的卡都会复刻，现在还在不断完善以后也会越来越好的，我们NXX是很好的一家子,28,2024-12-29 00:06,Vivo V2054A
528386789,多次表白陆知也,5,时隔一年我又来了<br />💘恋爱感：<br />有点恋爱感，但感觉不多(｡ì _ í｡)<br />短信和视频有点少…男主也没有朋友圈啥的<br />NXX就像是带着恋爱的工作侠们（思索）<br />但我还蛮喜欢男主卡面剧情的 文案组上大分(๑`･ᴗ･´๑)<br />💎资源获取：<br />米哈游……晶片获取途径太少啦……<br />晶片根本不够用…˃ ˄ ˂̥̥<br />但是活动中可以拿到的晶片也不少就是了<br />👂🏻声优：<br />左然单推人 个人xp就是人夫呀嘿嘿<br />还是一如既往的……<br />声优老师们！我是你们的狗！ヽ(〃∀〃)ﾉ<br />个人觉得男主们的配音真的很贴！听完之后原谅了全世界嘿嘿嘿<br />😍想对老公说：<br />我是左然单推人，所以左然推/梦自避<br />左然人夫感满满的！符合我对爱情的美好向往！我要为左然玩一辈子的未定事件簿！这辈子都逃不出人夫哥嘿嘿嘿<br />左然左然左然！！！小哥好辣呀！！！！<br />嘿～（吹口哨）一个人啊？害不害怕啊（摘下墨镜）跟姐一起呗（单手撑墙）（右腿弯曲绕道左腿后面）刚刚～在那边看到你，感觉～～你的样子～还蛮辣的(低头轻笑)<br />左然我爱你 每年都要一起呀<br />🎮可玩性：<br />可以玩的 卡面是不崩的 老公是帅帅的 活动是多多的 题材是可以的<br />但是这个游戏女主党和男生玩乙比较多，我比较膈应啊（也就是讨厌的意思）<br />（悄悄告诉你们一个秘密：有一次问卷我填的性别男，那次古风婚卡我53抽all in噜（十抽出左然，两抽出莫弈，二十抽出小陆，最后的第53抽单抽出夏彦）●▽●欧的可怕。。。,6,2024-04-20 16:52,未提供
39812568,骆驼的稻草。,5,除了老师大保底，其他无敌,,2024-12-28 12:18,未提供
512951126,有点emo.,5,💘恋爱感：<br />太好啦，永远爱小陆总！<br />💎资源获取：<br />一点都不肝,,2024-12-28 11:51,Vivo IQOO Neo3
9023015,rot,5,知道这个游戏但是从来没有玩过 身边的朋友也都在玩 心血来潮想下来玩玩 入坑第二天就出了半年卡 小📕搜攻略说买半年卡和月卡很划算 就买了半年卡和月卡<br />第一次抽限定池虽然歪了（幸好也只是20抽内出的非自推还是两张，emmm也算是幸运吧）反正最后大保底还是抽出自推了 果然新号就是欧一点吧<br />还有最后就是这个游戏时长根本不对啊 天杀的taptap我恨你 翻了一下相册就截了两张大富翁游戏的截图 就随便放一个上去吧<br />💎资源获取：<br />我是月卡党 资源就是还好攒攒也是够用<br />💘恋爱感：<br />挺好的 目前还在摸索阶段 就是我刚入坑很多不太了解 可能卡面剧情我不太接的上 后续会慢慢补课的,,2024-12-28 02:42,未提供
399278555,梦瑶,5,怎么说呢，大部分乙游都玩过了，只有未定坚持下来了，萝卜青菜，各有所爱吧。希望伟大生煎包越做越好,1,2024-12-28 00:06,Vivo V2061A
107347642,梨芙芙,1,男主好，但是女主党太多，很多卡牌男主看着主控，主控却笑着看屏幕，主控的个人喜好也挺鲜明，跟屏幕外的我们很多喜好都是冲突的，销号跑路了<br />还有主控的个人南凝脚卡，还改卡的机制，官方不作为也不回答，奖励好评，分期给你,16,2023-09-17 23:34,OPPO A96 5G
381721692,识檐,4,22年接触到现在<br />抽卡资源获取难度高<br />自推卡天天保底<br />陪伴系统约等于无<br />没有什么缺点卡面完整度很高  买了月卡一年也能拿几张自推的卡  给我一总慢但有自己的节奏<br />祝你越来越好未定事件簿,,2024-12-26 17:19,OPPO Reno Z中国版
33622329,手机用户33622329,5,开服玩家，我唯一坚持玩到现在的乙游。无论是男主、卡门画风、卡面故事、主线剧情、“我”的人设都非常好。,,2024-12-26 13:48,Huawei Mate 60 Pro
500854254,zzzzzzh,4,一编：一星给主线一星给男主们<br />想捞钱吃相也好点吧，看清楚具体受众到底是谁，乙女游戏策划组♂的别来沾边我没开玩笑<br />我进一步→你退一步←像滑稽的舞步💃🏻💃🏻💃🏻💃🏻💃🏻💃🏻💃🏻💃🏻💃🏻💃🏻💃🏻💃🏻💃🏻<br />二编：今年一整年都乖得离谱，画风也有了质的飞跃，重点是文案剧情终于好起来了啊（泪目），尤其是左然的卡，校园大活和古婚大活都最爱左然的剧情，铁血夏推已然变成夏左双推(=^▽^=)<br />提两颗星加以表扬，最后希望下次周年庆补药再有节奏了，生煎包你乖一点，外面的人也别盯着米乙拱火了🙏🏻就酱,1,2023-07-15 01:55,未提供
558167839,把盛夏埋在雪里,4,💘恋爱感：<br />细水长流的感觉！！真的很喜欢这种平平淡淡的日常🙌🙌🙌暖暖的很安心😚😚<br />🔖运营服务：<br />未定叔叔可不可以把爆率提高一点，求求了求求了求求了🥺🥺🥺,,2024-12-24 22:24,华为CTR-AL20
458786678,九殇,5,怎么说呢？从国外服转回来的玩家吧算是。不知怎么回事，慢慢就不想继续了。可能是因为连续好几次的保底。也可能是因为恶心的叠卡机制，突然失望了。<br />——————————————<br />好吧，春节忍不住回坑了然后玩到现在， 感觉现在心态都好了不少，微博删了之后耳根子都清净了。三周年那个卡也是抽了目前已经解锁所有互动了，肝一肝还是能肝出来的，所以收回之前的差评。一整年都不崩卡非常满意，今年也没有作妖。开心,,2023-10-01 21:43,未提供
431761570,蓝小莓,5,全年无崩卡，懂得都懂,,2024-12-24 13:05,OPPO A7x中国版
358765366,戴面具的猫伯爵,5,很喜欢，是一种细水长流的爱情,,2024-12-23 23:55,一加手机Ace 3
28060168,不见,3,兜兜转转两年，从开服入坑到退坑一年，试了其他乙游。到底不如莫弈让我挂念，所以又回来了<br />三周年退坑，总之就这样,4,2021-02-27 09:25,小米24117RK2CC
473066923,千惠,5,米家游戏特有的肝<br />老米，我还是爱你的😘,,2024-06-09 03:44,荣耀 X30
645598398,谬可,4,喜欢😊买了半年卡,,2024-12-23 01:00,OPPO PHM110
682771134,Tanya,4,好玩，喜欢弱推理的可以入坑，主角脸有点幼，其他都挺好的,,2024-12-22 22:54,Honor 80 Pro
606033789,无,5,谁能告诉我，这是什么意思？😭😭,,2024-12-22 16:58,OPPO A56 5G
354861266,小伊大王,4,刚开始玩…资源好难攒…,,2024-12-22 13:20,Honor 90 Pro
549487757,123,4,如果你对陪伴感和剧情没有什么特别大的要求你可以尝试。<br />端水很平，画风稳定，陪伴感没有这么强，有的文案可能会抽风，就例如三周年……<br />整体还可以，类似于你越玩到后边，你越感觉舒服<br />抽卡机制还行，但是萌新可能接受不良好，如果对这个游戏感兴趣，一定要坚持到后期！！！,,2024-12-22 08:48,华为Honor Play
633584600,阿哈,5,这个游戏是我乙游里面玩的最久的，画风是我喜欢的（话说米家的画风我都喜欢），而且官方很端水（nxx就是一个温馨的大家庭）平时没有活动时上线几分钟就全部做完任务，虽然每天没有消息互动，但对我来说就很方便了，毕竟还有其他事情要做，如果明天上线都有一堆消息要处理，恐怕我坚持不了几天。资源方面，我氪了月卡，如果我是单推人，那资源绰绰有余，但谁叫他们都太好了呢，看到好看的卡就想捞出来，资源就攒不住了，唉～,8,2024-12-21 22:46,Vivo S16
40121292,乐安,5,我是个卡面党，基本不过主线剧情，可能也是因为不想看太多字吧，还有就是主线是和所有男主一起，我就只想看我推，但是我看别的律师小姐们对主线剧情评价蛮不错的。<br />我的目标就是抽卡抽卡抽卡，卡面剧情也很好，很温馨，像平平常常的小生活，个别会有虐的，哈哈哈，有时候虐一虐让人上头啊。<br />资源还算好攒吧，我是单推，之前一直是零氪，不补卡完全够了，最近要补卡所以充了月卡和半年卡，也蛮划算的，加上日常奖励一天能有一抽。<br />未定每年都会有几次大活，大活剧情也都蛮不错的吧，就是走地图有些无聊啊，适合打发时间，我记得当时玩飞雪落红尘的一个小游戏给我红温了，好难好难，最后让我朋友给我过的，不走地图的大活也会有别的游戏方式，也都很有意思，就是蛮肝的。<br />我玩未定最红温的时候就是玩2048和走地图的时候，以至于后来我还专门下载了2048练习，别的方面都很好，它就小游戏难一点，不过有很多善良的律师小姐无偿帮忙过。<br />还有就是我玩游戏一般是不会去骂游戏的，基本就是爱玩玩，不玩就卸载，我记得好像就我入坑的时候出了点乱子，后来就没有，这一年也是安安稳稳的。最近圈子里也不太平，有游戏出了事，我就突然想看看未定的评分，还算好的吧，正好没写评价，就补了一个。<br />总之就是在未定的小家里安安稳稳的过着，不看外面的吵吵闹闹，稳稳的很安心。,8,2024-12-21 22:35,未提供
544487708,吖豁吖豁,5,很喜欢，里面还有事件调查和辩论，非常喜欢<br />👂🏻声优：<br />剧情人物声音都不错 也符合情节,,2024-12-20 18:29,Honor Magic3 Pro 5G
534814141,一只魚.,4,可玩性也没啥可玩的，就过剧情养卡啥的，卡面毋庸置疑，好看，然后抽卡方面宝底100抽一张，还会歪，但是是歪自推的卡。<br />然后对于女主党，前段时间这个争议很大，我倒没觉得啥的，刷抖音也没刷到真正的女主党就见到一旁人在那吵，微博就不用说了哪家乙游都有女主角党，我一直不理解那些咯噔姐，为啥要我怀疑把自己想成第三者，我看到还有人说我玩日乙女主有名字我都没觉得有蔷薇这个没代入感，就挺离谱的，日乙一般都有女主党把她当做独立的个体而且是很正常的事，为啥一到这就没代入感了呢？这不纯黑吗？<br />还有那个四大国乙被踢了两次，我是真的想笑，咋给人家踢了，又踢了一次？有事的时候又把人家未定牵上。<br />主线桩桩件件都是现实中的，很敢搞哦，我印象最深的就是孔茉莉的那个（应该是叫这个名字吧）<br />攒资源那肯定是没有光夜好攒的，抽卡我个人觉得容易歪，还容易吃保底，当然了也是我非，我是光夜玩惯了，然后玩这个觉得资源没那么好攒，然后后面不玩了的。<br />对了，还有那个陪伴系统，米游社国际服原神 崩铁都有陪伴系统，未定游戏里没有，米游社居然也没有,1,2024-12-20 11:34,HUAWEI MatePad SE
98513137,姓顾,4,开服玩家想看看自己的时长，结果显示一分钟？非得从tap启动吗😂<br />✍🏻建议：<br />二周年是永远是巅峰！！！<br />三周年就是一坨！！<br />四周年水准回来了，就是要温馨日常向的，不要想着搞瑟瑟了，而且容易画成四爱向，雷四爱！！<br />💘恋爱感：<br />铁血莫推，今年的生日卡画得非常一般尤其对比了夏夏之后，但是剧情还可以了解了莫弈的过去。<br />但是卡面不行。<br />💎资源获取：<br />这次冬愿节四人都很好，但是混池啊啊啊，保底歪别人合理吗，资源必然是难获取的！,1,2024-12-20 11:12,未提供
16970641,暮笙,4,2024年末总结<br />本年度左然无崩卡，神卡×n<br />今年的伟大生煎包强的可怕 往下回顾了一下前几年的评价，我算是看明白了，偶数年夸奇数年喷，这也要端水吗（）伟大生煎包明年周年不要整幺蛾子了嗷<br />今年的活动都很棒 卡面无可挑剔，剧情因为很不错，谷子更是貌美到kuakua买，谁懂啊<br />————————————————————<br />2023.7.17<br />现在心情很复杂。<br />本来前一天看完直播pv上头又去充了张月卡，结果第二天sss的抽卡新机制当头一棒，从来没见过乙游卡面还要命座的，怎么的你游是以战斗为卖点的吗？！谁缺你那点战斗力啊？你那sss是能一场战斗一直打的吗？您这抽卡消费也太贵了吧？单推想要全部内容就得500抽，all推2000抽，你自己看看这合理吗？还出1000抽的礼包，怎么的，下一步是要增加100抽的抽卡按钮是吧？策划的小脑瓜怎么长的？这样只会劝退别人不会给你涨多少流水知道吗？本来美美的三周年应该吸引一堆人入坑，结果现在连老玩家都要留不住了，笑死。那个钥匙挂件和名片要不是被喷得厉害还不会改，本来就应该是随卡赠送的东西，硬是扣扣搜搜，周年庆是回馈用户的，不是让你用来试探玩家底线的，逆子<br />—————————分割线————————<br />2022.7.15<br />时隔一年再次来填写一下评价。<br />刚刚看完二周年直播，不得不感叹未宝实在太会了！是求婚！是求婚啊！！！这个卡面的精细度和惊喜度都太棒了！呜呜呜虽然之前总吐槽池子改了，而且非酋总吃保底还叠卡，但是剧情和卡面真的好香啊😭是单推人都想all的程度 而且这种细水长流循序渐进的爱情真的好戳我啊呜呜呜 他们所有的感情都是有迹可寻的 真的让人感觉自己是被深爱着的 看这次pv我全程捂着胸口化身尖叫鸡 awsl抽！都tnnd抽！我可以我都可以！<br />未定！你 是我的神！<br />—————————分割线————————<br />2021.8.19<br />一星给美工 一星给左然 一星给cv老师<br />刚更新，抽卡快抽出脑溢血了，过来评论下<br />这个新机制我真的吐了<br />周年庆已经快把我之前攒的所有晶片花光了<br />我还只是双推只抽两张卡，感觉四张卡集齐得倾家荡产<br />这次活动复刻也是，合着就没有18000晶片就不配下池呗，未定物价是真的高，保底100抽比隔壁原神还离谱<br />一张邀请函还卖98真就把玩家当韭菜割了一茬又一茬啊 还是之前免费的邀请函 萌新就该被宰吗<br />当作老玩家福利打个五六折卖他不香吗 但凡便宜点也不会有这么多人骂<br />还有战力的问题，活动的战力高到离谱也不是一次两次了，别说新人，连咸鱼开服老玩家都打不过，看着奖励领不到是真的难受<br />还有策划……算了，一言难尽<br />最后我要吹爆四位配音老师，赵路yyds！！！,47,2021-08-19 16:50,未提供
491039785,xcvbn,5,想吃好的来未定准没错,,2024-12-19 13:15,未提供
38241032,雏兔,5,不要拿未定当拐杖,,2024-12-19 12:16,未提供
674125855,duduud,5,就是抽卡要100抽，可能出的还不是自推。其他的我都挺喜欢，都还行<br />确实很甜，真的特别甜。,,2024-12-19 12:02,未提供
583939482,饿死也比喻乐,5,伟大生煎包！,,2024-12-19 12:00,Huawei nova 8 Pro
108550901,梦之回殇,5,永远喜欢夏彦~,,2024-12-19 11:28,Redmi K60
122738207,User122738207,5,不多说了，小莫快要全图鉴了。加油,,2024-12-19 10:17,Vivo X80
544217899,折枝,5,我们未宝糊糊的很安心😎😘😘😘,,2024-12-19 08:48,Honor 70
664208939,青青,5,破游戏玩着玩着进不去，游戏本来就bug多,,2024-12-18 21:44,Vivo IQOO Pad2
120157970,曼曼长路,5,开服玩家了，玩的是b服。这一年未定都没有卡是崩的，希望未来也可以一直陪伴莫莫😘😘😘,,2024-12-18 13:52,Realme RMX2051
71733543,温周行絮,5,超级喜欢画风！小游戏也都很好玩！米家游戏适合单机！,,2024-12-18 11:05,未提供
