用户ID,用户名,评分,评论内容,点赞数,发布时间,设备型号
21541299,觅宇,4,我来更新评价啦，今年118之后回了好几个坑其中就有未定。目前卡在海奥森篇的最后一章，其实努力养卡也能过不过我比较佛系想多攒点资源一下推过去。主线文案保持了一贯的水准，卡面这几年基本没崩很难得。<br />现在小活动非常多对我这种喜欢小游戏的人很友好。也去尝试了之前的几个副本故事体验也很好。抽卡机制好像有修改？记不太清楚了，现在开了月卡和那个每天50晶片的卡，感觉资源对单推人来说基本够用了。算是玩起来很舒服的国乙了。<br />——————<br />主线已通，目前养卡中。<br />还得再改答案，首先要夸情节有想法，有很多现实问题的投射，比如第一个故事的修桥补路无人埋，第二个故事的心理疾病和娱乐圈乱象等等。<br />优点：画面好看，情节不错，探案玩法新颖，有简单的搜证环节。<br />吐槽开始：<br />主线也太短了吧，下次什么时候更？<br />我想要扫荡……<br />我想偷渡……140抽8个sr，就靠前30必出的那一张ssr走到现在。<br />能不能优化一下性能？？我麒麟980cpu 8g运行内存不算太差吧？玩一会儿就烫手，只有某些3d游戏能媲美这个热度。,3,2024-06-19 14:26,Xiaomi Redmi K60 Ultra
539348537,小陆总妻子呀？,5,可能对于别的人来说没有代入感但对我来说还挺有代入感的，我也喜欢我在二次元里长得漂漂亮亮的。不过出女主党这件事，我就被打成女主党了哈哈😂挺好笑的，我是小陆单推所以后来别人说未定女主党多我都不信，毕竟我正常玩家都能被打成女主的，那还有什么不可能呢？原来女主党多等于正常玩家都是女主党呀。在抖音刷视频也经常刷到，（我不玩都心疼你了）我不需要心疼，真的我吃的比你们想的要好技术方面我吃的是动态卡面全动态，除了R卡全动态男主动作丝滑流畅<br />💘恋爱感：<br />恋爱上我感觉我就是蔷薇，真的一模一样我就是会说那种话的人。（虽然上半年的时候文案出了点问题不过下半年就好了，我很搞不懂的是都这么久了，都快四周年了，为什么还会有人想三周年以前的事情，别家出了事一捂嘴就没事了，未定出了事好嘛一年了都还拉出来反复鞭尸）（对了，对于哥登小三姐的我只想说你都是小三了，可以别偷窥我和NXX的生活吗？别太暗恋我们）<br />💎资源获取：<br />1感觉也不用多说吧，之前b站有个up主算了一下，资源上面国乙未定排第二（再加上我是个月卡单推的我觉得超级好）<br />2而且今年出了未定立本，每天拿不用的狗粮换晶片和一张mr卡。（真的mr卡画出新高度，真的吃的太好了技术nb）<br />对了，评论这里看到几个其他游戏的解在搅浑水，说真的别太暗恋了阴暗臭水沟里的老鼠你推不会喜欢像你这样的人的。😃,19,2024-06-19 11:26,OPPO A2 5G
7947004,kyushu,5,三周年确实劝退了很多，但是三周年之后不管是卡面精度还是剧情饱满度都是一顶一的好看,,2024-06-18 23:04,vivo T2x
63553028,lian.,5,对单推玩家 ◔.̮◔✧，尤其是对我这种超佛系的单推玩家非常非常友好。可以看得见在最近的一年里，卡面精致度上升了不止一个高度，剧情也还算稳定发挥。,,2024-06-18 13:32,OPPO R11
30298406,初七,4,卖了一个号，又下回来重玩了，属于是天天肝不愿意，几天不肝又想念（）,2,2023-07-20 19:41,Vivo X Note
105718853,七月人间,5,卡面从不失误，音乐每次都很好听，主线剧情很吸引人，卡面剧情稍微逊色，除了每次都吃满100出，其它都挺好的。,,2023-11-06 16:00,华为 MatePad 11
99669822,纆云烟,4,啊啊啊啊米哈游什么时候给我改名卡😭😭😭,,2024-06-15 19:18,华为P20 Pro
4315204,泡饭好吃,5,国乙这么多玩下来最最最能留住我的，就是未定，卡面一直都有新惊喜，也不会画崩，贵是贵了点，还在可以接受的范围内。唯一比其他国乙不足的地方就是设定没有超能力，有时候感觉蔷薇太优秀了自己代入不进去。无所谓，我会自己编！只有未定玩家自己知道我们吃的有多好！,1,2024-06-15 15:39,华为P50 Pro
434110239,2,5,好玩！！主线很好www好爱小陆，最近回坑抽卡爆率好高我爱了，继续加油——,,2024-06-15 15:22,未提供
15428443,乐了细说,4,最近骚操作变少了，比较平稳，希望能一直平稳下去，不要给大家伙憋坨大的就行了,4,2023-09-11 20:47,未提供
497519585,秦艽,5,左律我唯一的牵绊😭😭😭,,2024-06-14 23:04,未提供
7454863,五。,4,删删下下 最后还是回来了 棕发蓝瞳大辟谷 我是左然你记住,1,2024-06-13 15:37,未提供
427493118,南风,5,喜欢看剧情，细节丰富，人物塑造成功,,2024-06-13 01:59,华为Pura70pro
19903718,咕咕咕飞了,3,5星给主线，个人线剧情和左然这些年的陪伴。<br />0.5星扣给改机制涨价等各种操作，0.5星扣给这三年崩了的卡面和故事，1星扣给永远保底的抽卡体验，1星扣给被伤害的感情。<br />最开始是三测玩的，本来对这种卡面画风不感冒，但是看律政题材很感兴趣就入坑了。被剧情吸引，兴致勃勃等到公测第一天就下载了。<br />最开始那一年真的是很美好的，虽然抽卡有点贵，我还次次保底，但是保底手段多，ssr不频繁，没有sss，也没有越来卖越贵的邀请函和背景。剧情好，人设好，和男主一步步发展感情的设计也很好。那时候真的有很多节奏，但是大家也很团结，同心协力怼回去。因为这个游戏对米哈游有了好感，去玩了原神——现在还在玩还加上星穹铁道（以前试过崩三不太感兴趣）<br />一周年改机制的时候跑路了，当时感觉大事不妙，抽卡机制这种基础的东西都能改这么大，后面还会有什么骚操作？不敢想。我这种次次吃满保底的人，根本不敢留下来，怕自己的钱和感情被策划糟蹋了。<br />虽然说是跑路，但也时不时被未定的新卡新剧情吸引回来……然后吃满保底再次跑路。直到这次三周年，因为前一阵子和朋友安利剧情上头了，加上pv真的做得很感人很吸引人，决定回坑，把左律的累充卡氪了，结果第二天看到具体的机制。一盆凉水破下来，冷静了。对米哈游的滤镜算是消失了，抽完周年庆的卡就彻底退坑，再也不见了。所以也留下一条评论，可能是想证明自己来过？<br />原和铁还是会继续玩的。但1.3和4.2过完就停氪了。及时止损吧。,2,2023-07-21 12:23,红米K70E
610903680,喜多川祐介,2,你游是唯一一个我耐不下心玩的乙游,9,2024-06-10 11:59,小米2312CRAD3C
25992553,霁月,4,现在恋爱感的加强基本上聚集在新sss卡上了，只要获取机制不像三周年那样作妖还是有一定可玩性的。<br />资源获取渠道还可以吧，最近小游戏活动都挺多的。<br />卡面基本上没话说，神中神live2d，保持现在这个画风，脸不崩题材好即可。加油二刺螈。<br />还有我想说绮思有点丑。像那种古早劣质小游戏的背景图。能不能改改。,,2024-06-10 08:55,未提供
585082653,球球大魔王,5,可玩性真的非常高，我是在2024年1月底才入坑的，到现在4个月，和小陆总在热恋期……米哈游不愧有一流的美工，卡面动态做的特别好，主界面的男主们也是骨骼动画，非常的流畅。新手期资源其实非常好攒的，目前我是拥有12张ssr2张sss，非常满意了。最戳我的是每一个男主角都有自己的个人线，未定篇，旖慕篇，约定篇等等等等……真的给人一种慢慢来的感觉……真的好爱，剧情也非常的紧凑有看点！希望米哈游后期能够多多开放一些晶片的获取渠道，让大家能够多上线肝一肝。未宝的日常确实好肝，上线两分钟30晶片下线hhhhhh,7,2024-06-09 22:14,OPPO PHM110
8870930,丸井,5,主线剧情我不记得玩到多少了，目前是卸载状态，真的没内存了手机。我感觉剧情超级好看，等之后换手机再下回来吧,,2024-06-09 21:59,华为P40 Pro
12363335,QQ用户12363335,1,💎资源获取：<br />没话讲，两个字逼氪，游戏官方吃相难看，排期太满抽卡资源跟不上，每日任务的奖励少到可怜抽卡概率太低，卡牌养成难并且容易卡关。,6,2024-06-09 12:53,未提供
70948980,Yolethargy,3,卡面很好看，人物比较美型，就是剧情对我来说有点无聊，游戏体验感一般。,1,2024-06-08 12:50,未提供
642226087,Lu,3,好 但是希望抽卡爆概率高些我要陆景和,1,2024-06-08 11:33,Realme V11 5G
361754252,cluhu,2,因为夏彦涨一颗星，但是游戏真的在一遍遍消耗我的热情,1,2023-08-29 17:19,未提供
435066577,顾子熹,5,陆夫人，玩了四年了，超爱，超推荐,1,2024-06-08 02:30,iPhone 14
436245251,´͈ ᵕ `͈,5,我是零氪党，目前44级吧，有6张ssr，很喜欢!为夏彦而来哦!主线很刺激，最喜欢之一，希望卡面以后能画华丽许多就更好了!😁还有，未定，你就不能改一下你那如同大海捞针一样的抽卡机制嘛，你知道晶片有多难攒嘛？我还没攒多久，你活动就一个又一个的送，我接不下啊🙉🙉🙉<br />温馨提示 ❗❗❗❗❗❗❗❗❗❗❗❗❗萌新不要因为“女主党”退缩哦!😉（反正我没看到过就是了，反倒是因为夸了皮套好看，就被骂成女主党的挺多的，因为我带入了，所以我觉得夸皮套=夸自己，皮套好看=我好看😌，但她们没带入，自己觉的不是自己，自己代入第三者视角，我能怎么办，自己带入不进去就换游戏啊！又没强制你玩，自己代入第三者给自己搞破防了，之后又要大肆宣扬说你带入不进去有多委屈一样，爱玩不玩😓）反正我个人觉得非常不错的，主线剧情是最吸引我的一个原因，入坑的萌新不要顾虑女主党的问题哦😘，感觉就是无脑跟风，博流量（流量确实高，圈外人不知道情况也来蹭，装正义人士说什么：连我一个圈外人都看不下去了😭）女主党只是少数，几乎每个圈子都有，但都是少数，可偏偏要抓住这些少数的不放，以偏概全，我只能说，你惹上未定，你算是惹上棉花了😒，关于“有没有代入感”这个话题本身就是无解的，就算有人带入不了，但也不代表全部人带入不了吧<br />最后警要❗❗❗❗❗❗❗❗❗❗❗❗👉请认真体验，平心而论，不要因为外界的因素影响了判断，还有谢谢体验😍,17,2024-06-07 16:24,OPPO A35
366969858,三敕,4,三周年卡掉率感人，互动做的很差，卡面剧情差，活动剧情部分内容低质，吃相难看。<br />————————————————————<br />分——割——线————！<br />这段时间新卡剧情8错，卡面也比较喜欢。😋<br />dddd<br />——————————————————<br />阿未的卡面一如既往的稳定，豪堪！🤓👍<br />すき！,11,2023-08-05 16:06,Vivo V2072A
70754460,未眠.,5,下回来了 周年庆卡不好看就要你好看<br />你也是见人！！！<br />米哈游你好事做尽！！！保持周年庆卡的美貌！！<br />未定事件簿 是我玩的第一款乙游。我是今年开始玩的乙游，现在算来三个月半了。但是我的主线什么的都打完了（没错又是长草期）。<br />首先，自从玩了米哈游的原神，我一直都信赖米哈游的游戏质量。未定事件簿的音乐美工都很精致，除了个别r卡卡面有些奇怪，其他的都很不错。QQ人也很可爱，已经对个别剧情NPC的塑造也很精美。<br />很特别的是未定事件簿给一些专有名词，难以理解的词语进行了整理，还方便玩家查阅，我经常感叹未定在文案上的良苦用心，涉及到多个领域，多类书籍。<br />人物的塑造特别成功，cv老师们的演绎都十分精彩，都很喜欢（还有姜sir yyds），只是刀子也是一如既往的多，那些不确定的因素还等着在后续剧情了解。<br />扣掉的一颗星是因为美中不足有这些:<br />1.主线更的慢了，乙游都是需要大量的主线剧情的。但是卡又出的很快，晶片的获取渠道不多，我是每个月都有月卡的，很难想象那些零氪的姐妹怎么有动力玩下去，其实抽卡的掉率不高，特别的比较非的姐妹，我个人是还行，没感觉。只是未定评分不高的原因都在抽卡了。<br />2.活动对于新手很不友好，活动难度应该按照玩家当前等级量身定做，让萌新也能参与到活动中。<br />3.手机的聊天少，和男主的互动不多，加。,11,2022-03-17 23:21,Vivo V2203A
3471921,Orαsa,5,开服玩家，经历了前中期的波折之后，现在是越玩越喜欢、运营越做越好的状态。<br />这么舒适的游玩体验在手游里非常少见，在国乙更是罕见，仅有此一例。<br />希望未定越来越好～,,2024-06-06 21:08,华为 MatePad 11
106747486,晚榕易碎,5,超级好玩，非常非常喜欢，是我第一次能够玩那么久的游戏,,2024-06-06 15:05,Honor Play 4 5G
48691957,易雀,4,玩了快四年了，再怎么样也不能分吧😸,5,2023-07-19 14:27,未提供
479527278,哈哈哈哈哈,5,虽然三周年的事我就退坑了，但是有些节奏让我觉得好笑😑,,2024-06-06 11:59,Vivo V2203A
563096875,想亲鼠这个电电,5,我爱小陆总,1,2024-06-03 23:43,Honor Play 30
355623105,慕君年,2,我受不了了！米忽悠你的爆率是不是真的有问题！！！我一个莫推到现在一张莫弈的sr都没有米忽悠你欠我的拿什么还啊啊啊啊啊啊啊啊啊啊啊啊啊啊！,,2024-06-03 14:02,未提供
103438391,Urplus.,5,我感觉很好啊 怎么才7.2评分,,2024-06-03 13:08,Vivo S15e
525554859,may.max,5,莫陆推  这是我第一个玩的乙游有着不可磨灭我感情 三周年抽卡机制什么女主党吵的最凶的时候我都没有退游  说真 平时虽然骂你骂的多但真的很喜欢你 你真的有在好好做 希望未定叔叔把陪伴感提上来 我要玩未定到80岁,,2024-06-03 07:37,未提供
439747708,木头人.φ,5,这半年让我很满意，请继续保持,6,2023-07-20 20:36,未提供
447662981,阿玖,4,💎资源获取：<br />还可以w～<br />💘恋爱感：<br />喜欢！超喜欢～年下永远的神！！！！<br />😍想对老公说：<br />陆景和,,2023-06-07 03:38,荣耀 50
26133740,本命,5,不知道是第几次修改了，底下还有当时夸未定的时候被冲的评论，其实最近热情不是很多可能要退游了但是好的游戏值得高的分数和大家的夸赞,45,2021-08-01 22:36,未提供
62870,HailStucky,5,今年的卡真是神了！古婚，跃动，此春离离，鼓乐鸣音！未妃，你还有什么惊喜是朕不知道的？端上来！速速端上来！,,2024-06-01 00:22,华为 Mate40 Pro
83663080,音九,4,玩了很久，退坑过，但卡面画风很喜欢所以回游，主要是很喜欢莫奕的人设，,,2024-05-31 21:30,Redmi Note 10 Pro
7368342,菇菇米晞,5,最近吃得很好，夸夸你，继续保持😙,,2024-05-31 14:09,未提供
109318407,橘子蒸糕,3,朋友，你什么时候被下架，我开始期待恋与深空挤掉你称为新的四大国乙了<br />二编<br />我服了，恋与深空比你还烂，世界之外还尸块，呵呵呵……,16,2023-08-28 23:16,Honor Play 5T
481238918,几何崩坏,4,未定是我唯一留下来的乙游了，三周年那段时间刚好退游，不是很了解机制改成什么样了，所以不是特别介意这个问题(本人微氪)之前也有玩原神崩铁，现在还留着崩铁，对保底什么的也习惯了，卡面也是越来越精美，所以对未定还挺满意的，希望未定越来越好，给个四星以免膨胀 -(来自莫推的发言  ᵕ̈,,2024-05-31 00:48,未提供
590703819,xin009,2,我真是服了 今天更新你怎么那么离谱啊😂 我十点多下载看见要更新了 我去taptap下载了更新了 但是你为什么要给我跳去浏览器再给我下一个未定事件薄呢 你现在给我一个合理的解释行不行 我一个小时都在弄你这个东西 你到底在搞什么啊？一次大更新 你凭什么还要给我再下一个未定事件薄啊 你闲的还是我闲的啊 我天天氪金给你啊？😓😓,1,2024-05-30 22:54,OPPO A1 Pro 5G
488082975,Min敏Min,5,开服玩到现在，总体上我还是非常非常喜欢这个游戏的。<br />优点：主线特别特别好！卡面剧情质量很不错（近一年）对单推人特别特别友好！小游戏有创新，很好玩！福利还是挺不错的，经常有小游戏送晶片，月卡党超值，资源比较好攒！端水大师！<br />缺点：主线更新特别慢！对all推不友好，不过大部分游戏all推都挺难的！去年一年左然卡面持续崩，不过今年剧情很不错！<br />说实话，去年周年庆特别糟糕之外，近一年没什么可以说的，感觉都不像未定风格，做得真的挺不错的,5,2024-05-30 20:40,未提供
106073987,曦,3,哈哈哈，我来喽（有自证哦），首先我玩未定有2年了，夏推，我是三周年的时候入的坑，之前是什么样的我在网上冲浪的时候听过一点，好像因为抽卡机制的问题，也有一部分女女主党，三周年才会被喷，关于女主党其实我知道的不多基本没看到过，也可能因为我不刷微博😂，其实我觉得玩游戏主要还是自己开心，眼不见心不烦大家不看就好啦😋，但是该说的还是要说未定有几张卡也确实有点奇怪，就比如莫弈的那张关于医院的，我不是莫推，但确实有点奇怪（仅代表个人看法），还有左然的我记得也有一张，但是他最近做的确实很好，美工方面没得说，希望周年庆别在作妖了，其次资源能不能给多点感觉不够用😂，还有婚卡什么时候返场，我受不了，原本是想买完婚谷之后停谷，你还不返场😕（本次评论只是个人体验过来的感觉）,2,2024-05-30 19:08,Vivo V2162A
505355665,颂,1,为什么我一更新最新资源完就这样了😅,1,2024-05-30 18:19,红米 Note 11 Pro
547003898,梦礼,1,题材还是不错的，，就是女主私设巨多，甚至还有男主视角，第一次见这样的女性向游戏😂,9,2024-05-30 12:19,华为FGD-AL00
577585347,^_小奈💭°💤,2,好无聊,,2024-05-28 21:22,未提供
410408897,枫忍,3,能不能学学崩铁😶,2,2024-05-28 14:42,未提供
483517084,結,5,期待周年庆,,2024-05-28 12:48,未提供
631560133,USB数据线-_-,5,💘恋爱感：<br />拉满了真的拉满了,1,2024-05-27 20:27,TCL IEnglish 4
1391871,叶瑄的小宝宝,2,剧情刚刚看目前没有特别吸引我的地方，能玩，打算继续玩玩看看后面剧情怎么样,,2024-02-01 16:46,Vivo V2046A
514150587,凌云卿,5,未定的质量一直都很稳定！最近的卡面也是超级好看！美工和文案还是一如既往的优秀，莫弈老师的配音也很好，我现在是根本听不出来是ai配音——不愧是米家的游戏！技术力就是令人安心😘<br />希望今年周年庆别搞烂活儿，大家都开开心心的。<br />还有晶片再多给点，我是晶片厨（bushi）,8,2024-05-26 18:48,华为HONOR 20
19310852,烟火,4,回坑了，后面只要不作妖未定事件簿你就是我的神，扣的一星还是抽卡概率（咬牙切齿）<br />啊？不是，怎么一退坑然后什么节奏都出来啊？多久之前的卡现在拿出来说自己像小三，怎么你忍了两年多然后终于忍不住说了？那真是辛苦你当三这么久了。😅如果是新入坑麻烦你收收味，开服这么久没什么人提，你们一玩就什么问题都有，日常未定被开除国乙籍是吧，什么女主党，媚男，玩家当三都出来了，怎么，哪个乙游不是第三人称居多，你不是第一人称怎么不说自己在一旁看着不是三呢？纯属吃饱了撑着，想象力也够丰富，玩乙游是让你注意男人你偏偏就在意到自己是不是三了😅<br />节奏是跟的，玩乙游是只关注女的而不是男主的，开服几年没什么大事，一有人带节奏就跟进来一起骂，你们没事吧？但凡你们不是突然在这个时间段猛刷差评，我都懒得怀疑你们是带节奏的，现在是真玩家在恶心sss机制，跟风的顺带一起挑毛病一起骂。太闲麻烦你动动你的手指卸掉，评价和吐槽是希望这个游戏变得更好，而不是你跟风来骂一句希望这个游戏沉底的。你没有对一个游戏付出真心而是带着恶意来的怎么可能没毛病？现在哪有10.0的评分游戏给你玩？省省吧你们，我懒得阻止你们但我一刷到未定事件簿都是我入坑时没有的节奏，谁不迷惑？毕竟我是付出过真感情的，玩那么久抽那么多卡，每次都吃大保底而且只能攒晶片到周年庆或者新春的大活动卡来抽。<br />我确实不喜欢它的抽卡机制，尤其最新的sss卡😅让我非到极致还死性不改，但是你们突然开始纠结于乙游里的当三我是真没想到。没办法，说了男主是你们的你们还不信，男主们口口声声说爱你们你们觉得是假的。多疑症一样看未定里面的人物，考究自己是不是三，我有什么办法，我不是心理医生也治不了脑子，如果这样对你们来说有优越感的话，你们键盘侠喷的开心就好😘<br />7月30<br />失望透顶<br />好好的三周年整成了这样，本来我就是吃保底的命，你还降概率😓<br />晶片攒了好久留到这个时候，抽完退游，结果你猜怎么着——90抽没出货哈哈😉98出的，我真的谢谢你，让我临走前一点不舍都抹除了😄知道你是对我好了我的宝<br />5月21日<br />突然又想回来评价一下了<br />有一说一，未定我淡坑了挺多，但暂时并没有退坑的打算<br />一个是因为喜欢，屯着晶片期待着周年庆之类的能震撼到我的新卡<br />淡坑也是因为抽卡概率和玩法原因，玩法容易长草和卡级，但好在做任务时间不长，我可以刷刷任务升战力，哪天兴起再打关<br />个人是真的非吧，几乎一到喜欢的卡的活动就会拼命肝，肝不到就氪，所以现在是氪了小几百玩了一年多但只有几张限定卡，图在后面自行感受😶<br />几乎都是七十抽及以上<br />但nxx还是YYDS<br />————<br />飞雪落红尘时入的坑，因为本人也算肝帝，在活动结束前直接把活动肝完了。乱步轩有点阴间，但还好，有一关也就重玩了十几次🙃<br />因为小陆总慕名而来的未定，现今左陆双推，还有发挥成all推的趋势，没别的原因，四个男人各有特色，都吸引我😋<br />剧情很戳我，中间退坑过一段时间（手机没内存），但还是一直关注的，在求婚卡来时果断下回，把任务什么的全肝过一遍，用70抽娶的小陆总。有一说一，相对其他乙游，未定最吸引我的是技术。<br />动图和视频电话都很戳我！还有求婚卡的戒指，真的很难不心动。<br />咱就是求少点刀和多点抽卡概率好不好😭<br />本人少氪，前期氪过几十，后面都是在捡便宜的礼包。现在46级，仅3张SSR，两张常驻，一张小陆总求婚卡，关卡刚打完第六章，总的来说比较佛，乐趣在于sr和SSR的动图，还有QQ人（真的可爱😘）<br />应该会继续玩下去，至少会关注，未名市我总会回来。<br />因为期待<br />扣的一星就算是抽卡概率的了吧😎,16,2022-07-30 03:42,Vivo IQOO Neo8
42980725,冬天煲冰糖雪梨,5,啊啊啊啊啊啊我可以一辈子玩未定事件簿！虽然之前三周年被EX到了，但是，马哈鱼他知错就改啊！最近的游戏体验真是好的不行，样样都好,9,2023-07-17 23:41,一加手机8
565484713,晨来昏升,4,好玩爱玩<br />NXX的大家都特别好<br />之前一直不玩是因为见过很多莫名其妙代入小三视角搞咯噔文学的人，真一条一条找所谓“私设”的这个鉴法没几个乙游能经得住。代入感不该是来源于主角的行为和心理合不合逻辑吗。入坑之后和朋友玩得特别开心每天都能聊很多，，,,2024-05-24 18:48,未提供
42737734,Okita੧ᐛ੭,2,新玩家快跑！<br />周年庆第二个大保底要来了(强颜欢笑)<br />疯了，活动接连不断。就差直接喊给钱了。,1,2023-07-31 11:16,三星Galaxy S21 5G
523354774,阿攴桃,5,说实话在国乙里算好的了，至少没有千奇百怪的硬性塌房事件和莫名其妙的“饭圈”化，其它解解都请放过未定吧，都被你们踢出国乙了还要拿你们那套标准往上面硬套，道德感强不喜欢魔怔人或者没有“可汗大点兵”“报菜名”式乙游特种兵准则的人挺适合玩的，至少不会遇上多少渗惊殡😂男主还不会有那种她们想要的故作姿态的油腻感，感情线和互动自然就被说成性冷淡真是够了😅,33,2024-05-23 00:44,未提供
