用户ID,用户名,评分,评论内容,点赞数,发布时间,设备型号
692806600,User692806600,3,手机体验非常难受，做的太追求拟真了，角色动都有缓冲和起步，电脑体验肯定拉满，手机玩还是算了。既然想赚手机玩家的钱就要多照顾照顾手机这方面的体验。但你手机电脑互通，又不可能单独给手机优化😩,,2025-03-25 18:04,一加手机Ace 3
369725466,知行合一,3,免费的大作，玩了3天，里面东西太繁琐，玩不明白，联网模式直接给劝退卸载。,,2025-03-25 16:23,华为MIS-AL00
584117799,白茶,3,没内存，全剧终,,2025-03-25 16:18,Realme X7 5G
22597439,国家脱贫漏网之鱼,5,pc端，之前主要玩二游的，苦二游一些弊病久矣，所以一开始玩起来最明显的感觉是集合了很多优点。玩起来很爽。<br />希望剧情和文案质量只高不低，细节和路边npc人声继续保持，战斗体验能够优化，女号衣服继续保持，不要搞擦边到处露。🙏💋,,2025-03-25 16:16,未提供
26676541,桜🌸芮,5,太好玩了，游戏时长336小时，最近在打流派试炼，打着打着就闪退了，我以为我没更新的问题，然后来更新了，更新完了，继续打流派试炼，打着还是直接闪退，我用的平板，听说用手机更卡，之前玩也不卡的啊，现在玩着越来越卡了，平板内存还有很多，不知道搞了什么鬼，玩着体验感不好了,,2025-03-25 15:46,Huawei MatePad Air
534120802,wj,3,Bug真的很多，做着任务，突然触发一个bug，导致我的任务做不了。打据点的时候，武器直接卡了，人物移动也出问题了。（说一个让我特别崩溃的网卡的bug，昨天打侠境的时候，人机组队网卡了，等连回来的时候，鬼公子直接锁血了，打了十几分钟，一点血没掉，但是这个东西舞狮就打了30分钟，鬼公子也打了30多分钟，为了这个奖励，磨掉了我一个多小时，而且还没拿到😱）<br />男装大部分真的很丑，又贵又丑，这个游戏大家花钱基本上都是买衣服的，但是做的那么难看，根本没有充钱动力（顺便吐槽一下某些衣服，他的裤子和鞋子染色是连在一起的，金池鲤那件衣服，买了你能得到一条红裤子和一双红鞋子，染色都是万相集的玩家们救了他）。<br />网易的运营服务我就不说了，一直都很差，出bug了，50长鸣玉补偿一下就算了，真“大方”啊。<br />有些地方强制社交，社恐很难受，而且还会莫名其妙被通缉，要是不及时解决，就有很多人闯进你的世界抓你。<br />开放世界肯定是肝的，说不肝是假的，不肝的大部分都是到大后期了。<br />跑图的时候，跑着跑着就爬树了，网易你有什么头绪吗😃<br />再补两句吧<br />战斗系统，移动端真的做的一坨，手感很差。<br />Ui系统特别混乱，你找半天不一定找得到想找的东西在哪,,2025-03-25 14:30,未提供
102650922,彡彡君,5,真心觉得不错，一般手游剧情都是直接跳过，但是这款剧情从来不跳过，每个小人物都有血有肉有故事。野外首领和boss，打不过的还可以调整难度，一样不影响掉落。关键花钱只能买外观，很公平了😁,,2025-03-25 13:51,HONOR PTP-AN60
50151096,温木,4,其他都行就是手机端bug太多，一直发烫，你既然要卖手机端就做好优化然后战斗太差了，主角被怪物打倒地被控还要慢慢起来还没起来呢又被打死。。。。莫名其妙的索敌，我只是路过你镜头直接给我锁在怪物身上不动了，我只能倒着走。。。。设置里能关掉的都关了😇,,2025-03-25 12:51,Vivo S17
561830863,度洛西汀,3,游戏挺好玩的，移动端的手感和游戏体验有点差。bug很多，有些任务老是触发不了，打boss时有时会卡。,,2025-03-25 11:27,Vivo X90
458134371,三拼灾,4,总结来说，确实挺好，推荐入坑，就是解谜的话有点难，还有他主线确实做的挺好，副线的话……难讲,1,2025-03-25 11:24,Realme GT5 Pro
35372816,梦境呢喃,2,（想过来想过去，还是把修改后言论放最前面）<br />游戏里在莹渊留个路牌调侃“鹿和石棺，我知道了，缝的老头环地下遗迹部分”然后系统通知禁言了……这么敏感？<br />——————<br />ylsl，游戏单机部分确实感觉挺好的，偏魂式玩法（只不过手感跟永劫无间一样软），但游戏联机部分太多，而且有越来越多的趋势，只不过单机大世界部分仍然算大比重，不喜欢联机的完全可以零氪当成单机游戏玩玩，等到什么时候彻底变成mmo网游了该退坑退坑，，<br />游戏内调查问卷好几个问题是问联机部分的，可以看得出来这游戏是真的想更新很多联机玩法，但问题来了，我玩联机为啥不去玩逆水寒呢……这游戏要是类原那种微联机模式的话感官更好点，预感更新可能变成幻塔武侠版<br />—————————————<br />这奖励tmd压根不合理，一个宣称是偏向单机的游戏一堆联机内容也就算了，但联机奖励竟然比单机多，很多任务和奖励都得联机，手感延迟忍了，手感飘忍了，bug忍了，结果最重要奖励反馈居然是逼着联机,2,2025-03-19 19:09,未提供
8501452,-,2,战斗设计很奇葩，有种一点都不想战斗的无力感，打什么都得等对方先打我再去卸势，很不好玩，玩这游戏一点爽感都没有，让我练，练不了一点,2,2025-03-25 04:53,一加手机13
14676823,QQ用户14676823,4,预下载搁哪儿呢？我怎么没找到啊！！！！,,2025-03-25 03:15,小米23090RA98C
435349808,User435349808,5,好玩,5,2025-03-14 09:59,一加手机Ace 3 Pro
540211239,Aquarius,1,bug上做了个游戏，ch能不能用点心，副本里的关卡能不能用点心，做的升降台扶梯什么玩意自己自顾自上去了把玩家丢下面了，跟你家boss打架还得提前通知是吗，两次打boss二阶段boss消失不见你到底想干什么燕云十六声,4,2025-03-25 01:17,未提供
29198717,曜日升辉5479,4,游戏还好，就是手游暖手袋，端游倒还好，真的是地道全地道，好好优化吧只能说,,2025-03-25 01:16,未提供
407462705,亨~,2,老是闪退 刚上线就闪退,,2025-03-25 00:21,Oppo K10 5G
548242847,哟哟哟,5,混江湖❎<br />倒斗✔️,,2025-03-25 00:06,iQOO Neo5 SE
380056313,心头晚意,4,画面满分，可惜剧情太无聊了玩一会儿就玩不下去<br />改分，我为我之前的莽撞道歉，好玩哈哈哈,,2025-03-21 15:23,未提供
380056313,心头晚意,4,画面满分，可惜剧情太无聊了玩一会儿就玩不下去<br />改分，我为我之前的莽撞道歉，好玩哈哈哈,,2025-03-21 15:23,未提供
29643948,华子,1,卡登录，闪退，各种硬伤,,2025-03-24 23:09,Huawei P50 Pro
17312175,太阳☀,5,唯独不喜欢里面的男性服装，丑不拉几的，有没有战斗一点的衣服铠甲,,2025-03-24 22:55,Vivo IQOO Pad2 Pro
14690376,QQ用户14690376,1,问就是3a大作堪比众多单机捏😂,1,2025-03-24 22:40,未提供
8207500,Yokiko,3,其他都没问题，就是太中式恐怖了，有些剧情一定要弄的这么吓人吗？让女孩子一个人怎么玩？,,2025-03-24 21:56,iPhone 16
396910199,lucky,5,玩了四十多小时，还是很好玩的,,2025-03-24 20:33,华为荣耀9X
604971779,It's me!,5,夸一下燕云的剧情，做的非常好。美术演出，都很完美。唯一一点就是太黑了，地图很多地下空间，但是光做的非常暗。废寝忘食地玩了几天，白天玩必须蒙被子里，不然真的看不到黑暗里的细节。还有那个武器指引，好复杂，刚开始看不懂。<br />男玩家衣服很丑，哪个武侠天天穿那长不拉叽不适合打架的袍子啊？披风我能理解，但是武侠不是仙侠啊，还是做个束腰吧，初始服装那种感觉啊。,15,2025-03-24 19:41,Vivo V2115A
665553745,左然然,1,腌鱼十六升，你要干嘛！！！！！！我调了三把伞，全是鸣金！！！！！我是玩伞扇啊啊啊啊啊啊啊啊啊！！！！！去spa！！！！老子武器什么时候调好什么时候给你打五星！！！！😅,,2025-03-24 18:38,HONOR LYN-AN00
67667989,Di3ian,4,玩着玩着就卡到闪退了，能不能好好优化一下…<br />其余都挺好的，剧情打斗不肝不用社交的玩法很适合上班族！,1,2025-03-24 18:33,小米13 Pro
709116624,。,5,代入感强，剧情丰富，内容有趣，人物多样，游戏有趣，画面清晰,,2025-03-24 18:23,OPPO PEQM00
50072202,"长不过执念 ,短不过善变",1,乱七八糟多余的关卡很多，而且各种卡细节，bug一堆，一个任务一个落脚点跳一个小时。,2,2025-03-24 18:06,华为 MatePad 11
327897827,鱼鱼鱼,5,唯一难受的就是卸势手感太差了，感觉初期卸不卸得掉全靠运气，后期练出条件反射可能能好点，但是，这真的很抽象！前期手感巨差！<br />另外，剧情没的说，很正统的武侠思想，比现在主流的经过阶级化的新武侠设定舒服很多。,,2025-03-24 18:01,Vivo V2121A
511449061,Liur,3,手机端真就没没手柄玩不下去啊😓什么时候支持手柄啊！！！,,2025-03-24 17:35,Nubia Red Magic 8 Pro
354223472,幻想御剑,5,和射雕比起来确实好太多,,2025-03-24 17:01,未提供
105731409,山葵酱,5,2025最好的游戏，没有之一！,,2025-03-24 16:43,iPhone 15 Pro Max
5132847,226,4,我奔着纯单机盖房子来的，我觉得盖房还不错，能在大世界里抄录摆件建筑啥的，还能在大世界里随意盖房子，就是偶尔有一些bug，还有待改进。<br />偶尔看到小河里像有马赛克一样，方方正正一小块一小块的东西，不知道是啥。,,2025-03-24 15:37,Vivo IQOO 13
674355880,诚南,5,还好,,2025-03-24 15:07,小米24129RT7CC
672016656,及时雨,4,能不能把情景的穿搭单独出来，不想随着跑图穿搭变动,,2025-03-24 14:09,Vivo X100s
1550204,Akai,4,就这样吧，不换运营的话不会再玩,28,2025-02-18 13:06,Huawei P60
704919236,安安,5,非常好玩，我之前就玩过，达到了70多级,,2025-03-24 13:07,iQOO Neo 5 活力版
478616428,吹圣,5,好玩爱玩，剧情无敌,,2025-03-24 12:10,OPPO Find X8
690624950,雨野,3,先说优点，剧情特别好，代入感很强，作为一个从不看剧情的玩家都把剧情认真看完了。剧情爱好者可以闭眼冲。战斗也很好玩，喜欢他的战斗模式，很带感，动作也好看，战斗党也可以冲。还有一个吸引人的地方就是二创，同人爱好者可以放心玩，饭很多，什么饭都有。<br />缺点，一个是太肝了。一个就是我后来退游的直接原因，就是单机体验不好。我最开始是冲着单机无干扰去玩单机的，因为不想社交连百业和门派都没有加。但是很多多人世界任务，生病了，被诬陷了还必须找人解决，然后因为不小心太极丢到村民，被悬赏，跑了两步就出追捕圈子了。然后就给我传进来真人追杀。对于一个纯粹的单机玩家来说，单机世界进人的感觉就像自己家里进了陌生人一样特别让人膈应，所以就退游了。如果像我一样比较社恐不喜欢社交的不推荐这个游戏。<br />我退游前还有一个很恶心的就是里面那个郑鄂是明星配音而且配的很难听，我当时养了奶伞奶扇输出伞，所以每天都要刷他，被恶心的不行。而且因为跟明星绑定所以找不到同人饭吃，不知道现在改了没。,1,2025-03-24 11:40,Vivo S17 Pro
376499305,钴蓝,3,少给两颗星，是因为战斗体验太差了，那个卸势，还得提前预判着点，类似于黑神话悟空的识破，战斗系统真的很差，其他的方面没得说，都挺好的，希望后续可以优化,1,2025-03-24 11:10,Vivo IQOO Neo9 Pro
56788623,秦先生,4,换了pc端之后，感觉真的和手游完全就是两个游戏，手游那简直优化就是一坨啊wc，自由度非常高，代入感很强，很让我着迷成这样的状态还是在22年玩的某原，第一次感到如此喜欢这款游戏。打斗机制上我感觉pc端手感远远比得过移动端，移动端的打斗机制能不能优化一下，尤其是卸势，挺难受的，我也不可能每天都盯着电脑玩。<br />时装类的，女号玩家的衣服都挺漂亮的，但是我是男号玩家，就是能不能别整你那破v领，真的讨厌v领😑😑除了这个，我感觉其他都还行吧，只能说部分时装能接受（目前我的风华值9千4左右）<br />就是多送点心力啊，你送的这么少是怕我们刷到金装，你也不看看你那个金装概率和词条歪的多离谱，不说送的很多，至少大更新的时候可以送那么1  2个也不错啊。我现在上线都不知道干什么了，天天就是打牌，打输了就跑😑还开了个小号去玩。<br />总体来说都很不错，剧情也喜欢，人物都很生动，像活的一样，还有就是不要把我们三更天长老当契丹人整啊😅<br />（献上我儿子的图😋）,9,2025-01-30 16:27,未提供
98602778,lj,3,可玩性来说我真的很喜欢这个游戏，画风剧情啥的我都喜欢，就是你那个boss难度能低一点吗？已经选了剧情模式，还是打不过，打这个田英打的生无可恋了，求求降低点难度，对我这个手残党来说真的很难打。（更新：越做越对单机玩家不友好了）,2,2025-01-14 18:06,Vivo IQOO 13
457300779,透明酱,2,网易的游戏大家都知道我要说运营是什么😅<br />但是游戏质量还是不错的，不过键位很怪啊！很多按键不能整合到一起吗？战斗时的按键还不能和平时用的按键重复，我改了半天都是冲突<br />进去没多久就是一场战斗，问题是你又不给我改键位，还拉我的鼠标灵敏度，我差点刚进去就晕3D了<br />画面质量也是，虽然下载的时候可以选低配置的问题是动态模糊什么之类的也是要到后面自由活动才能改<br />捏脸的自由度算是很高了，可是体型是不能改的emmmmm虽然也不是什么大问题<br />以下为3月5日更新评论（以下涉及剧透）<br />网易就是被武侠be美学这种东西害了，只顾着剧情里面这一刻的帅气，飒爽，也不管逻辑是什么。剧情真的就是一坨。<br />刚过完主线第一大章，我真的是被网易逗笑了，是，主角是年轻（虽然你这个体型看着不像是十五六的愣头青），但主角应该不是傻子吧？事情轻重缓急都不分？非要打一架先证明一下自己的勇敢？<br />是，确实是遇到人力不可更改的事情了，但是主角这个磨磨唧唧的状态真的就很火大，搞的很帅气，实际上失去一切。<br />尤其是第一章结尾时的大战，这个诗念的，我真给逗乐了，是念诗喝酒的时候吗？给人一种制作组在做这段的时候一拍脑壳说：“诶，这里喝点酒念个侠客行是不是超级帅的！”<br />是帅，是可以拿出来剪视频做宣发的帅，问题是，这个演出打断代入感。<br />玩家玩到这里，心中悲切哀恸，充斥着仇恨不甘和对自己无能为力的悔恨，主角和玩家都是无心耍帅，任何辞藻都是多余的。耍帅是要看场合的，在自己游刃有余的时候耍帅是潇洒，在自己无能为力的时候耍帅就是小丑了。<br />我知道制作组想制作一个美强惨的主角，但是美强惨的塑造不能只通过刀主角的亲人，让玩家同等的感受到主角的悲痛才叫惨，让主角在面对独木难支，大难临头的时候能率先勇敢的面对才叫强。<br />（以下为3月24日修改，涉及剧透）<br />主线过完了，没想到我还能在修改一次，网易你真是绝了啊。<br />我直接暴论，剧情就是一坨！<br />盈盈有什么资格说那些话啊？盈盈有什么立场指责赵大赵二啊？她和福禄寿在走私**诶她凭什么质问赵大赵二啊？<br />我即便以小民的视角来看，盈盈做的事情也不能称得上利民吧，钱荒的本质如果是货币不足而商品充足，那一定存在以物易物的渠道，钱的价值会相应升高，引入外来**会造成的不是钱荒缓解而是恐慌，你这玩意变成发行金圆券了，这是赵大赵二说行，现在我们也收唐钱也收其他钱就可以解决的吗？物资总量没有变，人民的生产力没有提升，这种搞法把民间的走私**变成了官方承认**，网易你看看这对吗？<br />而且赵大赵二就这么收钱，我请问这个钱如果是契丹的经济战怎么办？福禄寿仨小孩走私的唐钱都让整个开封人心惶惶了，你这开放收唐钱，承认唐钱的购买力，是真当游戏就不存在通货膨胀了是吧？<br />（我上小红书一看，盈盈好像还真勾结南唐，那没事了，就盈盈这个角色显得很丑陋，龟奶奶的好心显得很傻而已，反正网易不在乎）<br />还有就是，盈盈既然有盈盈这一面也有无缺公子这一面，那她说大义凛然的话就要用盈盈这一面来说，她被抓的时候还是白头发的盈盈，怎么绑起来了反倒衣冠楚楚了？抓了还梳妆打扮了一番是吧？盈盈都尚且没什么立场指责赵大赵二，无缺公子这个身份就更没有资格了好吧！又不是没做白发盈盈的建模，为什么不用呢？为什么要用无缺公子的模型呢？真的很难理解啊！,,2025-02-10 15:38,Redmi Note 12 5G
32151809,洛竹宣,5,应该是现今国内最好的武侠游戏了吧,1,2025-03-24 09:33,华为ADY-AL10
13666061,李時珍的皮,5,燕云十六声正确打开方式∶单机<br />你当单机玩以剧情+探索为主燕云可以说近几年难得的双端手游佳作，单人模式很有沉浸感，剧情党必推,,2025-03-24 09:25,一加手机Ace 5 Pro
15817654,月亮,2,战斗手感很差，卸势十六声懂的都懂，手游延迟高按键不灵敏的同时卸势防御一个还是键，打陌刀试炼千夜完全是煎熬。流派看似搭配自由但是平衡一坨，也没什么引导，心法装备全靠赌。喜欢某些文案和剧情才忍着屎一样的战斗系统和各种bug继续玩下去。主线剧情的红线刀哥之死有点为刀而刀逻辑不通但总体上能挺有情绪感染力，梦中不羡仙也做得很美。一叶平生更是个好故事，有遗憾也有完满。团圆结局但是比悲剧还有余韵，更让人想落泪。<br />运营真的很让人恶心，不回应玩家，不解决问题，反而疯狂作死，纵容某些incel群体发泄恶意，“单机无干扰”也是很可笑。再这么烂下去再好的剧情都留不下玩家。,6,2025-02-22 20:50,OPPO Reno12
448162746,墨水,4,游戏挺好，低画质老年机也能玩。剧情没得说，我一个跳过党，玩这个游戏的时候都没跳过剧情。<br />pc端画质很好的，风景优美的大世界。<br />游戏操作设计的不太好，尤其是手机端，打斗系统真的很烂。操作不方便。按不出来技能是常事。bug也忒多了。<br />不过我还是很喜欢这个游戏的。虽然不完美槽点挺多，但是也胜过大多数手游了。,9,2025-03-24 06:45,华为 Mate 30 Pro 5G
384125671,小生不吃小孩,3,不知道为什么好卡好掉帧其玩其他大世界游戏的没怎么卡能不能好好优化,,2025-03-24 05:54,小米Xiaomi 12S Pro
462051768,黄麒,2,这游戏太喜欢把玩家当日本人整了，虽然不氪金，但你要是想玩儿必须肝，不肝不行，那些抓蛐蛐和蜂窝啥的感觉跟原神的神瞳差不多，但数量真的很庞大，必须抓完才行，还有一些蛇群，几个人演戏悬赏，大锤小锤，官方真是演都不演了，还必须按着剧情方向走， 个人感觉跟其他大世界差不多，玩法没什么区别，不过剧情顶是真的顶也很现实和残酷，到最后主角既没有奖励啥的，而且你花了好几个小时搞完关于寒姨的消息就那么一丁点还不如不说，真有那种原神味儿了，祝官方身体健康,,2025-03-24 05:46,未提供
26066883,如今游戏太浮夸,3,怀恋的武侠游戏，BUG有点多，任务中途看到提示没显示，需要重登入，碰过好多次这情况。换副手武器不够连贯，搞不清楚为什么要副手武器，武器方面完全搞不懂为什么切武器。<br />剧情可。大轻功画面有点多浪费时间的4连跳。网易最喜欢做点恶性反胃的鬼怪，做鬼怪完全扣你2星。把武侠风完全成了鬼吹灯的。<br />晚入坑3个月，居然组队老油条带副本打不过，有点意思。👍<br />其次就是每天要刷的界面让我是找半天。界面设计不够简洁明了。<br />扣2星的就是鬼怪太多，少了武侠味。,,2025-03-24 02:02,未提供
16391182,樂樂,3,今晚这次更新后，挂很好认。打完pvp后马上退出的就是，他要是不手动退，你就会卡在死亡画面。一般都是自动卸式，或者加速挂。有个挂我隔一局遇到他一回，连遇四回。直接举报了，虽然没什么用。<br />——————————————————<br />0324<br />现在的外挂已经进化到技能无cd无消耗的地步了，真是太可怕了。遇到低调的就火，拳。你也不敢确定，还以为是人家装备好，定音好。可你无限药叉，我一直在天上起起伏伏是什么鬼😂？一直闪避躲，三十秒从丝血回到半血是什么鬼？金定音也是10生效一次吧？<br />更可怕的是官方的不作为，举报无用。好不容易成功一回，回邮件告诉我已对对方进行惩罚。结果第二天pvp照样能看到他，人家继续用挂，不耽误。宏狗就不说了，抖音，b站都有教怎么做卸式宏的，也没见封过一个，现在连挂也放飞了…<br />我想他们会说数据量庞大，些许网络波动照成的异常，我们无法确定，为保护玩家权益，我们不能随意封号。那我想问服务器在你那，根据举报的时间人物，精准定位一段数据。看一下日志有无异常看不出来吗？<br />还有pvp里的横幅公告，手机端一直刷，正好挡住对面的血条和状态条，关不掉。反馈…算了没什么好说的。独狼玩家就算数量再庞大也是一盘散沙。听取玩家意见的声音中，不包括独狼玩家。很多人都爱戴—苍生无言，侠为其声。是一种期许，还是只是好看呢？,1,2025-03-02 01:26,Vivo IQOO 11
2801231,-月神/WOYCHEN/-,3,游戏美术不错，就是手游优化感觉不太好，，。很卡，掉帧。。。,1,2025-03-24 00:51,小米15
445252758,也来,2,非好坏，游戏品质本身没有任何问题，mmo里绝对算优秀，只是说一个问题，只说游戏PVE战斗方面，联机不怎么玩，就单人体验，目前防御攻击有三个，卸势格挡闪避，卸势跟完美闪避按理说收益应该是持平的，但是现在因为有白条，完美闪避时停基本没什么收益，攻击收益太太太低了，放技能跟攻击打完一整套，不如一个终结技伤害高，真的合理吗，别说攻击放技能的的时候还会被boss打，现在说的少因为，大家现在装备心法差不多抖毕业了，有压制感觉boss不难打，所以不明显，正常进度放技能或者攻击，被boss一个技能打半血秒的太多了，而且说卸势 红光也不明显，抬手有快慢刀纯靠记，技能的意义只剩打小怪了，打了半天叠个流血buff，好不容易冒着被秒的风险满层打一套，结果一看不如卸两下一个终结技伤害高，闪避又扣体力又没收益，个人觉得不如给每个流派的武学加一个破盾技打白条，类似天刀破定技能，这样技能跟时停收益才算正常，不然不可能说攻击高风险，还不如防御低风险的收益高，,14,2025-03-24 00:28,一加手机10 Pro
445590897,渴死的鱼,4,剧情模式难度降低了，单机玩法难度降低了，嘿能玩了，不过这个卸势是真的不好把控。玩到现在有点不知道玩啥了，没得玩的了好像，就每周末登登刷刷么玉，换换材料啥的，不然就打打据点，然后就下线。,1,2025-02-15 14:18,小米Xiaomi 14 Pro
370828108,幸运,3,这游戏其实其他的都很好，就是那个手游，他能不能优化一点你那个按键你按的时候都不奇怪吗？嗯，都不奇怪吗？点那个跳的时候他为什么要有卡顿呢？人家有的地方为什么他跳不上去呢？就是就是能跳的地方，你三段跳都跳过去的地方，那你为什么跳不上去呢？它就是到那个地方它卡。掉然后就飞掉，手机端能不能优化一下呀？而且你那个信息不觉得很奇怪吗？我在我自己的一个大世界里面，我在那里打boss呢，然后一个人叫我进百业，一个人叫我进百业，一个人就要进百业。我都怀疑你能不能单独设一个收件箱，你把它归为一类啊。每次打的时候都很烦，真的很烦，而且手机端真的很不友好，你本来就是个3d游戏，你要去旋转的时候右侧的按键非常多，你旋转的时候这就是一不小心就点到那个身法，就点到那个技能就很烦人。这潜行的我一个跳人跳到人家头上，我直接失败😅<br />除了这些，其他的都很好。,,2025-03-23 23:57,OPPO Find X8
647856663,く,5,第一次尝试这种类型的游戏，意外的好玩，总而言之就是好玩爱玩，游戏时长已经370+了，战力也到2鹅了，非常期待河西赶紧上线,,2025-03-23 23:49,未提供
46103640,User46103640,5,帅飞了。讲的是五代十国的事 看不良人的必玩,1,2025-03-23 23:35,iPhone 15 Pro Max
