用户ID,用户名,评分,评论内容,点赞数,发布时间,设备型号
29951931,小林,3,链接飞智手柄冰原狼3老是卡画面，无论开最高还是最低画质都会时不时卡十几秒，是一动不动的那种，平常不连手柄最高画质卡都不带卡的,,2025-03-31 11:10,Redmi K50
501815339,岑禾,5,游戏很好，就是有点阴间，副本基本在地下，可以说很接地气了，同时加上画面和音乐也挺接地府了。,,2025-03-31 10:44,未提供
367814794,桉姳,1,画质这些可以说很棒比天涯明月刀和楚留香有的一拼，但策划搞毛啊，我都格挡了还能被杀掉血而且格挡都还有一格，这咋玩啊策划有创新可以的但能不能考虑一下一些手残玩家,,2025-03-31 10:31,Vivo IQOO 12
116902543,洛璃,2,故事可以给到满分，但运营只能是负分，尤其是更新河西后就是在Bug里玩游戏，感觉更新的新程序是按照病毒的模式写的，只要打开软件就会无限吃爆运行内存。等级养成虽然有点肝探索有点乏味但探索在偶然发现的故事可以给游戏加分，比明日之后好了一亿倍的美术（只能说现在是这样的）让人有玩下去的心情,,2025-03-31 10:04,未提供
411893853,逢于临别、,4,游戏还行，就是咸鱼玩家有点难受，志趣属性达不到，装备穿不上，还有提升协调那个，偷了个功法，然后不知道怎么弄，后来就没了，晕晕乎乎。然后志趣要花费很多时间在地图上跑吧，这你跟我说不肝，时间少的都没法玩，又不是就玩这一个游戏。拜拜,,2025-03-31 09:33,一加手机Ace 5
542683362,Mua雅心❤️,3,从这个出了以后，手机上就只留了这一个游戏，我以为往后的几年就只玩这一个了！结果呢？前俩图还挺好，更新河西以后那真是一大坨，还是稀的！卡就不说了，Bug一大堆，进一个洞窟给卡了几个小时重复进了七八次！竟然在外面也会卡，采集没反应！呵呸！～你家游戏都是这一个鸟样，高开低走最后残废！高光不会超过三个月！拜拜👋🏻,,2025-03-31 09:14,未提供
694116864,柚子是啊,5,值得的，带入感非常强，自由度相对来说比较高，交互也很丰富，但是@网易雷火科技有限公司，能不能把飞檐走壁时路过旁边的人他会来打我这个bug修修啊？暂时退游了，因为把所有东西都获得了，战力也拉到极限了，等以后估计会回来,,2025-03-31 08:26,小米Xiaomi Civi 3
73627076,曹雪岩,5,开放性自由度高,,2025-03-31 07:23,华为FIN-AL60a
52754441,手机用户52754441,2,以下观点纯个人感受。<br />半星给剧情，一星给探索，一星给武侠题材。<br />一星给美术，一星给音乐，半星给时装。<br />应该5星吧，等等，战斗扣一星，交互玩法扣一星，网易运营扣三星，因为不能打0星，1星不算，所以给2星。<br />得分项：<br />剧情很不错，我觉得很难得，但参差不齐，有些剧情很棒，演出也很棒，但很多剧情真的很失水准，支线明显比主线好，再加上长时间在探索，所以很有割裂感。九流门挺逗的，算是成功致敬吧，然后我是会认真看对话的，有很多玩烂梗，还有带点其他游戏（老头环）的对白设计很败好感，可能编剧觉得自己这么写很幽默？AI对话加好感拿礼物一开始觉得很新鲜，久了就有点无聊，所以剧情体验给半星。<br />探索算是最棒的了，不多说了，玩那么久就是探索撑下来的，给一颗星，为数不多的武侠题材动作游戏，咱先不说战斗体验如何，希望多一些武侠动作游戏，给一星。<br />画面音乐我都觉得不错都给一星，被骂的时装我觉得还好，因为剧情给的衣服我都觉得还挺好看的，但是商城里的我甚至没有购买欲望，这不是帮玩家省钱嘛，应该给一星，不过超五星了，给半星吧。<br />扣分项：<br />战斗体验，不多说了。<br />交互玩法体验，总体感觉很无聊，我知道有各种小游戏可以玩，弹琴、投壶、话术、象棋残局等等等等，还能打麻将，还能打团本，我怎么能不满呢？但我就觉得无聊……也可能因为探索太吸引我了，探索完了（其实有很多区域只有90%左右，查b站攻略才探索完）<br />说说最扣分的项，网易的运营，无论是宣传还是这个游戏的运营，网易都做到了极烂，说实话，单独看网易的宣传是很吸引人的，逆水寒、射雕我都被吸引来玩，然后都直接删游戏了，逆水寒大概玩了几个小时，射雕玩了五分钟，燕云也是所谓的3A级别的单机内容吸引了我，燕云玩了好几天，但是问题在于游戏配不上他们宣传时吹的牛逼，现在更是开始自造词来搞宣传了，这种宣传组只需要使劲吹，实现不了自然有水军和孝子洗的姿态我真的受够了。<br />游戏运营过程中网易又开始暴露吃相不管品质了，燕云一开始的版本里我没遇上啥bug，结果更新几次之后怎么bug越来越多了，有钱有心思请主播到你游戏里打麻将引流，没钱没心思保证游戏质量吗？<br />我能感受到制作组的努力，我完全能接受战斗体验很难完善的情况下继续游玩，但网易是我无法相信这个游戏能继续运营好的主因，新内容上线了，重新下回来玩，万一网易突然转性把燕云十六声运营好，那天我回来改评分。,75,2025-03-31 04:42,Vivo IQOO Neo9S Pro+
541289584,六闪,5,pc端<br />玩过一梦，天刀，逆水寒，燕云的故事剧情做的非常好，我从来不看剧情的人也会忍不住去看，代入感很强，中控也不是只会一味的复读NPC的话帮NPC跑腿的人。NPC很有细节，感觉里面每一个都是有生命的一样，建模都有区别不是大众脸，看着赏心悦目。<br />建议：不希望地图出太快，有长草期人才会慢慢玩游戏，所以不用急，把地图做好，做精，做活。河西地图我也很喜欢，但是感觉bug非常多，体验感不是很好，剧情和美术概念没得说，荒漠里有几个热情的老百姓显得地图没那么死真的很喜欢烟火气。<br />关于带新手的活动，可以有新手推荐或者给新手推荐人带他，不然人都窝在自己的世界不敢迈出第一步，外人也不好意思打扰。<br />长草期可以出活动玩，关于多人动作真的很需要更多，期待多人动作，期待更多衣服染色开放。<br />拍照系统多人不能时停很不好，不如把动作可拉进度条放进来，最好可以控制队友的动作<br />建造系统也搞多点组件吧，我要在燕云定居。,8,2025-03-31 03:56,未提供
442568626,奈奈子小趴菜,2,玩了一段时间，感觉金陵楼才是归宿好吧，一堆bug也没谁了，平衡也是做的特别好😂,1,2025-03-31 00:48,Vivo IQOO 12
355668242,菩提镜,5,可 就是没任务的时候有点无聊,,2025-03-31 02:17,iPhone 12
505768997,馍馍嘛,2,两颗星给剧情，剧情真的神，战斗做的和史一样，PVP更是一坨，建议剧情组骑着动作组上班,2,2025-03-31 01:22,Honor 70
14713180,ｸﾞｯ!(๑•̀ㅂ•́)و✧,2,pvp把非对称性做到了极致，移动端包含模拟器外接设施手柄，PC端包含鼠标宏<br />百业战能不能调整一下，头两天挤不进去，每次只能进30个人，打完4把之后人家都不打了。管理看人少了就不开了，那剩下十来个没打的人也打不了，而且有的百业凑不齐20来人还不开，不如就改成8点自动开启，谁愿意进谁进，能组织起来的自然8点之前就组织上了。组织不起来，把这个开启权限给百业的管理，那就是在坑人，因为有的管理脑子转不过来，既然不打排名的话，这个就相当于百业聚会一样，一个增加活跃度的活动，谁家泡个澡还要凑齐二三十个人才能开？<br />新地图的剧情还不错，虽然脱离主线剧情了，但是还不错。,1,2025-03-13 23:59,未提供
552262321,`清零,1,为什么我玩一卡一卡的呢，滑下屏幕就卡顿一下体验感真不好,,2025-03-31 00:23,小米 15 Pro
1884823,zero,5,单人模式吹爆！河西剧情哭坏我了！呜呜呜呜呜呜呜,2,2025-03-31 00:03,HONOR Magic6 Pro
593070504,没有梦想的咸鱼,3,自由度和，剧情都可以，但就是太逼肝了，必须卡进度，而且最重要的是bug太多了，窃听别人交谈，我每听一个讲话，就要再重新进一遍游戏，不然就听不到,,2025-03-30 23:21,荣耀 X30
52886740,风还在继续吹,1,玩了一个月，目前已卸载，团本看到就恶心，战斗机制不喜欢，多玩一秒都是受罪，,1,2025-03-30 21:40,小米13
641142262,xxxx,3,这游戏就像离职不交接同事的烂尾项目，没啥大问题，看得过去，但是小小屏幕里塞太多东西，有点乱七八糟。玩法太多，没精力，食之无味弃之可惜。而且小bug不断，有点糟心。,4,2025-03-30 14:11,一加手机PHP110
18235054,王九九,1,别玩！！！千万别玩！！！移动端卡到闪退！！！网易装傻看不见不修复移动端      玩就后大悔！！！我华为p70ultra虽不是啥好手机吧    画质都调到最低了   连个正常的游戏体验都没有   做个任务卡退三次    打个怪都第二阶段了卡退   刚才正常跑图甚至都给我手机卡死机了    我都怕我手机出毛病    总之  别玩   千万别玩   玩就后大悔,,2025-03-30 22:39,未提供
18592546,回忆在这歌声里,1,各种行为动作跟十年前没啥区别，比如有时候转个身非得要转个半径才能转过身来等等。体验还比不上逆水寒。都25年了，还是武侠动作类游戏，还那么拉跨……………<br />开宝箱嘛！能开出多少好东西来？还费劲的到处找。还踏马的官服渠道服不互通…,,2025-03-30 22:09,一加 Ace 2 pro
11279415,星海漫步,3,2025.3.30.今天河西开封清河全图，野外战斗和镇守战斗都开始三步一卡顿，几次重新登陆游戏触发过两次全图卡顿，都是从河西地区触发的，重启进游戏时在清河开封没有出现过卡顿。已经上传视频自证。<br />2025.3.29.下午登上去试了下，救将军笔树枝那个必卡的树下浓烟大火堆幻灯片卡顿和城墙下ppt卡顿没了，至少能正常游戏了，现在就剩滑沙穿模摔死这个问题了。但玩家碰到问题反馈后，第一个反应反而是给评论bug与卡顿反馈的玩家发违规警告，这样的运营，我个人的评价四星扣一星。<br />2025.3.28.移动端的河西区域的剧情井中滑沙穿模掉落摔死卡剧情，着火的树救将军的笔和城墙下等物件多的场景会有卡顿数分钟人物难以移动难以游戏，河西的手机端优化体验太差了。看后续优化吧。（我做了28号评论的细节补充，如果阐述手机端出现的bug与卡顿让游戏难以游玩的事实，希望优化手机体验是违规，那我只能沉默不在对网易的游戏进行任何回馈评论了）<br />2025.2.1.战斗boss判定问题太大了，判定与boss动作不一致完全脱钩，靠动作判定会出现错判，会出现判定先于动作，判定后于动作。就跟音游到圈里按了是错的没到圈里时就要按，背板还要背什么时候延迟在圈外按，什么时候加速在圈外按。可怕的是不同的boss判定没有统一的反馈，每一个boss还要各个背板，这种背板基于错误的判定基于手机的战斗优化更是让人心力憔悴，建议就开剧情模式，赛季挑战打不过去就别强求了，不是菜不菜，一个搞高难战斗的手游判定反馈不对版，负责战斗判定的策划太出声了。<br />2025.1.15.手机移动版玩了几天，感受就是手机版战斗不友好，多人副本手机也不方便，百业公会不收移动端的标注很多。手机就当单机看剧情吧。<br />剧情音乐等小游戏玩法，大世界探索都很不错。剩下就看运营了。,1,2025-01-14 19:01,Redmi K50
551468080,祈子,2,什么时候才能有一款真正女性友好的mmo手游？,,2025-03-30 21:08,未提供
58273702,克莱因蓝,5,从楚留香到一梦江湖，再到天涯明月刀和逆水寒，我自认为也玩过不少武侠游戏了，玩燕云的时候一开始对燕云的剧情感到震惊，因为很明显地能感觉到，燕云的剧情是认真做了的。<br />燕云的剧情下到百姓上到家国，涵盖的是方方面面，河西从回溯百姓生存挖了四代人的坎儿井，到镇守边关的白头军，处处都是武侠，一个游戏用不用心真的很明显能感受出来了。<br />虽然主角少东家感觉是明显有自己的个性的一个角色，但我女玩男号的时候完全没有代入感缺失这种问题，可能因为剧情写的太过好的缘故，还有十分写实的场景建模，感觉美工撑起了燕云的剧情天地。<br />目前会一直玩下去，也期待更多的地图，希望官方不忘初心，不要后期出现机甲等各种自刀的雷点设计。<br />最后，加强双刀吧我求求你了加强双刀吧我求求你了加强双刀吧我求求你了加强双刀吧我求求你了加强双刀吧我求求你了加强双刀吧我求求你了加强双刀吧我求求你了加强双刀吧我求求你了,6,2025-03-30 20:56,Vivo IQOO Neo9S Pro+
31942194,꧁請風亖嚳乆꧂,1,你河西加个跳过很难摸，搞个破动画连个配音都不来就一个破音乐,,2025-03-30 20:31,一加手机Ace 5 Pro
696760942,厌旌,4,挺喜欢玩的 玩了就会忍不住 哪怕在赛季末的长草期 还是会忍不住上线 会为他打每周周本 为了刷装备 为了刷材料 第1次对一个游戏能上心成这样,,2025-03-30 20:30,Vivo V2031A
710786303,现实还是游戏傻傻分不清,1,打了很多字但最后还是默默删了，退游了，再见吧,,2025-03-30 20:10,小米13
1919518,橘子,3,他喵的，我怎么卡起来卡卡？半个小时左右就开始卡了，就是那种一顿一顿的，那么流畅，我走了几步，一卡走几步一卡的,2,2025-03-30 19:40,小米 15 Pro
429864874,陆地的鱼,5,刀死我了！！！这个剧情刀死我了！！！！！,,2025-03-30 18:53,Huawei P60 Pro
418476129,User418476129,5,平板的不知道玩的行不行,,2025-03-30 18:36,中兴W205DS
579508549,墨星,1,过个剧情，人都麻了，前半段挺好，后面卡死，还跳过不了,,2025-03-30 17:51,未提供
427907938,遇春渡知,5,除了有些支线和背景音乐有点阴间外，强推,1,2025-03-30 17:35,HONOR ALT-AN00
472662032,自由如风,4,燕子燕子河西做的真好新衣服真好看但是孩子的无名剑气全被沙漠吞掉了你有什么头绪吗燕子😭<br />不说了我转伞扇去了，心法置换了没啥奇术拉不动无所谓，装备凑不出四件套也没事，但是我破产了啊燕子！为什么一周那么点元宝啊能不能提高点上线，我能宝钱买玉为什么不能玉换宝钱，别补偿你那五十玉了给我点元宝吧（宋元最好）,,2025-03-30 15:52,Redmi K60
16157180,没有梦想的咸鱼,3,手机端玩家，bug一大堆，战斗也是一坨💩，特别是抛春恨，敌人就在面前还对着别的地方释放，索敌总是锁定离我很远的敌人，武器切换和喝药回血的速度也很慢，有时换了箭就切换不了武器了，要射一箭才能切换，卸势的时机也让人摸不着头脑，那些按键有时点几下才有反应，总之就是很不畅快，有种束手束脚的感觉，如果不是玩过战双帕弥什我真的要以为是我的技术问题。<br />这游戏有很多故意恶心人的地方，打白狼主的时候，整了俩没用的NPC跟着主角，妨碍走位，挡住攻击，说好了一起来打狼，结果完全不出力还碍事。,1,2025-01-31 14:11,魅族20 Pro
53028448,久童照心暖,5,剧情和代入感，音乐都是顶级的，不需要充钱也能玩，开服就买了个6元红衣玩到现在，冲这个剧情会继续玩下去！,1,2025-03-30 15:30,iQOO 9
664697153,棂烛,5,自我感觉真的很好，特别是主线全是刀，支线，特别是那个鬼市的那个，贼恐怖，好像有一次不小心把他删了，然后我重新把它下回来的时候，他在给我搞卡退反正就是你一登到那个界面，然后它就会退回去你的那个手机界面，大概是我手机不行吧，我也不知道我怎么做的？我把它重新下回来的时候卡退了，我也去搜过为什么会卡退，但是应该是我手机的问题。<br />但是我很推荐你们玩的，真的很好玩，代入感真的把你从江湖带进去了。,,2025-03-30 14:49,HONOR JDY-AN00
580311365,全价四万^^,2,3.30更新了2.25鹅截图 纯奶没练好打71可以81不太行 81本可以补位半奶 过段时间半奶不打了 转破竹尘 讨厌沙漠地图河西这段时间不会探索<br />3.10更新了2.055鹅的截图 纯奶有2鹅可以拉我下本<br />开封终章拖到五六月 你真是疯了知道这三个月能流失多少玩家吗？你现在最重要的是开除男明星多招几个程序员<br />3.5 2.28那次说伞漂浮违规了被我删了<br />同时更新了162.6h成功上2鹅的截图 赶在80级开之前上2鹅了非常开心……<br />风沙酒肆我跟你拼了又是强制多人。<br />3.5 升2鹅了 小程序没更新 先贴个1.998上来 睡起来更了再贴<br />哇咔咔今天也没道歉加油祝好似喵<br />没开记录时长taptap看不到 小程序是110h+ 1.91鹅感觉也是能说句话 玩下来就是觉得没人在修bug/做优化啊 最近bug就是越来越多 我经常走着走着莫名其妙立正了 卸势摁了0个反应 而且此游的基本界面上手是真慢 感觉做的反人类了 以及货币种类多的我觉得应该出一个单独的导引 不是所有玩家在此之前都玩过类似的游戏的 为什么会这么理所当然的想呢 而且活动强绑多人玩法非常恶心 追求纯单机的可以不用来了此游后续还打算出强绑多人玩法的活动 我只能说加油好吗 而且最近的一些问题也是0个解决办法只会在公告画饼河西 其实你再不好好道歉就不用担心三月底河西抬不上来了因为可以不用做了 死之前开退款通道记得限性别 别让充六元礼包五元仇杀的好兄弟心寒 他们支持是真的支持 不用退^^<br />补了张图^^<br />人生有梦，各自精彩。《燕云十六声》自开服以来陪伴大家度过了0个春秋。但聚散终有时，今日起《燕云十六声》转型为网易第二款男性向黄油，感谢大家长久以来的陪伴。有朋自远方来，又赴远方。,11,2025-02-24 02:27,未提供
365870180,寄思居,1,修一下吧河西一直闪退怎么玩,2,2025-03-30 14:15,华为TGR-W10
682063421,不到仓库十点半才开始点半才看见,2,河西bug满天飞，打野外首领伤害是没有的，疾跑是出不来的，服了，没出河西之前移动端从来不会有闪退的情况，河西出了以后10分钟闪退一次，永远都是一卡一卡的，我服了,2,2025-03-30 14:08,华为DMG-W00
70699799,坠落到了谷底,5,我是双端玩家，河西更新后玩移动端总觉得卡卡的，打架狂点卸势都会卸不了，和我联机的朋友一晚上闪退了四五次还和我肝到了凌晨两点多也是够热爱了，本人基本是个在单人世界混的三更天长老，要求也不是很高，别变成隔壁逆子那样就行了，说实话这次河西出来我真的有点担心，感觉已经有玄幻的味道了，补药放飞自我把武侠全搞没了😇😇,,2025-03-30 12:40,未提供
710696183,旧梦、,2,无敌了，bug满天飞，一点不修复吗，就等着捞钱啊，你告诉我这bug几天了，还不修,2,2025-03-30 12:32,未提供
639500275,咸鱼不会流泪,5,场景真的美得没得说，每天恨不得24小时待在游戏里，除了运营其他都好,,2025-03-30 12:31,未提供
29219971,彼岸の翊纤,3,我只能说，没开河西之前完全没问题，开了河西之后一直在闪退，我真要爆粗口了，有的时候打镇守打着打着快过了闪退了，我真不知道要怎么说了，,1,2025-03-30 12:21,华为ADY-AL10
345303206,岚轉,2,一会儿要说一说我遇到的最大的问题，我干根本不想玩了，明明超级喜欢这个游戏的<br />游戏很不错，剧情很丰富，有很多梗，总体来说很细腻，打斗之类的没什么可说，因为对设备要求很高，格挡就过了，比较喜欢的就是缩骨功的暗杀流。但是不知道为什么会自己变大，因为进入战斗模式么。<br />我用的是云游，就这样我用留出了66g的空间，却还告诉我内存不够，关键是之前告诉我要留出100mb的空间，然后我去卸载了20gb的东西。回来突然变成还要留出两gb了？<br />能不能优化一下？这个方面很有病啊，我进不去游戏了因为我刚开始流出来的时候是能进去的，后面我去充了个云游会员，再进来的时候就进不去了，给我退钱啊可恶,1,2025-03-30 11:55,Vivo Z3i
10665534,惜寒,2,🧗自由度：<br />自由度确实很高，可以给一颗星<br />🎮可玩性：<br />可玩性对于没有电脑的我，太极接水球简直折磨，手机端的优化就是一坨💩，想要上手机端就把你的bug，还有狗屎一样的操作好好搞体验很不好，扣三颗星<br />🌃画面音乐：<br />画面感很强，音乐也很好听给一颗星<br />🌈总结：手机端bug满天飞，优化一坨💩，电脑我没有，电脑端不做评价，手机端建议删掉了不要折磨自己，保持自己的好心情,3,2025-03-30 11:47,Vivo IQOO Neo9S Pro+
431076876,（陌生男子〉,2,玩着还行，玩法太少，但有主线，射箭，卡等玩法，老是闪退，自由度很高，但功能难找没细节指引。剧情有路牌可以球朱，代入全是剧情刀，那怕知道提前步局也..不提也吧，作的不差但没做好，对设备要求也很高。另外打击平衡由玩家决定。,,2025-03-30 10:36,OPPO R15x
104849746,東,3,剧情很精彩，但游戏时间不多的一定觉得冗长，且很多没指引还无法跳过，半个小时的游戏时间看个剧情动画，下线,,2025-03-30 09:55,小米24117RK2CC
520051584,枯续,3,内存是足够的，更新是说内存不足的，整个手机内存留下了30多GB你告诉我你下一个15至20GB的东西你说我内存不足？<br />我暂且叠个甲哈，本人是在玩这个前玩过不少类似的游戏，例如逆水寒啊原神啊还有崩铁啊各种还有很多别的比较冷门的游戏，燕云十六声的怪不会太难打，就是把武器培养好然后天赋跟上就可以了，但是这个内存和闪退这个问题就是最恶心的,2,2025-03-29 20:36,荣耀 畅玩30 Plus
18709869,灵魂ジ燃烧,3,原本挺好的游戏在二十八号更新我直接崩不住了，官方是不知道怎么去做这款游戏了么？本来这游戏看见太多前辈的身影了，已经挺抽象了，唯一不错的点就是手机上可以体验高画质的传统武侠的既视感，这次更新后就开始离谱了起来，你们自己看看新剧情是贴合武侠的么？这是武侠？还有养成系统问题装备原以为终于定型了，结果你反手甩出一坨更大的，81级装备还有40天后的86级装备之后是不是会继续更新91级96级红装橙装专属套装？你以为你在做天涯明月刀么？战力系统这东西难道就不能一次性做好在端上来么？还有五人副本，你们真是屡教不改，实在不行你就放弃联机副本玩法好么？我真的累了。,1,2025-03-30 09:42,红米 K70
7160589,稻草人面包,2,好玩爱玩，非常推荐，但是只能打两颗星，一颗星给剧情，一颗星给地图，因为实际玩下来就是一种截肢葛瑞克的感觉。<br />我买了无相无间，还有喜欢的几个外观，我把游戏推荐给了好几个朋友，我确实很喜欢这款游戏，这一点母庸置疑。<br />虽然燕云真的很好玩，但实际上还是网易的老一套，把国外大作的东西扔过来，然后咔咔卖皮肤圈钱......<br />我玩过第五，玩过逆水寒，也看朋友玩过蛋仔，全是这一个套路。<br />不能说燕云做得有多好，只能说卧龙，只狼，法环，黑魂，仁王，古墓丽影，对马岛之魂等很多游戏做得很优秀。<br />什么时候动作模组，玩法机制，包括地牢探索的东西都是自己设计的，我再来改评分。,9,2025-03-30 08:57,Vivo IQOO 12
499557249,Acacia,4,为什么这么卡,3,2025-03-30 08:43,Huawei Enjoy 60
547231519,到达站,2,要郑重提醒策划，不要再走逆水寒的老路，这是武侠游戏，不是仙侠游戏，不要再去搞那些花里胡哨脱离古代风格的时装，更不要去搞那些只有仙侠游戏才会出现的发光坐骑，老老实实做写实风格吧<br />河西地图更新了，一言难尽啊，终究还是越来越玄幻了，幽灵马、发光衣服、发光武器、发光侠名，现在河西剧情一路莫名其妙的设定，不发光不玄幻你就不会做外观了是吧？还有主角动不动就中招、动不动就昏迷的剧情也真是够了,8,2025-01-30 09:02,未提供
688027150,L J L,5,taptap下载的燕云十六声是官服吗,,2025-03-30 06:33,Vivo IQOO Neo9S Pro
71675078,手机用户71675078,5,新手玩家，感觉很好玩😆😆😆画风很精致写实，是我喜欢的类型，玩法也比较多,,2025-03-30 05:40,Vivo X90
70869562,User70869562,1,pvp没做好可以参考参考这个 自由度也不如山海基本所有东西都是自由交易 真奇怪山海就是不火 可能现在游戏比较吃社交属性,1,2025-03-30 05:33,Vivo IQOO 11
