用户ID,用户名,评分,评论内容,点赞数,发布时间,设备型号
2515929,余榆虞,3,我真的带着很大的耐心去玩了，我对这类型游戏一般都玩不下去一个星期，这个我已经玩了个把月了，刚玩游戏的时候我抱有很大热情期望，觉得这个游戏玩法多体验不错画面什么的都很精致（后来打脸）<br />越玩下来越觉得玩家们的包容性还是太强了<br />bug太多了，不管是游戏打斗时的还是游玩时的场景画面<br />打斗时会卡顿，跟别人联机打本我按技能会有延迟几秒，不能轻功跳跃<br />大多画面都有穿模现象，有时候多人世界画面全都是脑袋和头发分离然后黑模，进更衣界面也是经常性头发乱飘跟女鬼一样，我觉得大厂做这类游戏这么多了，逆水寒我不知道什么样，但我觉得这个游戏还是没有达到我认为网易该有的水准<br />很多解密探索的地方确实很阴间，某些剧情要点轻功真的很垃圾，好几遍都点了就是没反应跳不过去，点穴定住NPC学功法这个真的很恶心，算是最让我不想体验到的了<br />玩武侠类游戏不多，不知道到底怎么样算有很好的打斗体验，我只知道这个游戏的打斗体验也不怎么样，打击感很一般，躲避和御势很多时候不知道哪个时间点该去点<br />主线剧情清河不羡仙部分我觉得需要提升，那些角色们，我还没了解完，还没生出感情，就都死了，感情渲染太少太突然，我完全对这些角色没感情，每当看到玩家们路牌留言怀念她们，我完全无感，几个其他支线任务时倒是代入感强一点<br />暂时说这些,,2025-03-19 22:14,未提供
391237809,我滚,3,该骂的要骂，什么时候出来道歉？nga的那位如果不是你员工就快点出来澄清，一直不说话是什么态度？wy能不能不要什么锅都往ai上推，如果不是你们下指令ai会做情人节红线的情话吗？<br />玩了一个月，光这一个号就这个时长，还开了一个小号现在也40级了，我能说话吧？,18,2025-02-18 14:29,HONOR 200
389829728,次要角色,4,好好好🙃,,2025-03-19 22:10,OPPO Find X8
446201424,孤独的小灰狼,1,打击感0，网红捏脸如果是卖点的话，请停服，谢谢。（审美畸形罢了）,2,2025-03-19 21:46,小米15
10187506,施主你的节操掉了,3,电脑端开服玩得上头，由于春节出门就只能移动端玩了，然后发现移动端毫无操作感可言，玩没两下就养胃了，建议感兴趣的还是玩电脑端吧😓,1,2025-03-19 21:38,红米 K70
670602728,05,3,不知道为什么一直卡退😢😢是手机的问题吗,,2025-03-19 20:18,华为FIN-AL60
394149534,Sad(白),5,🌟 画面精美，细节处理得非常到位，让人仿佛身临其境!<br />🎉 游戏体验超级流畅，操作感满分，玩起来根本停不下来!<br />🎯 剧情紧凑，任务设计得很有趣，让人欲罢不能!<br />👏 音效和背景音乐也很棒，为游戏增添了不少氛围!<br />总之，这是,,2025-03-19 20:02,小米Xiaomi 14 Pro
516025577,爱❤️,1,他那个获得可以飞的之后，然后你差不多都要去做第2章的任务，然后你又要去肝了。然后那种虽然打击感情爽，但还有很多。很多带好的。,,2025-03-19 19:46,小米2312DRA50C
352726378,。,5,本人女玩家，玩这个上头了，很牛逼，刚换的性能机。打游戏爽的很，这游戏比原神还吃性能，丝滑好玩剧情也特别好！玩过的游戏不少，目前是我最爱的游戏没有之一！<br />🙌<br />🧗自由度：<br />很好！<br />🏹代入感：<br />没毛病！,,2025-03-19 19:07,小米 15 Pro
689404020,姌卿,2,一个小时内闪退三次无语死了,,2025-03-19 18:12,未提供
43509922,劘绯,5,虽然但是剧情好好，官方听劝,3,2025-01-27 22:51,OPPO Find X7
547005538,泽鱼,5,快更新啊，不然没玩的了,,2025-03-19 18:04,iPhone 12 Pro
415305443,粥粥终于来了,2,好无聊，画面不喜欢，捏脸一般，操作也卡手,,2025-03-19 17:35,未提供
26261181,小六子,3,野外BOSS很多技能起手没啥差别，BOSS一些瞬移跃击贴身技能范围很诡异，很影响操作，而且一开始玩架刀时机太短很难把握，要花很长时间熟悉，不过PVE的战力还是很平衡的，熟练之后还是能做到越级击杀的,,2025-03-19 17:32,未提供
441648249,。。。。。。,4,游戏做的确实不错 建议单机玩法 多人世界是真的不想说烂 但是单机玩是真的爽舒服 氪金基本就外观 如果有亲朋好友一起玩更不错总得来说算好游戏就是不要去多人世界玩就行了,,2025-03-19 17:01,HONOR 100 Pro
30062227,仲懿老爷,4,感觉电脑键盘和手柄操作很奇怪，有一些功能直接找不到了，能稍微优化一下吗？救救电脑玩家吧,,2025-03-19 16:23,Vivo IQOO Neo5S
65785575,不能叫珍居吗,4,隔天一个新bug真的无语住了，你游战斗本就有点一坨，没想到还有会吞掉处决的bug。调律，调律有bug。打架，怪概率锁血。体验感差的没边。<br />—————————————————<br />应该是修好了，目前没再遇见影响体验的bug，总体瑕不掩瑜，入坑不亏，好玩爱玩！,10,2025-02-18 22:07,未提供
529074665,持鉴人,4,红线死了，寒姨不见了，家被烧了，江叔也没出现，我出去找他们天天被骗，去过老鼠洞，也救过人。他们说开封好，我就去了，突然有人告诉我一掷千金的地方是用尸体堆起来的！他们说这就是江湖！刀哥，我不去看江湖了，你回来吧！ಥ_ಥ,3,2025-03-19 15:45,OPPO Reno12
13221041,总师,4,还不错，就是缝的太多导致一堆bug，期待后续优化,1,2025-03-19 14:51,未提供
589902519,LiU,4,都挺不错的，就是主线更新太太太太太太太慢了！,,2025-03-19 14:38,未提供
354290318,萝卜炖白菜,4,碰到件无语的事，我做任务，去打那个土匪，我打土匪打得好好的，但其中一个土匪用弓箭把旁边的一个NPC给射了一下，总共有三个在一起，然后我就被那三个NPC认为是我打的他，跑过来打我，你说这是人干的事吗，接着一个人跑去报官，另外两个人来攻击我，我受不了把他们给嘎了，然后我就被通缉了，之后我成功逃脱了NPC捕快的抓捕，完了之后来了个真人来抓我攻击我，关键等级太悬殊，我五十多级，他八十级直接给我干死了，直接进了牢房关半小时，还玩个吊,,2025-03-19 13:51,未提供
110732721,七七噢,5,朋友拉入坑的，电脑确实比手机好玩多了…o_O,,2025-03-19 13:22,未提供
120296355,沐,5,好玩，听劝，省钱（男号）,1,2025-03-19 13:07, iQOO Neo7 SE
84243474,苏隐,5,不必多说,2,2025-03-19 12:42,小米24122RKC7C
98677069,手机用户98677069,5,没玩过，想问问好心人，纯单人玩可以吗？,,2025-03-19 12:41,Vivo S19
422386991,唤月,4,四星给的是美工文案和程序员等辛苦工作的人，一星扣的依旧是运营。,14,2025-02-21 16:39,华为nova 7 5G
705945746,橘黄日落时,4,好玩的 躺平人可以单人看看剧情 摔伤中毒就喊个医生就好 基本上治完就走 男号衣服最好看的还是原皮😲没有啥必须氪金点清河剧情挺好的 我现在就天天跑图 最后记得早点睡😝,,2025-03-19 11:30,小米Xiaomi Civi 3
553504531,感情带师,4,其他方面都很好，战斗系统是一坨，还有我们的小丑剑法什么时候改一下,2,2025-03-19 10:39,Vivo IQOO Neo10
354681876,悠悠🦌,3,🧗自由度：<br />很高，单人大世界很好玩，游戏里的npc都有自己的故事，白天做事，晚上就会回家休息。<br />🏹代入感：<br />很强，不过不喜欢一些剧情。例如火烧神仙渡，还有最后一瓶的离人泪了，居然就因为吃饭没钱就没了。主控都occ了，按照主角的性格来说，她才不会这么轻易就把酒抵押出去了。<br />但是，真的很难过，神仙渡我都不敢回去了，看着就难过，就像自己已经没有家了。之前都叫我少东家，现在就是外乡人了。<br />（不过如果你只当玩玩游戏还是不错的，不过手机端的话有一些关很难闯。）<br />就这样，以后如果感兴趣了再回来吧，主要是被剧情伤到了，暂时不玩了。,,2025-03-19 09:46,荣耀 V30
23879778,心跳托马斯回旋加速然后平静,3,你再拿那个死曝光闪我试试看呢，你试试看呢<br />端游手游都玩，手游操作简单，端游画质精美，各有各的好<br />设定多，新手教程没怎么说全，玩到一半还是觉得一头雾水，前期挺劝退，后面自己摸索熟了就还行，<br />🧗自由度：<br />一般，为什么不能让我把那群人全都砍一遍，我能打六个小时副本，我怕和他们磨血？凭什么我打不过，越打越窝火，剧情全是刀子，感觉是在塑造一个悲剧性的故事，但是凭什么啊，我才是主人公，而且剧情玩着失落感太大了，有一种我不一天24小时在游戏里我就会错过什么的即视感<br />🌃画面音乐：<br />端游拍照好看<br />手游死曝光<br />樊楼歌好听<br />🏹代入感：<br />代不了，看似我是主人公什么选择都给我了其实我什么都没得选,2,2025-03-19 08:24,未提供
343893255,逍遥,1,自由？一点也不自由，每天都有NPC污蔑，必须要用一个材料解除，不然就匹配玩家干死你,,2025-03-19 08:07,一加 Ace 2 pro
466064411,Fall.kaisa,5,很好玩！！！但是为什么一上线几秒钟就闪退啊,,2025-03-19 02:28,Vivo X21A
470663349,。。,3,说实话，游戏前期确实比较精彩，主线剧情我感觉也是目前大世界开放手游里面比较好的了。但是游戏本身也有很明显的缺点，各手机优化太差，很多机型迟迟不上高帧率，同时游戏其他bug众多，最重要的是游戏主线剧情长时间不更新,,2025-03-19 01:16,Redmi K60
647266048,不，不好意思……,4,就其他的都感觉好像，只有装备啥的玩不明白,,2025-03-19 00:49,小米23073RPBFC
388781971,User388781971,5,自由度挺高的，探索很好。就是战斗系统太差了。但是剧情真的很好,,2025-03-19 00:25,Vivo IQOO 10
643774267,M,1,手机端卸势太难 一些boss得熟悉个两三小时技能才能卸势通关 游戏时长本来可以更久 但是已退游好几天 几乎每天在线时间拉满 氪金方面我不多说没啥逼氪的<br />一个boss通关成本太大了 要耗上我2-3小时 甚至有些boss满足条件通关 甚至要耗上好几天来熟悉boss的技能，熟悉完又要不断的练习卸势<br />但你也知道，手机端卸势是坨史 所以我没话可讲<br />没吃过史的可以来尝尝<br />吃过的再尝尝这坨新鲜的<br />总结要么给手机端优化卸势 要么就降低boss数值,7,2025-01-16 09:30,Vivo IQOO 12
64533363,达布妞,5,这是什么情况，一到晚上曝光度就高。,1,2025-03-18 22:00,Honor X50 
702805100,😊,1,游戏前期很长的任务还不能跳过，探索根本肝不完，有些任务还特别难根本过不了，侠镜，试剑，没有固定队伍，进野队打不打个七八局根本打不过，如果你真的能坚持玩，到后面这游戏也没特别互动的内容，除了打下侠镜，而且心力9分钟恢复一点心力，根本不够打，所以基本上很无聊这游戏。建议别入坑。,3,2025-03-18 21:34,未提供
34626081,珂珂紫苏,2,玩这游戏最好身体健康，否则心脏受不了。我玩过很多游戏，这是一款唯一能给我气得无语的游戏。真的是 NB！<br />游戏自由度高，对于我而言是高。探索又很肝，都给我整无聊了。<br />游戏前期的养成是真的肝，现在嘛，好一点。心法置换我觉得辣鸡，开始出的时候没有说哪边放不要的，哪边放要的，第一次给我兑换了不要的心法！还不能撤回，要再次使用就要等待 7 天时间。到了 7 天后，我就立马兑换回来，不用了。它这个心法置换，也是有限制，不能把对应的全部置换，还会有一些不能换。所以这个置换，对而言就是废物。我直接选择最开始的开箱子随机获得心法，反正给我的感觉不好。<br />游戏装备的词条概率是我见过最辣的，没有之一。我用鸣金它给我出裂石，牵丝和破竹的词条？我就想不明白，没什么还能这样？我副武器就是用牵丝，有牵丝属性也可以，问题是你这个属性在主武器上，会整体增加吗？之前吐槽金色词条概率低，现在你要是用金色装备，且四个金色调律和足够的升级材料，它是能给你金色词条，但是几乎全是废的！给我玩文字游戏呢？<br />打镇守出金色装备的概率也是很低，用了心力可东西不是好东西，你说怎么办？心力恢复的速度又是那么的慢，唉～  反正就是这游戏的概率是真的低，不管是啥都低。<br />官方之前说过游戏不肝，我看是很肝，现在感觉好一点点。游戏的一些活动玩法，强制社交，我就是想玩单人，非要多人玩法，没有其他选择。现在是有单人玩法了，我看是被骂了，才改的吧。一些活动的奖励，刚好又是你需要用来养成的材料，你说不玩嘛，养成又需要，你说玩法嘛，自己又不想玩（且开始的一些活动一点都不好玩）。说这算不算是间接性逼肝？还有拉人的活动，就那么需要流量？可是你游戏实际做好了吗？<br />游戏的 bug出现的频率也高，特别是 1.5 的版本。当时停服维护后，进来游戏，出现了很多 bug，我也在游戏反馈了。闪退，卡顿，画面卡主不动（有声音，还能听到操作移动的声音），游戏声音不同步等，最让我头大的就是闪退和卡顿，我是一位手游玩家，没 pc，所以游戏主要是移动端。玩游戏闪退和卡顿的频率是真的高，一天十次以内，每次都要删除后台重新进入。我画质开的也不好，频繁卡顿，让我心烦。在游戏传送的时候，进度条就卡在 差不多 80% 的样子不动了！我去，我真的服了。游戏优化较差，游戏运营给我的感觉就是不好。<br />我个人比较喜欢燕云十六声的画风，这种画风氛围我喜欢，跟其它武侠网游不一样。游戏的画面，我觉得还不错，画质还是挺清晰的。人物的建模，NPC 建模和建筑建模我觉得都还好，有些建模还挺有特色的。音乐我是关闭的，所以这个我不说了。<br />说说让我最气，给我气笑的玩法和事情吧。主线给我的感觉到就是刀，一整天流程下来，就没好事。副本嘛，全是鬼！那个鬼新娘，就是来回吓你。每次被那个机关刺死，我就要重新开始，到了第二层还是第三层，鬼新娘就在楼梯口等你着。那个玩法就是鬼打墙，绕来绕去，真的无语了。前六个宝箱是找到了，到最后一个宝箱没找到，绕到最后发现最开始的地方多了一扇门，就是不知道怎么打开，看了攻略就是门上面的那朵蓝色的花。我是最讨厌天宫地窟这个 P，太恶心了，要是有人玩过就会知道，真的会给你气炸了。我觉得官方是不是故意的？不气玩家，不吓玩家，你们都不好受？要不是需要一些材料，想提升探索度，我都不想玩这个。<br />还有一些玩法如下棋和余音绕梁这两个，让我记忆深刻。前者下棋我觉得出残局的人是身体健康，太恶心了。我能用的棋子都被堵死，非要死一些好的棋子。有一把就是黑子的兵对着我的帅，对面将和兵隔着河相望。我又不能吃兵，吃了它我的帅和将碰面我就得输。而且我的帅只能上下两格跑，因为位置只有这么大能动。余音绕梁这个玩法也是奇葩，我一个手残党也要玩这个，不玩这个没有奖励，也不能推进探索度。你说玩还是不玩，有些余音绕梁的评判标准是真的高，我其它都几乎做完了，额外加的分也达不到赢的标准。我就是双指，操作，也跟不上那个音符下来的速度啊？多指操作又不会，能会我能是手残党吗？一局下来就是不能断，一旦断了分数就不够，要下来只有 4-5 局的难度很高。有的试了十几把都没过，都给我整崩溃了！<br />说起奔溃，有一个地方也是。叫“武成王庙”这里面的机关可不输谁，两边两条路，为了过那个机关我死了十多次还是多少次（记不清楚了），我当时是真的给我气笑了，内心已经崩溃了，我都骂人的心都有了。最后一次运气好，终于是过了。过了一边还有另一边，这种快乐要让我体验两边？真的是岂有此理。<br />说来说去也就这么多，我个人是把这款游戏当做单机游戏玩的，单人联机倒是不错，但多人模式我很少去。因为有些活动就要去多人模式，你不得不去。这里面也夹杂了点私货，包含了一些个人情绪。燕云十六声移动端开服到现在可是一直玩的，到游戏给我带来的一些负面情绪可一点都不少。不管是玩法，养成，还是肝度都有。,2,2025-03-18 21:29,OPPO Find X6 Pro
566932270,霜枫猎火268,3,不是我说，AI对话针放这里很烦人，其次，不会出残局别出，那个象棋我真的吐了，不知道是我运气不好还是怎么，打5把三把残局都打不了，要么就是认输，真***,,2025-03-18 20:23,Huawei Nova 11
708435638,万事,4,主要人物形象塑造立体，地图事件密度高，大世界探索代入感好。<br />手机端战斗手感差，之前没玩过类似战斗系统的有上手难度，但开了辅助卸势基本可以战胜Boss。要善于卸势，找好时机用药（Boss攻击欲望高，容易吃一套连招）<br />地图里的墓穴地洞是真多，尤其天工地窟多恶心的机制，建议用伞漂浮。武王成庙不评价。<br />服装不评价<br />培养主要集中在装备，心法上。奇术升级不用采材料，每周不肝加活动会有奇术材料支援箱，不着急。<br />多人优化差，多人战斗很卡。<br />关于悬赏，不肝每周四个悬赏令，基本可以避免仇杀，除了玩家花钱悬赏。<br />悬赏治病要点赞啊。,3,2025-03-18 20:01,HONOR 200 Pro
684434481,兰锋,2,男号衣服不好看，女号姿势不好看，战斗手感差，小游戏太多武侠内容不足。,2,2025-03-18 19:38,iPhone 14
118276821,骨折竹节虫,4,入坑大概一个半月<br />刚开始的时候特别上瘾，主线剧情也塑造的特别好，但是主角在主线里的战力设定为什么感觉忽高忽低的让我感觉有点捉摸不透，不过还是很好看的。<br />画面什么的都很好看，就是主角头像能不能多来几张好看的，也有可能是我的审美问题，我玩的女号真的没几个头像好看，我觉得以后的活动除了一些小配饰呀多出一些好看的头像也很好<br />关于服装方面，希望关于服装配饰方面能再多出一点拆分，和头发捆绑的那些配饰希望能拆开或者能够染色，这样能让服装不单一（玩女号就是喜欢漂漂亮亮的仅个人观点）然后男号的服装有些真的很丑。。有很多女玩男都想穿的帅帅的，一看商城没几件好看<br />战斗方面的话我不怎么玩止戈，最多就是觉瘴林，我是一个纯奶玩家，战力也不是很高目前80级1.88鹅，有关于攻击伞的定身技能能不能有个优化呢，经常会打偏导致没了先手，还有奶伞的群疗CD有点过于长了吧，虽然是个无限范围的群奶，但是也就只能奶一下然后加增伤，可以降低一下增益然后减点CD，然后脱手之后也只能奶一个人，希望能关于这个也做一下调整吧<br />关于门派能不能把那些半成品快点端上来😭急急急，还有青溪这个门派存在素……？（别骂我我是青溪的）治病不是青溪的也能治，而且治病还需要抢病人，现在人又多，门派内也有业绩高的歧视业绩低的……而且需要病人点赞多加业绩，公屏上就有不要赞免费给治的以此来抢病人，希望能增加一些关于治疗呀这种方面的专利吧，小利小惠就可以。<br />希望这个游戏能走的远一点，多丰富玩法和世界观，想一直带着红线和刀哥的心愿走下去。。,3,2025-03-18 19:11,未提供
97708462,65z,2,🧗自由度：<br />不高 不太行 不如原神 原神不做主线任务 能满世界跑 燕云十六州不行 能跳过主线 比如 须弥主线没做 纳塔 我3天 就做完主线任务了 一点不影响我的游戏体验 燕云十六州就不行😡😤清河都出不去😤😡,,2025-03-18 19:10,Redmi Note 12T Pro
523450009,小白hour,1,不是这大世界社交还要说啥吗？这能随便给别人杀了，去悬壶被蛇毒杀，你还拿他没办法，挂不了悬赏，不知道是谁，自己一肚子气，主要这是个别人吗？反馈一个问题半个月了一点结果没得，这就是游戏特色？,,2025-03-18 18:56,Vivo IQOO Neo8
438801791,T^T,5,为了江叔来玩的😋,,2025-03-18 18:19,Vivo S18
569293374,帅气的咸鱼,3,我是一个休闲玩家，偶尔打打怪，仅个人感受，不针对任何人，玩了几天不太玩的下去，和市面上好多游戏一样，感受不到沉浸感。<br />其实非常失望，职业武器太固定，没有盗贼侠盗之类的职业，武器也没有飞镖之类的，休闲玩法很少，游戏打斗操作感很差，让我感觉不到一个真是的武侠世界，一进游戏和平常网游一样，旁边全是各种按键，沉浸感不足。<br />先说武器江湖里有刀剑就有拳掌，就会有下三滥石灰粉，要是可以自创武学或者自由度高一点的打斗模式会很好。人物移动很怪异，难道一个人从起步到奔跑没有过程么，直接就跑那么快都不真实。<br />第二就是休闲模式，我就发现了钓鱼，那些打麻将斗地主我都无语，真真缝合啊，能不能加点扮演模式，最最基础的扮演押镖镖师，或者入室盗窃的小偷，或者官府的人抓小偷，我觉得我应该是这江湖里的一份子，而不是我格格不入。目前我没发现有什么随机事件发生，听说下线以后人物会变成npc，那么npc要是调戏良家妇女是否可以拔刀相助，扭送官府，是否有官府悬赏的大盗，当个赏金猎人。沉浸式难道不是整个江湖和我息息相关，我是其中运转的一个齿轮么？<br />第三打击感操作，真的很拉胯，玩起来很怪异，例如，手机玩弓箭为什么不可以设置陀螺仪，必须手滑，没考虑到部分玩家操作问题，键位很怪异经常误触，这个我倒是没来得及看能不能改，可能能改我没发现哈，武器这么多没有那种术业有专攻的感觉，最无语是那个处决，还处决不死叫什么处决，打击真得借鉴一下真三国无双，里面我玩赵云，能感觉到招式顺畅<br />然后不知道有没有拍卖场，我现在剧情模式都不让我进城，没有考虑到部分玩家不想过剧情模式全是任务，为什么一定要过任务才能开地图呢，谁规定的，你不是说沉浸式武侠大世界么，任务难道不是江湖游历的配菜么，不应该是我自己进这个江湖，感受江湖的魅力，就像真世界一样。<br />操作下蹲手游居然找切出来漫步也是，为啥没有趴下，视角还可以切换，为啥要切换啊，人力有时穷，你咋不看上天呢，搞个第一人称第三人称不就好了，而且大地图上希望出现一些随机事件，比如说一些npc聚众闹事，随机出现在那，你跑地图看到了就是遇到奇遇事件了，这样我才想跑图逛逛啊，堪舆也行啊，挖宝藏，随机npc出售藏宝图或者小怪爆藏宝图，对不对这些是玩法啊。<br />也可以弄一些副职业呀，铁匠打造武器，加点自由度，炼药也可以啊，制毒药，暗器淬毒啊，蒙汗药啊，看过鹿鼎记么，韦小宝最常用的就是蒙汗药。多的就不说了反正，并没有让我感觉到沉浸大世界武侠江湖！<br />ps:如果我提到的，里面有的话可能是我没玩到提前致个歉，我说出我觉得不舒服的也是希望变好，评价我觉得就是官方集思广益的一个渠道！,2,2025-03-18 18:17,Xiaomi Redmi K60 Ultra
668326472,x血腥英雄路,4,闪退太频繁了😤,,2025-03-18 18:09,Nubia Red Magic 8 Pro
9951010,『绘梦之人』勿忘初心,5,🏹代入感：<br />🧗自由度：<br />进入开封你就会体验到什么才是真正的江湖,,2025-03-18 17:47,Vivo IQOO Neo9S Pro+
427919018,落雨.,5,燕云你们多招点人吧产能不足不够玩呜呜呜,1,2025-03-18 16:59,Honor X50 
349376865,社交恐惧,4,自由度蛮高的，动作设计一般，故事设计非常好，在江湖武侠这类游戏中，我觉得应该是排在第一位的，只要剧情设计一直保持高水准，会留住玩家的,,2025-03-18 16:47,未提供
3632967,司南,5,这个游戏也太大了吧，安装包1个多G，解压缩10个多G，外观2个G，地图拓展包10个G，对手机是沉重的负担。,1,2025-03-18 16:28,未提供
