用户ID,用户名,评分,评论内容,点赞数,发布时间,设备型号
446255397,User446255397,5,只能说这是一款有门槛的游戏，对历史缺乏了解，对底层人民缺乏代入，对传统文化缺乏认同的，确实难以接受这样的剧情。但一旦跨过门槛，充满中华传统内核的剧情内容令人感叹。,,2025-04-05 22:15,华为BRA-AL00
428011368,User428011368,3,快给我优化啊，每次玩一半就给我卡退了，要不然就黑屏了,,2025-04-05 21:41,未提供
4640678,黄金帅香蕉,4,【副本玩法】<br />地图的怪过于一致。都是一团小兵，打起来都一样。应该增加耐打，难度适当的单体小 boss。<br />【战斗机制】<br />BOSS战卸势卸麻了。一场战斗大部分时间都在卸势，玩家缺少主动空间，过于依赖卸势与数值。因为BOSS 攻击都是锁定向的。若增加些非锁定向范围攻击，且具有一定的前后摇或者技能时间，可供玩家在此期间灵活发挥，体验会好很多，例如狂野之心，怪猎更多就是找空档和身位的控制，将输出美学展现的淋漓精致。不过怪猎大体型招式不容易辨别，燕云敌方出招比较清晰是优势。目前主要太单纯太病态，可能比较魂，但更多像 qte 音游。。实际把卸势抛开，主角的入场攻击模组是比较少的，只能说卸势在帮开发组节省了角色的动作开发。<br />【流派玩法】<br />武学流派体验轴太长，玩法和培养方式单一，过于同类化。流派的搭配上，目前设计过于固化，很容易玩腻。其他游戏有着更自由简便丰富的组合玩法。切换流派替换时间和资源成本，繁琐复杂，毫无意义。<br />【装备养成】<br />极差，装备除了追求数值带来不了什么快乐。装备调律单纯数值，套装效果几乎只一种固定选择，设计的套装如果不增加多样的选择，何必要设计套装效果，直接其他方式附加给角色不也一样。加上装备刷取苛刻几乎没有更换的选择。等级突破后，装备形同废品回收，毫无价值。其他游戏至少武器有独特性功能性价值感。以前因为某游戏遗物系统毫无养成乐趣弃坑。只能说有过之而无不及。<br />【奇术技能】<br />好评，丰富多样，搭配组合自由，突破技能有新的效果机制。但解密奇术和战斗奇术只能共用 8 个键位实在不方便。另外培养的资源目前来看正常，但不知道后续开放后，资源要求会不会上升过高。【心法被动】<br />心法功能设计好评，但目前心法搭配组合过于套版，看似多样，实则单一固化。同样存在着麻烦的切换成本。心法收集上挺有江湖味，但培养设计上显得有点矛盾纠纷。心法可以置换，培养上实则和加点无异，但又不如可自由重置的加点方便。虽然可方便转换，但又不如直接资源继承功能。心法满重后，玩家只要有满重几个心法后，出新的心法直接转换即可，估计会导致开发对于心法的开发设计比重会降低，导致游戏战斗核心流派玩法缺少扩展性。感觉不如与剧情/挑战/任务绑定，去直接提重。流派心法需要玩家推进流派相关的任务挑战获得更多的流派点数，当然也有一部分是探索获得。！！！这样玩家就能主动去控制提升想要的心法，而且所有的心法能同步提升，另外可以去专门精化个别心法。不至于现在前期切换心法斤斤计较，很缺心法，后期心法满重后培养系统几近废掉。<br />【资源爆率】<br />金色装备，金色胚子，调音石，都需要爆率，爆率十分低。一天打完，甚至啥都没有，最大的问题不是歪，而是他根本就不给你多少东西你都没法去歪词条。其他游戏至少资源多，而且就算歪了没准可以给别的角色。抠抠搜搜。然后换流派装备必须要心力资源重新刷。真的难以理解，玩家换个玩法是抢了多少钱似的。<br />【多人副本】<br />机制过于讨厌，明明正常的战斗交互挺好的，非要加一些复杂难过的机制，降低战斗乐趣。十分杂乱甚至角色职业头标，都没有都不知道队友是干啥的。难度毫无分级体验，只有一个难度分级，毫无逻辑，试问各位满级后，一定是缺少装备才去刷多人本吧，缺少装备一定很难刷吧，假若我没装备刷过去那我还要刷装备干啥。导致前期刷很难，很难受。<br />【赛季制度】<br />赛季制度不知道玩家要与什么竞争，莫名要搞一些资源回收扣点。搞一些没啥策略性乐趣性 PK 加点。赛季开发新的内容，多是徒增重复性的工作玩法。<br />游戏里也有很多，例如题材，背景，场景，手感，特效，音效，细节，剧情演出，梗融入很自然有趣等等。,18,2025-03-25 12:19,小米24122RKC7C
118434977,日常想宰人,5,四编<br />之前退了一段时间，现在纯剧情党，活动都不想管的那种<br />河西主线很顶<br />家国情怀这种真的很在我的点上！！！<br />燕云十六州<br />切入点也很好<br />—————————————————<br />三编改好评<br />打过了退不了游了<br />昨儿个开了四格卸势+四瓶药之后还升到了九级世界（对不起我膨胀了）<br />说实话武侠风大世界我本来就蛮喜欢，但之前的全是多人，各种团战PVP啥的真的很讨厌对我来说。而燕云能单机玩所以短期我属实是放不下，还有好多任务没做地图没探呢<br />喜欢大轻功赶路，好帅，甚至不想传送<br />近的话可以飞檐走壁<br />唔还有一个很麻烦的玩法是偷师，可不可以不要搜那么密集啊我真的不想染血的你们放我进去的话我们大家都好<br />装备到底怎么配怎么提啊<br />昨天到处采集想升奇术，但是有些明明就在附近可上上下下找不到啊啊啊啊啊<br />—————————————————<br />二编<br />本来说音游过了改评分的，现在音游确实过了（遇到的都过了）（不知道是改过判定了还是我习惯了）<br />脸也重捏了<br />但是战斗被卡了<br />哈哈<br />我都剧情模式了<br />能不能不减疗能不能不减疗<br />一次只能带三瓶药还得减疗<br />自动都打不过<br />我要不是菜我为什么开剧情模式<br />我都开剧情模式了战斗能不能简单一点<br />打小十七死了一次然后小福禄寿帮忙过了嗑了两瓶药<br />刚刚打田英又挂了<br />嗯下楼的时候还死了有七八次好像<br />本来以为卡是我的问题但看到折戟路牌的留言发现好像不是我一个人觉得卡<br />马上再喊道主帮忙打田英<br />打不过就暂时退游回米家<br />—————————————————<br />云玩的<br />别的没什么，本手残开剧情模式+辅助卸势当单机游戏玩还不错<br />很后悔最开始没好好捏脸，现在看着丑得要死有没有办法重新捏呀<br />不过才玩没多久很多功能没开<br />来评价是因为路过一个音游被判定迷到了（所以是恶评）<br />本音游玩家<br />玩一个根本没难度的音游<br />死活过不去<br />please tell me why！！！古乐你告诉我为什么我是哪里没跟上<br />啊啊啊啊啊啊啊啊什么鬼东西啊延时也不高啊（50左右）高画质低画质都试过了有几个双押就是按不上啊啊啊啊啊啊啊啊<br />什么时候过了古乐什么时候再来好好评价,,2025-01-09 15:42,未提供
675709402,白逾,5,好玩好玩好玩！我还是劝你玩燕云十六声吧，曾经有教育家做了一个实验，把中国孩子和美国孩子从楼上扔了下去，中国孩子使用Q键开千斤坠获救，而美国孩子不玩燕云十六声，直接认输。从小培养玩燕云十六声的意识，比任何教育都重要，这就是玩燕云十六声带来的好处。,,2025-04-05 21:30,Redmi K60
651161282,YU,4,我只能说要燕云不拍帅儿子的是这个👍🏻<br />氛围感很到位<br />冲着捏脸和武侠风格来的<br />就是养成系统没太弄明白<br />应该是我自己的原因<br />因为以前只有玩二游的经验<br />比逆水寒好的吧<br />逆水寒我捏完脸就跑了<br />后期又往手游使劲了<br />皮肤花里胡哨<br />反正我是独行模式<br />剧情也是可以的<br />历史感也很到位,,2025-04-05 21:02,未提供
102911546,我是大傻der,3,手机啥时候能让我开60帧,,2025-04-05 20:50,小米24129RT7CC
432302256,逐梦星云,4,说实话做为一个开服玩到，现在的玩家，这游戏过过剧情，就可以了,1,2025-04-05 19:55,Vivo V2417A
49071306,星云,4,666过新地图任务的时候卡这儿了,,2025-04-05 19:48,Redmi Note 12 Turbo
647688879,sunshine,1,985策划一定觉得自己做的探索系统可有意思了，你是要杀了手机端玩家吗，还有奇术概率能不能调调，太低了,2,2025-04-05 19:38,未提供
33567390,脱剑膝前横,5,河西剧情真的神中神，麻布袋剧情我真的一边哭一边玩一边查资料😔😢😢😢<br />强烈推荐小伙伴们入坑。大世界奇遇应有尽有，剧情跌宕起伏，射箭、投壶、猜谜、打牌、偷师、奇遇、pvp、boss战总有一款适合你<br />🏹代入感：10<br />🧗自由度：10<br />⚔️世界观：10<br />🥊打击感：8<br />🎮可玩性：10,4,2025-01-09 10:52,Vivo IQOO Neo9 Pro
33486781,没有昵称,3,占用30g的空间，真的还是优化一下占用储存，要不然越更新越大,1,2025-01-10 11:11,未提供
528600804,十,5,对比市场现存手机游戏，此款游戏还是比较贴武侠世界，自由度探索度也高。,,2025-04-05 18:53,OPPO PFGM00
506086299,starone,5,呜哇哇哇哇哇哇河西的剧情我爱死了（就是有点费纸巾😭😭😭😭），结尾这种浪漫主义的表现手法也很巧思，我爱！🥰,,2025-04-05 18:20,华为 MatePad 11
572835299,ususnsn,2,逆天锁帧，天玑8200都只有30帧，卡的一匹,2,2025-04-05 18:10,Vivo V2314A
68658808,告死鸟,1,下的pc端，游戏很棒，打斗很好，画面精致，第一章爽玩，一切都要从我来到开封，被骗了那瓶离人泪开始说起，只玩到那，有点反胃了，我就知道玩不下去了，太恶心了，不求你做个龙傲天式的主角，但这是个啥，你做个一直赢赢赢的都好，这个。。。。emmmmm，不要说什么更伟大的目标，只是被恶心到了，玩游戏还要跟个🐢一样吗？附图表示真玩过<br />一般不评价，但是这次是真恶心,2,2025-04-05 17:31,Huawei P50E
400659065,今朝同淋雪落,4,🧗自由度：<br />仅个人感受，手机玩起来还是没有电脑端的流畅，过剧情老卡壳<br />🏹代入感：<br />挺强,,2025-04-01 18:28,OPPO PFZM10
699736734,不除,5,哇塞。？直接给我卡退了<br />🉑,,2025-04-05 16:54,Vivo V2046A
462865744,临江仙,5,河西出之前，三星不到，河西出之后，我觉得五星都少了,4,2025-04-05 16:46,华为WEB-W00
668913383,阿黎,5,很爱玩，就是手机带不动，内存不足了，只能删了😖,,2025-04-05 16:39,OPPO Reno4 Pro中国版
5734376,蓝懒,5,文案剧情组我允许你骑着运营策划上班,7,2025-04-05 16:13,未提供
20540800,FXY,3,玩了有一段时间了，游戏自由度很高，可以随意探索，原本是有些bug，但还可以接受，但是河西更新后，一传送或者过剧情就闪退，一天要重登个七八次，弃游了,,2025-04-05 16:09,Huawei Mate 50
567271453,薇尔莉特伊芙加登,5,自那句我天生不受教进入江湖，我便慢慢开始了我期望的江湖，明白了刀哥说的江湖更多的不只是打打杀杀还有那些芸芸众生，再后来遇到戏弄百姓的黑财神，为生为民，问这天地，苍生真的无言吗？不，侠者，大则为国为民，苍生无言，侠为其声。来到黄沙遍地的边域，遇到一个又一个平凡且伟大的角色，看到了大唐安西军为疆土死战不退，撑的不只是大唐的脊梁更是我华夏无数民族的脊梁，我明白人定胜天，这是华夏民族几千年来如此强大的原因。举此三尺青峰，誓平沧海四方渊。,2,2025-04-05 16:06,OnePlus Ace 2
442587950,昊,2,真无聊，除了剧情，其他的很无聊，难度应该也算有吧，就是打起来又麻烦又无聊，还有些甚至不知道怎么过，一点提示都没有，这竞技场更是没有公平这一说，纯比战力，不是技术。卸了,2,2025-04-05 13:22,Vivo V2417A
435743964,3570,5,太好玩了！爱玩逆水寒的，绝对不要错过燕云，玩法风格差不多。但我个人感觉燕云的剧情要有意思得多，因为在过逆水寒的剧情的时候，我根本就没有期待感，但是燕云的剧情就有那种吊胃口的感觉。解密和玩法上也更丰富有趣。带入感也非常不错，突然冲到npc面前，npc有被吓到的反应，我骑马都不是横冲直撞的骑了，太土匪有失大侠风范😏还有捏脸系统，不知道为什么，我逆水寒捏的脸没有燕云的漂亮，可能是我的捏脸技术提升了吧😋,4,2025-04-05 14:04,华为ADA-AL10U
528815846,乌松应,5,你有这么权威的第九艺术进入中国,,2025-04-05 13:51,HONOR 200
670650799,芩惑,5,太好玩了，每天都有同门找我高级，人也特别热情，怕我孤单，总有人想让我去多人世界，必须大大滴推荐，如果你不知道玩哪个门派就来三更天，我们三更天的同门对人都特别友好，等你当上长老后，每天都有人来找你，再也不用怕玩游戏一个人了😁,1,2025-04-05 13:32,OPPO A2 5G
503283552,越无欢,5,我觉得很好！！！剧情超级无敌感人，哭的稀里哗啦,7,2025-01-18 23:34,Honor 70
8651052,环形蕾丝花边垃圾桶,4,4.4<br />你说长安近，可是抬头能看见太阳，为什么却看不见长安啊😭<br />今天打了主线，天杀的，你后面要骗走我多少眼泪我想都不敢想😭之前也做了问渠几许。人民才是历史的创造者啊，生在沙漠里是他们没得选，几代人用血肉堆叠才挖到水😭民生多艰。燕子我给你当一段时间护官宝，前提是剧情组能骑所有人头上。保持这个剧情质量你做什么都会成功的😭<br />感觉燕子很大胆，不用少东家走剧情，用一个胆小懦弱又善良的普通人。代入感很强，没有轻功没有武学没有看不见的四维背包，普通人太难活了，到处都是兵，九死一生啊。看到被商队赶走我叹气，但是大家都没错啊，都有难处。没有水走大漠找烽燧堡的时候特别焦虑，想的是望山跑死马，担心布麻袋晕在大漠里。被鸟追的冒火也只能点闪避，到黑水城没有攻击键的我唯唯诺诺全程下蹲。换少东家我可能就冲进去百鬼起手了。最后漫山遍野的棉花看的我泪汪汪，飞鸟带着他的眼睛回家乡了😭<br />小程序有河西入梦的组队活动，边塞军人身份对应了陈哥，右边文案也是和布麻袋相关。所以河西剧情应该都是这种代入式的吧！还有琵琶客幻术师和深闺女子，感觉商队头领指的不是大曹，应该还有其他人。或者给大曹再开个个人支线？期待期待！<br />过完送个布麻袋，开封地区有金叶子、小乌龟，清河地区有死人刀、红线和离人泪，还有养父和赵二送的风筝，少东家衣柜里要塞不下了！话说战令头上那个毛笔好适合当江五郎的鸟架，sukisuki😇<br />——————————————————————————<br />3.2<br />江五郎太萌了，有头部稳定器还会小鸟展翅，给你加一颗星。你就不能今天出江燕明天出刀鸽后天出赵鹅吗😍<br />态度还行吧，游戏是有改进的，可能是要改的太多了人手不够吧。最近的白衣修罗和白龙都挺好看的。缝伪人公寓的新模式我还挺喜欢的，刚玩还以为要鲨我呢，原来就偷了钱袋啊哈哈。<br />—————————————————————————<br />主线剧情很好看，没得喷。奇遇啊支线什么的量也足，好看爱看。感觉最吓人的是井中人奇遇，起鸡皮疙瘩了。不过可能是江叔逃命的时候没包好襁褓，导致少东家淋太多雨现在体质不好，大宋耐晕王，耐力条也短，蹦几下就累了。不能减少轻功体力消耗吗。探索还老下地，请问这里是盗墓笔记吗？<br />其实挺肝的，就算开了剧情模式也不能当纯剧情党，你要去打装备抓蹊跷升奇术凑心法。不然你可能打不过boss推不了剧情。只玩一个流派还好，材料够的，多了就要肝，奇术材料爆率也挺低的。谁教你牵丝扇子上面能随机出来裂石和破竹词条的呢？装备掉落随机，词条也随机，你工资能不能也随机一下？我现在也没有金头和金护臂😡金剑词条也是怪东西😡真是原原十六神啊你<br />单机不纯。新春活动怎么是在多人世界，看烟花的地方一堆墓碑你有什么头绪吗？最近想要悬赏的披风，npc海捕仇杀都是50积分，抓真人玩家900积分往上。抓人的想快点拿就是要去打真人。罪恶值没有减少途径，被抓的不被npc抓到最后就是放别的玩家强制入侵你的世界😡想抓真人也难，目标在玩法里，接不了悬赏。好那我不鲨人了，我去接营生悬赏，这个竞争更激烈，比鲨人的还难抢。单机的ai也是笨蛋，容鸢本不走机制，我就这样被炸炸炸炸，在黑白屏幕中暗自心疼装备耐久度，柳诗诗你别拉我起来送死了，求求你了。<br />你那个缩骨功任务三我现在都记得，打红温了😡其实策划自己都没打过吧，一堆天工洞窟的跳跳乐，死了还扣装备耐久，没有伞逃课我什么也不是😭还有杀神出庙任务，跳房梁是人玩的吗，打完还有个骑马回枪没拿，又碎一下，碎碎平安呀。<br />加了门派能不能来点特别的？比如可以直接进偷师的地方，我真的好想逛一下天泉门派，偷师的时候听npc聊天老有意思了。铁铁你们武学是真难偷啊，我将叛逃醉花阴加入天泉这个更高级的门派。<br />男号衣服很多丑东西，而且男女号很多同款衣服不一样，比如男号有面具女号没有。男号不能拥有红线做的小包吗😡给个破草鞋是什么意思😡英雄与美奇遇的服装奖励给我看笑了，是扒了和尚的衣服吗，洗了没有，凭什么私吞赵小姐给我买的女装啊😡<br />我是菜比，能不能加个菜狗模式，表现为取消boss减疗，虽然在辅助卸势的帮助下现在地图boss也是打完了了。但是我还记得那个被河伯折磨的晚上。郑鄂也ex，还好不是玩牵丝流派的，不用刷装备，那破语音，懒得喷。<br />题外话，谁让你把头发兑换放在第六关的，不能辅助卸势又被叶万山悄悄地打碎了😭准备以后战力碾压再打。<br />———————————————————————<br />叶万山不过如此😎还得是奇术打伤害，百鬼神龙太白是一直在c的😎👍,134,2025-02-12 21:41,未提供
586464227,omg,5,好玩 剧情太好了,1,2025-04-05 12:42,vivo Z5x
413262596,寒霜,4,最近更新以后就老闪退了。😒,,2025-04-05 12:33,Huawei Pura 70
688621127,口罩队长,3,"这种大厂的游戏，只要是老玩家懂的都懂。<br />1.画面音乐剧情配音。包括特效渲染、手感。保证都是顶级的，这无需质疑！这也是吸引大多数玩家的入门手段。<br />2.武器系统、心法、奇遇、特技、各种小游戏。高难度boss,设计的目的就是让你玩儿的各种复杂。你没听错，这就是故意的。玩家花费大量的时间玩这些东西，必然时长就有了保障。而且这不是普通的肝，是肝到死!等你把所有的玩法都搞得差不多的时候。你突然间发现实际上只有一两个好用好玩的，其他的全都是鸡肋。没错，现在游戏的复杂程度都是做加法。美其名曰：玩法丰富。自由度高。<br />3.新手玩家在初期的探索之后，会产生沉浸感，所谓的上瘾。然后慢慢的就会进入下一个阶段数值游戏。这种圈钱的深度套路大概有十年了吧。我说的可对，各位道友？<br />4.现在所谓的大世界自由探索，无外乎是一个噱头。你累死累活忙了一晚上，实际上捡的全是垃圾。以前的套路是背包紧张，格子数不够，现在的套路是让你捡，让你开心的捡!作为轻氪玩家或者是白嫖玩家没错，你连玩这类游戏的资格都没有，你只是给游戏打工，人肉气氛组。<br />游戏的总体制作水平还是在线的。玩玩剧情，逛逛风景。别给自己定目标，打不过就打不过，任务没完成就没完成，你会玩的很轻松。",1,2025-04-05 12:06,Redmi Note 11T Pro
14434090,K,5,我玩游戏最注重剧情，燕云这一点做得很好。<br />故事背景选在五代十国末期、宋刚建立时，就引起了我的注意，这是个民不聊生注定处处是悲剧但又让人看到希望的时期，如何构建故事就很重要。<br />我对清河感觉不大，但很喜欢开封跟河西，这两个地图做到了历史的厚重，而且不伦官还是民的视角都发挥得很好，比如最近河西的安西军和麻布袋，让我深深的动容了。安西军失去长安支援坚守几十年，直到最后全部战死；麻布袋作为一个唯唯诺诺的普通人，也能为了他人的遗愿不顾生死的奔波。那个时代太难了，但是再难也有人向前。不知道后面会不会写归义军的故事。<br />至于河西的写意风格，我没觉得有问题，本来设定就是梦，而且里面有大量象征符号，比如有的动物、植物、怪，可能是大量被害的军、民、商人等，总不能满地图都用写实的尸体吧，有的玩家可能受不了，过审也不一定好过。<br />当然，问题也不是没有，比如 bug，比如沉浸感上没做到统一，有的很穷苦的地方饭都吃不起却能喂猫…嗯……<br />不过总体来说，瑕不掩瑜，燕云是一个有叙事野心的游戏，希望梦保持水准。,4,2025-04-05 12:02,未提供
117244521,User117244521,5,剧情真的很棒很震撼，服装也是很很的爱了，但是bug有点多,,2025-04-05 11:45,Vivo V2002A
695890685,最强拖延症柚总,3,开服就玩的<br />不愧是你啊冈易，bug暂且不提，剧情也没得说做的确实不错两星给剧情，抛开这些那就是纯纯坐👍牢游戏，装备刷取跟玩的一样，最近更新什么兑换金装什么的给我整笑了，刷了少说也有5000体力，真是一个能用的都没有，这些暂且不提，就论掉金率，平均9次能掉一个已经不错了。<br />特别是毕业弓个射决，这个百分之3的概率放出来跟开玩笑的一样，射👍决我差不多了做了200多个一个金的都没看到，都给👍侧👍滑吃了是吧？你跟我说是0.03%我都信。合计我天天花费那么多时间采材料来给自己找罪受，说白了是我自己的错，我不应该浪费那么多时间在这个游戏上。<br />接下来是这个最让我生气的和鸣，真就是旱的旱丝涝的涝丝，长鸣珠和鸣非绑100+抽数砸进去毛都没看到绑定的砸了70差不多忘记了，也是什么都没有，长鸣玉和鸣反倒是，十连两金什么意思，鹅👍心👍人是吧？更气人的是我朋友，我亲眼看着她10连出两个八音窍，她总抽数才17抽而且还是绑定的真的，比啥了我还难受😁，我自认为自己没有那么非，但燕云确实改变了我的命格。我一再怀疑这个概率是否是专门来对标我们这种中氪党，冲了大月卡，大大小小买了不少衣服，只要对我口味的我都买了，我真的是，相信冈易的抽奖概率我真的是个--👎---。话就这么多，最近那些暴雷我也懒得提，我只想说我现在能做的只有停氪停肝观望，因为我不敢相信这游戏会不会被侧滑玩👍👍没。,6,2025-03-07 23:00,索尼Xperia 1 IV
18615823,画里刻,5,我平时不评论游戏的，但这个河西主线，棉花这个主题，到最后我整个人都在麻，故事就得这么讲啊！<br />爽到了真的。,,2025-04-05 11:18,Huawei Mate 60 Pro
627796,钟未见,3,只评价新章节河西，是真的阴间，又空又大，那怪物已经不是武侠范畴了吧，手机画质本来就差，色彩画面真阴间，还有满地的垃圾收集要素，通关剧情就已经不想玩了，剧情也尬的抠脚,2,2025-01-19 17:46,小米Xiaomi Pad 7 Pro
