用户ID,用户名,评分,评论内容,点赞数,发布时间,设备型号
486018795,菟菟灵,1,个人喜好不是女频，服装不够漂亮，玩起来容易打瞌睡，不够吸引我，退了<br />我回来玩了，移动端开最高也有抗锯齿，新手机啊……<br />真的就是勾十无限暖暖的手机端，区别对待，纯找虐。真的就是歧视手机端玩家，还要吃手机端玩家的饭！体验完全不同！然后手机端玩过的人，去说无限暖暖优化的问题，还要被pc端的捂嘴！说你怎么不去网吧开个电脑玩无限暖暖！或者你怎么不去买个电脑玩手游，无限暖暖！笑死我了<br />我自诩不是手残玩家，但是活动奖励二十次都拿不完，手机端非常拿满，而且福利特别特别少！这还是过年的福利，都那么抠搜了！,2,2024-12-05 16:53,HONOR Pad 8
9618246,夜の星空,1,自1.3版本更新出现噗灵怪收益bug，填了一堆工单，找了无数客服，他们没解决bug，没解决补偿，解决了在下，再见无限暖暖,,2025-03-16 17:13,iPhone 13
651645476,碎˃ ˄ ˂̥̥,3,我觉得可以多增强好友互动让大家可以一玩,,2025-03-16 16:45,Honor X50 
597319253,妙妙,3,为什么老是显示空间不够啊，到底要多少啊,2,2024-12-08 22:03,Vivo V1938A
708663589,User708663589,3,🎣交互丰富度：<br />为啥我进不去啊？还没进去又闪退了，加载到了62就闪退了。😓😓😓,,2025-03-16 16:07,Vivo V2002A
629170941,汐汐,3,就是刚开始进入奇迹大陆太慢了,1,2025-03-16 15:21,Honor X20 SE
708055270,不服你吻我,2,不是卡顿，就闪屏真的是绝了,,2025-03-16 15:14,Vivo V2426A
332703927,A上官蔷薇,3,为什么华为鸿蒙系统不能玩？什么时候可以玩？希望尽快安排，真的很喜欢这类游戏。,,2025-03-16 15:11,Huawei Enjoy 20e
643816871,纸折的鸟,1,垃圾，画质可以和我模拟器玩怪猎p3有的一拼。玩法无感（跑跑跳跳然后捡垃圾/捡垃圾/捡垃圾/... ...），剧情无感（你带着活在现实的异世界属鼠穿越异世界变成巴啦啦小魔仙要收集8888件衣服来拯救世界...），人物设计一坨，台词一坨（起的名字也跟个小孩子想的一样，我甚至觉得这个还可以和我邻居家小女孩看的动画片有的一拼），剧情我猜也没有好到哪里。动作僵硬一坨（人物还不能捏脸，感觉每次看到都是木偶一样蹦跶蹦跶的）。他引以为傲的服装也感觉一坨（除了光污染根本就没有一点观赏性）。算了不说了，最后评价：建议十五岁以下的女生游玩。设定毫无逻辑可言。,1,2025-03-16 14:57,未提供
100037968,噜啦噜啦liu,5,冲着暖暖去的！溺爱了,,2025-03-16 14:45,HONOR 200
690737393,加油学习，人人开心个屁,1,进不去，还要实名认证。,,2025-03-16 13:55,Vivo IQOO Z9
396276466,湘水薄河,1,又一次被气得头疼牙疼后给你打差评来了。<br />首先我玩游戏就是为了开心，但别的游戏是玩家迷惑行为气人，你这游戏纯粹是官方恶心玩家。<br />尤其是成就奖励，就一个成就达成才能拿5颗钻，但你设置的难度呢，尤其是限时，有些关卡就是卡玩家在线时长，必须十几次完全记住走位卡极限才能完成，就比如那个120秒困难幽灵列车的限时。<br />你主线都不更新，任务少，我现在任务都做完了没任务了，除了日常和月卡，为了拿钻只能做成就拿那少的可怜的钻。<br />还有，重点！常驻阁给两天一次的免费抽数，本来给的资源就少，月卡的钻每天才90钻，给我改成正常的100钻，咋那么抠搜呐你，不买月卡两天才能攒一抽，你那不要脸的杀熟抽阁保底，二十抽一个五星，我从来都是保底才出一个五星件，还有你那个破满五星几次必出什么件，刚开始我还以为是抽到次数直接送的，原来是占保底次数抽出来的大保底。<br />还有每日分享有十钻，你暖五根本没有，闪暖是一天分享一次有十钻，深空是一周分享一次有十钻，到了暖五啥啥没有，你做的还是暖暖系列吗，把深空那套捞钱操作带暖暖来了是吧。<br />游戏可玩性真的很低，很无聊，纯粹是暖暖ip吸引老玩家，尤其我生气的点还有，别的玩家五星阁抽到180抽是为了染色，我抽到一百八十抽是根本全是保底出的部件，不抽到次数就齐不了。开服到现在全是保底才施舍玩家一个部件，到现在才过来骂你是我以前脾气好，现在是刚从游戏下线被气的头疼忍不住骂你来了。,6,2025-03-16 13:53,Realme GT5 240W
421015242,耶！,1,纯粹是闪退闪的没办法了 越更新越爱闪退 十分钟闪退五次 想怎么样 做个主线一直在闪退,,2025-03-16 13:46,华为  MatePad 
492274511,布丁,5,一个有着温暖内核的游戏,,2025-03-16 13:19,未提供
639177631,一挽清愁,4,就是容易卡退,,2025-03-16 13:08,iPhone 13
557757080,予晚🍬,5,希望多出一些活动，钻石真的攒不住，衣服超好看,,2025-03-16 12:08,未提供
586805365,帝诺,5,很好玩啊！！！！,1,2025-03-16 11:27,iPad Air 2
98775343,孤傲着非同凡响！,1,玩不了啊，刚进去就出现这个，点X后直接退出了,,2025-03-16 10:16,Vivo Y77
656037993,小晴,4,这是咋了,,2025-03-16 09:43,小米24094RAD4C
31166241,黑卡,5,奇暖十年玩家，现在也一直在玩，奇暖能玩那么久的原因主要是衣服多而且好看而且游戏度不高上线点点就可以收集衣服了，无限暖暖也是早就预约了，开服后第一时间上线下载，衣服真的很好看<br />还是有很多需要优化的地方，比如体力真的不够用，噗灵获取方式只有跑地图和用体力换，感觉暖暖手机端还是有点卡，我的手机虽然不太好，但是带原神都能带动，暖暖就卡一些，小游戏大部分还是比较简单的，除了一部分真的玩的人红温，比如飞跃热气球第五关非要卡28秒吗，30秒都比较难了，还有那个要自行车拿的奇想星，也是完全拿不到找的朋友帮拿的，还有一个五星卡池时间太长了，长草时间有点长，不过还是很喜欢的<br />对暖暖还是很期待的，希望暖暖越做越好!,,2024-12-10 09:53,小米24090RA29C
525214903,宝宝,3,不是平常模糊有点卡就算了，今天还进不去，我还在过剧情呢，我都不知道听了多少次，诺诺伊的暖暖你来了，然后你跟我说游戏崩溃了，我不管，我要200钻,1,2025-03-16 08:33,Vivo V2002A
414165684,t,5,为什么打不开，老是闪退QAQ,,2025-03-16 08:30,华为荣耀9X
655710850,盗笔抵我意难平,5,就是不知道为啥，这两天我进去就卡退，一直重进卡退回登录界面，又是个解答一下吗？😞😞,3,2025-03-16 08:25,Vivo Y85A
647130792,嘻嘻嘻嘻嘻,2,抱歉可能真是手机问题还有七十G的空间就一直闪退一直闪退，不知道是不是只有我出现这种情况，游戏整体还好就是一直退，一直进着进着就黑屏了，真的很影响游戏体验感，从昨天开始就突然打不开了，很服！如果是我手机bug我自认倒霉，如果是游戏bug我希望尽快优化解决，谢谢,,2025-03-16 07:40,未提供
415605565,U归归,5,iQOOz9turbo<br />极致画质，拍照画质开的2k，仍然糊的头发丝儿都看不清<br />不愧是电脑，拍照就是可爱,1,2024-12-05 20:14,Vivo X80
82094932,倪瑜,2,手机端画面模糊，人物走路卡手……,3,2025-03-16 01:17,未提供
602715928,啊这···,1,怎么说呢，这是我玩3D中手感最差的那一批，虽然玩的时间不长但是手感真的不咋样，真的越玩越郁闷，在我看来唯一一个比较好的优点是风景，这就很离谱😅😅😅,2,2025-03-16 01:09,未提供
669824304,我是奶龙,3,抽卡抽的挺抠门的，一件套装都把我开服积攒的所有钻石给薅完了。还有优化方面电脑都稳不了60帧，手机上画质拉的又完全没法拍照来看，希望花些时间好好优化优化吧。有些活动任务没啥指引，做的摸不到头脑，后续版本中希望能加一些提示,1,2024-12-03 13:42,红米 K70
610311869,你是一个小傻妞,5,本人现在玩的是移动端，由于今天去网吧专门体验了一次PC端，我真的要疯了😔😭😭😭😭这个画质是真的吗，也太美了，我真的要受不了了，我要为了暖暖攒钱买游戏本啊啊啊啊，啊啊，啊啊，啊啊,1,2025-03-16 00:34,Vivo X100
690796633,2185,5,爱你暖宝,1,2025-03-16 00:32,iPhone 15 Pro Max
535290700,嘤嘤嘤,1,Pc端还行，如果暖暖过剧情时面部表情丰富点就好了，生气思考紧张表情都没怎么动过，导致面瘫化了。<br />说可怕点有一种整容过的面部僵硬感<br />游玩方面目前还没遇到特别让人红温的(不过目前只玩了6小时)，就是游戏里面有一些术语听着很尴尬，我对剧情要求不高，稍微有点中二但还能接受<br />(给四星)<br />————<br />移动端不推荐下载，之前上wy的云游戏玩过，画面真的很烂，我赞同评论里说和pc是两个游戏的说法。<br />最后如果能把配置要求降低一点会更好，因为大部分女生都是专一休闲养成类的(是刻板印象)，所以基本不会买高端设备体验，可这个游戏把画质拉满是表现效果最棒的。叠纸没考虑到这点<br />27日评论：<br />玩到自行车那里了，自行车很难骑，只要不开到障碍物它会越骑越快，基本走几步就要左右移动从障碍物里挪出来。<br />让我想到以前我玩口袋妖怪，当时有两个自行车，其中一个和这个加速设定一样。我骑不来，换了个不会加速的，虽然慢但是匀速，我没撞过。<br />另外自行车手感不行，你让它掉头要掉老久，要是去到野外，有石头有树木的，真的一点都不想骑<br />(减一颗星)<br />——————<br />27日二编：<br />游戏内bgm很好听，特别是到了千纸鹤那里，拍照很出片。<br />然后就是首充送的裙子，换个游戏都能卖70r的质量我觉得很棒。<br />有个点不能接受，就是无限暖暖虽然说是大世界，但是任务模块依旧按照一般网游的标准，卡等级不让你做任务。<br />另：我其实不喜欢给服装强行弄属性这个设定。因为每个人审美都是不同的，我认为很性感的衣服，却被打上清纯的标签……<br />无限暖暖有创新，但是依旧跟着前作的风格将搭配战作为一大特色，我觉得没必要。<br />前面说了，我认为审美是多元化的，为了赢搞那么多数值，结果点推荐搭配一看，花花绿绿加一起不堪入目，搭配战不如说是数值战，好不好看没人管，数值高就行。<br />可能是没人氪金只能加点门槛强迫收集裙子升级吧，毕竟玩起来确实比较轻松，四星裙子比很多五星好看，那很多人都没有氪金的必要。甚至限定衣服池我喜欢的就一个配件，谁会给不喜欢的凑一套。<br />但这样玩起来其实很割裂，一边是自由大世界，一边是对属性对等级的要求。外表自由了内壳还是那样。<br />28日再编：<br />自行车掌握后骑起来感觉还可以<br />赶羊的游戏制作出来后内部有测试过吗？羊吃一次草拖五秒，还难赶的要死，特别是到边缘后，怎么赶都是原地转又拖6秒。完美通关刻薄的要死，一次草都没吃才160，十多次了已经。<br />开局的草是自动定位羊的吗，三次都是开局吃草根本来不及赶，体验差死了。完美通关比普通通关多了30钻啊<br />(扣一星)<br />————<br />1日续编：<br />那个自行车适应后其实还是可以的，它到了最高速后就不会提速了，下坡路还会受惯性影响。只要不是一直按w，踩踩松松基本不会撞到建筑物(补回一星)<br />另外不知道是不是人气不够，还是新手福利期或者别的原因，它福利给的真的多，我就玩了三天，不氪的情况下，五星限定池配件已经有三个了，主线剧情免费送的白色裙子很百搭。<br />最爽的是，你不用像传统网游一样，在副本里坐牢，过了一次之后就可以快速通关。可以说是我目前玩的游戏里前期最爽的大世界游戏<br />真香！(加一星)<br />————<br />2日续篇：<br />说真的，叠纸真的不会刻画打斗场面。没有炫酷的决斗画面，只有花里胡哨的特效魔法。<br />敌人放个千纸鹤就瞬间抱头慌了，暖暖算大女主人设吧？独自勇闯下水道修电路、在高空用千纸鹤高飞，独自飞跃重创囚鸟，勇闯火车没有安全措施一路跑，为什么能被一个反派的千纸鹤震慑了？？<br />不想ky，但我已经能脑补如果换个游戏，主角早就干起来了，前面都已经给人设铺垫好了，关键时刻告诉我你怂了看着对方朝天一路走，之前一直说有漂浮能力，明明可以冲上去拦截的！<br />暖暖又不是小女生，维持一下设定啊<br />————<br />大概是最后一次评价：<br />讲真挺失望的，度过了新手期之后就是漫长的肝肝肝，体力不够用、材料不够用、想要刷主线肝粉宝石抽衣服，结果主线卡衣服(就是必须要有xx衣服才能继续过主线，但是你又没材料，想要材料又没体力，想拿宝石抽衣服得到高属性服装，诶，你又不能过主线。陷入了一个死循环)<br />得，更肝的都玩过了，那就肝吧。但是你更受不了的来了。<br />这个小游戏真的恶心的要吐，难的真难，简单的又简单到你完全不想玩。我先说后面的。<br />比如非常简单堡垒球、踢足球、还有那啥跑酷，就是简单到不需要怎么动脑。但是偏偏它完美通关条件刻薄到要死，我拿原神这个大众游戏举例，让你们能够理解：你普通通关它一次只给你5原石，但是你完美通关它能一次给你40原石。差距那么多，而且不像打深渊你要凹属性(用暖暖的术语就是升级衣服)，过个小游戏就可以了，你能放弃吗？<br />但是那个游戏就是无聊到你想睡，完美通关条件又很刻薄，你玩个十遍才能过，偏偏这个游戏又很废话，你失败了让你过几个对话再重开、你进去了又给你来个过场动画，再给你个【321开始！】，如果是跑酷哪再给你过一个跑道的全程动画。有可能你过关25s，看动画10s。<br />很简单的游戏设置，给小学生玩的，但偏偏通过要求刻薄，失败了又会红温，大晚上就想肝几个宝石，结果逼你玩起了儿童游戏，你还过不去，你能放弃完美通关的奖励吗？<br />折磨死人了，那个小游戏。<br />——<br />然后难的游戏收集那个奇幻星(是叫这个吧)，它是真的一点提示都不给你，就看着你卡住卡在那半个小时。<br />简单的游戏烦到发困，难的游戏你要想个半天最后就得一个奇幻星。<br />——<br />游戏吐槽完了到肝度：<br />游戏本身并不肝，体力上限和材料上限摆在那你要肝也不给肝。<br />但是问题来了，假设要做一套衣服要100材料，你一天只能做10，做完一套就要大概10天。你要肝还肝不了，都给你材料卡的死死的(然后主线剧情还要锁死一套衣服)。<br />如果你和我一样，生活忙到不行，只有放假才能偶尔上线，那恭喜你，准备一套五星衣服做一个月吧。<br />衣服做不了，那我上线玩个小游戏吧，玩到红温，那我做支线剧情总行了吧<br />————<br />好，接下来吐槽剧情：<br />我真的怀疑叠纸真的是乙女游戏大厂吗？过到烟花那个岛上，抓那三个反派时，你大女主辛辛苦苦，从地面给你跳到几百米的高空，稍有不慎就要从热气球上掉下去。<br />我认为无论是谁，过那剧情都要花个15分钟，女主跳了个15分钟，好不容易抓到了坏人，但是坏人留了后手逃了。我们的【大男主】直接坐了个热气球，拿起一把玩具一样的🗡️，不用任何套装力量，一跃高空一斩而下，大女主飞了半天追了15分钟的人，我们的大男主一剑拿下。<br />不要问为什么没有漂浮套能飞，不要问为什么一个做衣服的会用剑，也不要问为什么一个整天待在店铺里没有运动体型均匀的人，能一剑干过三个壮汉。问就是大男主光环捏。<br />好了，事情结束后没人问女主在高空追逐有没有受伤，没有问女主怎么靠飞跃追上去的，只有人围着大男主夸赞你好强啊～呕……<br />恶魔怪女主打的，勇气烟花女主做的，精灵和道具没了是女主冲上天救的，那男的难过还是女主凑着脸去安慰，结果女主人间蒸发一样，功劳全男的<br />这么爱男的剧情我真的要吐了，真的是大女主作品，女强男更强，那你做个屁的女性向啊。<br />——<br />总结：要可玩性有画质、要休闲有画质、要剧情也有画质。<br />都能受得了都不雷就入坑吧<br />打一星了，没可玩性可言,19,2025-02-27 05:31,荣耀 50
601734568,冷酷小帅.,1,一个小时了还是进不去😅,2,2025-03-15 23:59,红米 Note 11
665133384,仙卿道,5,总体来说福利还是good ，基本上每版本更新两次，就能攒到一套五星，我现在是微氪，大概也就充了400，从最初的蝶屿风袭，到现在的皮肤，多多少少有了六套五星，每天上线最多也就半小时，少的话五分钟就结束，总体来说，我是真的很喜欢叠纸的这款游戏<br />🧗自由度：<br />高<br />🎣交互丰富度：<br />仔细看剧情的话还是很好的,3,2025-03-15 23:29,Vivo X100
47777723,介抒川,5,挺好的ᥫᩣᥫᩣᥫᩣ爱了,1,2025-03-15 23:26,未提供
708287968,左手定则,5,暖暖真的超级好看！强烈推荐！,,2025-03-15 23:15,Vivo V1813BA
538765774,hhh,5,妈呀，你taptap推荐页面展示能不能给暖暖带妆啊，明明那么好看却不带妆。🙉,2,2025-03-15 22:56,Huawei Enjoy 60 Pro
494961803,四刀,5,开服全勤，氪条1900，移动设备华为pura70，pc设备华硕天选5pro锐龙版<br />发言仅个人观点<br />先说优点吧：<br />1.pc端画质绝美，建模绝美，可看配图，均游戏内调滤镜后原图直出。pc端操作很方便（除了追星星）<br />2.服装设计较精美，同时大世界的场景建模又激发了玩家的搭配欲，哪怕日常做完了也可以继续在地图里骑自行车找地方拍拍拍。<br />3.游戏内指引做的很好，噗灵都会明确指向奇想星和灵感露珠，宝箱等，美鸭梨大地图工具也可以很方便的查漏补缺<br />4.可玩性很高。尤其是副本内部的探索，各有各的特色，难度不会很简单但只要操作熟练就可以拿满，比如版本活动限时幻境，地图内的小游戏小挑战（推南瓜等），还有奇想星的获取，很有趣味，但容易红温。<br />5.官方一点点听劝，有在努力优化移动端，商城也上了直氪实惠小礼包，一键搭配也有了，提了很久的阅读物收录也有了，问卷里填的建议都会收集好辩证性地采取，会通知优化进度之类的。<br />6.不仅游戏美术出乎意料的美，配乐也是非常非常的契合场景也非常的好听，最典型的就是愿望仓库副本的fing my way。<br />7.0氪微氪也能玩。大世界玩的主要就是探索，暖五可免费获取的衣服也很多，如果不每次都下池好好规划资源分配，也可以拿整套的限定，但高图鉴肯定是不太可能的。<br />8.交互丰富度高，在暖五地图里可交互的东西很多，吹泡泡，洗小动物，钓鱼，带着暖暖在路边的长椅或者是草地上的野餐垫上坐下，碰到留影沙漏可以和其他暖妈拍照纪念<br />以下缺点，个人观点不喜勿喷，理性讨论：<br />1.版本更新较快，地图资源少，想帖主这种地图全锄完成就点347的每天获取钻石的来源只有大小月卡和日常。<br />2.日常少，<br />3.体力非常缺，游戏内获取服装的材料需要大量魔物晶石，抽扭蛋机需要大量噗灵，制作奇迹套装需要大量心得，收集胜利祝福闪光也需要刷大量的体力，升级服装增加分数需要的闪亮泡泡和金币丝线等等都非常非常吃体力。但是体力回复很慢且没有中午晚上的体力领取，体力除了自动回复和用能量结晶，其他获取途径为0，非常影响在线时间，导致日常时间很短，上线2分钟就可以刷完体力然后不知道该干什么因为什么都要用体力。<br />4.好友作用不大。好友间无法互送体力，目前也没有联机。<br />5.拍照系统仍有很大不足。暖暖的动作和表情太少，用来用去总是那些姿势。大喵无法和暖暖一起拍照，使用缩小套能力的时候拍照也不方便，pc端竖屏拍照很伤颈椎，移动端拍照画质很糊尤其是华为，而且参数很难调，拍照目前无法录视频。华为移动端拍照体验真的很差。<br />6.交互有时比较麻烦。沙漏不能一键隐藏总是影响到交互，有时候突然就交互失灵没办法去洗小动物。<br />7.华为的移动端体验极差。ue5的引擎在移动端优化确实很受限制，但是没想到那么受限。这个真的需要技术组的员工长久努力，现如今市面上能带动ue5引擎的移动设备确实几乎没有，看以后芯片进步吧，目前移动端只能尽力优化，追求游戏体验的最好用pc端，移动端真的很难坚持。<br />8.五星服装进化材料获取困难，五星服装进化材料需要7个但一周只能获取一个，一套全进化要21个材料，进度非常缓慢而且没有次数补充，且无法找回缺失的次数。<br />9.全进化以前，服装进化除了变了颜色，其他的几乎不变，没有设计的变化。<br />10.后期等级升高困难但是奖励很少<br />11.官方运营非常不成熟<br />12.剧情很一般，很失望，如今的版本活动主线不如开服的风物逸闻“家向左，心愿向右”。文案组仍需好好打磨，最近写的故事线远不及预期，配不上玩家等了几天的期待，重要信息比如女王为什么和同父异母的妹妹关系很好为什么女王会被称为暴君都没有讲清楚，浪费了菲洛米亚和奥利维亚的姐妹情深，没有写出来感人的东西真的很可惜。<br />13.奇迹之旅（大月卡128档）奖励与预期有落差。<br />14.稀有材料采集麻烦，尤其与天气有关的。<br />15.服装适配做的有点差，带了帽子头发会自动被包起来，搭配起来很不好看<br />16.产能低下，版本更新快但活动很少，制作组只能靠硬卡关卡等待天数把版本时间拉长到一个月。<br />17.极其杀熟，越氪越非。叠纸经典套路。<br />18.键位自定义一坨。<br />19.查找材料很麻烦，品质从高到底无法锁定，每次都要重新点。<br />✍🏻建议：<br />1.染色系统加快进度<br />2.商场小礼包增多<br />3.体力获取途径增多，或者减少体力消耗，把体力换材料的消耗降下来。<br />4.祝福闪光可分解获得噗灵丝线和泡泡等材料，获取材料视祝福闪光升级等级而定<br />5.主线剧情收录<br />6.材料查找时用的方式让玩家自己锁定。不要每次都要玩家自己手动把获取时间调到品质再调从高到低还是从低到高，真的很烦。<br />7.增多天气预报系统。一下雨就去找雨滴蝶兰一找到就天晴，制作组你们有什么头绪吗？天气概率真的很烂。<br />8.增多能力格子，简化奇想能力的更换方式。<br />9.增加等级升高和收集齐套装可获得的奖励，每升一级送体力和30钻，每升五级和十级就送钻石体力和共鸣水晶<br />10.增多好友间互动方式<br />11.增多背包可携带道具<br />12.大月卡送暖暖的衣服<br />13.收集大喵斗篷加奖励<br />14.加强运营的培训，运营人员业务差。,107,2025-03-15 21:15,Huawei Pura 70
635964856,许莹杏,5,🌃画面音乐：画面很美好，我很喜欢，音乐也好听！,,2025-03-15 22:14,Huawei MatePad Pro 11
69994889,萌啊萌,5,当暖暖说出愿望是：想让天下的女孩子肚子都不再疼时，我下定决心玩这个游戏了，再难再红温也要玩，电脑端真的美🐭了,3,2024-12-12 06:34,Honor X50 
708435612,帕10,2,孩子只想看一个完整的房子。主要是光看这个有点儿吓人。然后看到那个人把他站在空气上面也有点儿吓人。这个...主要是觉得有点儿吓人哈。,2,2025-03-15 21:42,Honor X20 SE
100487916,龙卷疯,4,画面：作为一个开放世界的游戏 肯定是需要内存和处理器要求的 图像设置里开到极致个人认为画面还是非常清晰的 蝴蝶蜜蜂都清晰可见 衣服细节纹理也是 我最喜欢的应该是里面水池的画面展现清澈见底 波光粼粼<br />建议：但是作为一个换装游戏 拍照动作是不是可以再多一点 来来回回就几个好看的动作卡来卡去 再好看的新衣服拍出来都感觉很无聊了,7,2025-03-15 21:11,小米15
