用户ID,用户名,评分,评论内容,点赞数,发布时间,设备型号
111353673,暴躁老樱佛系活命,3,25.3.12<br />1.1把我办公本干烧了转云游戏，1.2发现华为平板适配了糊就糊吧优化态度挺诚恳的，1.3手动换了新设备虽然肯定不如pc但是苦日子算是到头了<br />现在主要问题是剧情很差，剧情体验需要散落的文本拼凑而且剧情人物对话的僵硬感和不合理很多，产能比较低每天基本是长草的哪怕刷奇迹套装也是长草的<br />12.6开服<br />华为手机平板都进不去你是没做适配是么<br />二编，平板华为matepad，手机nove7pro，平板进不去，手机页面不适配连登录都登不了真是服了<br />三编，说真的做足了准备卡顿模糊虚幻五难做，就是没想到没做适配进都进不去，你还扯热搜请水军大晚上发道歉优化微博都没啥人骂了，玩暖暖系列本来就是情怀，硬是翻电脑下pc开云游戏体验也是差劲，除了暖暖的建模衣服依然精致其他什么红温挑战都是差劲的，半成品这么明显真就是版号快到期赶鸭子上架，一天时间看你评分9.0掉到6.4了，隔壁mc开服那可是剧情大雷➕移动端优化顺便加点串子，你这6.4有90％都是我们的真情实感你就老实受着吧,12,2024-12-05 10:29,未提供
445189505,甜.,3,为什么华为会闪退，试很多次都会这样,1,2025-03-12 11:55,华为 荣耀 X10
696430628,溪照,5,很童话的世界，人物服饰和大地图.关卡别的不说，真的很美。（适合当摄影以及绘画的素材库）玩法大有开发的余地.厨师套-烹饪，园艺套-种植，企业家套-经营管理…第一款不时要看流水的游戏，因为我真的很担忧琳琅的筹备资金（不过把琳琅稍放迟点，让技术积累成熟，应该会表现地更好）总之，加油呀！,,2025-03-12 11:38,华为ADA-AL00
608165246,百年一遇的互联网冲浪人,5,开服三个月了，我把四星好评改五星了，真的全网无代餐。<br />喜欢大世界+休闲玩法的，入股绝对不亏。<br />移动端画质提升巨大，如果你有电脑，用电脑玩极致画质，简直就是顶级视觉享受。<br />长草期每日任务2分钟解决战斗，是我玩过所有手游里，每日负担最轻的游戏，绝对不会有上班感。<br />补的图456是开服三个月后的移动端。<br />______分割线________<br />刚开服，服装一般，没有闪暖好看，根本没有抽的欲望😂<br />大世界好评，压力不大，非常适合休闲玩家。跑跑图拍拍照，玩完心情超级愉悦。<br />箱庭关卡尤其好评，玩起来特别享受。<br />游戏偏童话风。<br />副本可以一件扫荡，淡游期间2分钟就能搞定每日，这是我最最最喜欢的地方，很多游戏退游都是因为每日太长，感觉像上班一样才退游，无限的日常超级舒适。<br />开服一个月，厂商一直在优化，从最初的移动端一朵花都没有，到现在种满花，而且花瓣清晰可见，不输PC😌<br />做衣服需要的材料不算多，想玩的时候随便肝肝就能做，但是体力非常缺，卡体力没办法，只能慢慢熬时间。<br />一些细节还需要优化，比如自行车手感😅<br />总之挺推荐的,1,2025-01-06 22:10,Vivo V2417A
577816540,别紧张不是好人,5,好玩儿，裙子好看,,2025-03-12 09:28,OPPO PEQM00
24991873,谢况奕,2,主机的按键太过繁杂了，弃了。这个游戏整体感觉就是无聊，剧情无聊，地图风景也大差不差，可玩性就是跳跳乐，跳到高处了，因为一下没跳好从头再来，容易红温。爱玩大世界游戏的不建议玩这个游戏。<br />--<br />试了主机，确实不是一个游戏了，画质清晰，操作也不卡手了，但是依然很晕！！！这个问题能不能优化啊<br />--------<br />晕3D晕的很厉害…但是原神和鸣潮我一点都不晕…开极致画质锯齿也很明显…跳跃手感很差…捡东西的按键卡顿严重<br />作为开放世界不能爬……不能游泳……开局是一条直线的副本…感觉属于开放世界的阉割版…<br />晚上回家再试试主机版本的，反正目前感觉手机版本是很难玩下去…,4,2024-12-05 14:48,Vivo X200
705951279,凌乐乐乐,5,除了特别耗电，游戏小游戏很红温外我很爱玩，暖暖真可爱,,2025-03-12 09:13,Redmi K60
601782695,User601782695,5,女儿无敌,,2025-03-12 07:13,iPhone 15 Plus
449775311,TeapTac,1,笑死反馈了也不解决问题哈,,2025-03-12 03:04,iPhone 16 Pro Max
349158418,溯末呢喃,3,除了开新的大地图外，可以玩的真的很少很少，一个版本也就几关跳跳乐，剩下全是跑腿<br />剧情……连宝宝巴士都写不好也是服了。女王剧情还不如不开时有点神秘感，为了妹妹成人礼抓无辜百姓进玩偶，我觉得暴君这称号还真不是误会😅<br />运营这方面，只能说叠纸确实很会骗氪很会pua呢。反正千万别为这游戏的任何功能性氪吧，简直背刺狂魔，出一个不上不下的东西出来下个月绝对有更好的上位，带来丰富的氪金打水漂体验。这还是留给富婆们消受吧<br />画面和音乐的氛围感确实好<br />开服评价：<br />非暖暖玩家，纯粹来玩解谜大世界<br />优点：<br />1. 地图设计的不错，谜题量大管饱<br />2. 这梦幻感有迪士尼那味儿了，仓库乘千纸鹤特别梦幻。不过我过图装不穿大裙子，梦幻感少一点，官方要不要加个高光场景重现功能，让玩家随时换不同大裙子过来截图<br />缺点：<br />1. 主线剧情都别说是12+，可以说是8+了，任务剧情会好一点<br />2. 战斗手感很差，索敌判定范围特别窄，高度判定也是，而且好像判定出发点还不是人物中心而是右手，很怪，非常怪。看动作是个法师，实际上为了命中率都变成近战。判定好像还有延迟，明明攻击的时候索敌了，但攻击后快速位移就很容易miss。还吐槽一下这个攻击动作，真的好像扇耳光啊，特别是换了黑发套装，每次战斗都有种“吃本女侠一耳光”的既视感<br />3. 很多跳跳乐的容错也有点低，很容易红温<br />另外，移动端可以试试平板玩，我用一年前不到2k的平板也能玩，就是哐哐掉电<br />分享一下自己搭的跑图装,13,2024-12-09 02:39,未提供
629679064,薛定谔的狐狸,5,怪可爱的嘞,,2025-03-12 02:10,Vivo V2131A
2870451,User2870451,5,🧗自由度：<br />玩法元素都蛮丰富，个人很满意了<br />🎣交互丰富度：<br />一般，可对话npc挺多，但全是每天按时上班下班一成不变的人机<br />🎮可玩性：<br />副本做的超棒，除了个人体感难度有些低外体验感都挺好，不过红温小游戏们又很好的弥补了这一点<br />但是或许因为我太肝，每个活动版本都会有2-3周的长草期<br />🌃画面音乐：<br />完美，一百分，简直就是艺术品，永爱,4,2025-03-12 01:13,Vivo IQOO Neo9S Pro+
102976302,☔,3,——3.3——<br />换装有跳过按钮了，剧情还是没有，这次的衣服我很喜欢。<br />——1.7——<br />如果你不会写剧情，麻烦加个跳过键按钮，人家隔壁比你晚出来一点，剧情那么优秀都有三倍速，你这么一坨也好意思完完整整端上来。<br />这个游戏叫什么？无线暖暖！<br />本来你1.0的剧情就已经是平平淡淡，毫无水花。1.1没啥剧情，出个新五星，发型和女NPC一样，能力和上一个五星一样。1.2剧情又开始搞节奏，咋的，黑红也是红吗？<br />暖暖系列，我玩了三个，唯一有印象的就是奇暖的剧情。这么多年一直没有进步就算了，你还给我倒退。<br />不会写就像闪暖一样给我多留白，玩家有丰富的想象力给你填补伟大的剧情。当然，服装请给我弄好看点，知道自己卖的是什么？<br />请尊重你玩家的智商，请尊重暖暖的付出，请管好你的NPC。<br />那几个男NPC的我都不想说了，一个男反派，长的跟最终幻想路人NPC拉过来一样。那个少年，你说是暖暖换男装我都信。还有这次这个，暖暖辛辛苦苦做了那么多，最后被他摘桃子，高光都是他的。<br />你们公司是个主打女性向吧？咋了，为了走一般向不要face了，关键是你能讨好谁？<br />——12.28——<br />就不能夸，1.1版本什么东西呀？背刺来的太快了。<br />减星<br />——12.26——<br />加一颗星给部分优化<br />交互动画跳过改了，不用强制看动画了<br />（但是改的还是没有考虑手机，你那个跳过动画那么大的几个字，点了竟然不能跳过，非要点到那么小的一个跳过按钮图案。与之相反的就是任务那边，明明可以所有的字都点击任务列表，对于跳过非要搞那一套，咋的？你真觉得自己动画做的挺好？）<br />小游戏难度降低，那个接捧花的改的非常好<br />（但是自行车还是一样的难骑）<br />能够拉近视角了，但效果一般。<br />（但拉的再近一些，直接进入相机了）<br />接着改吧<br />最后，抽卡体验非常不好，我已经拿完一整套了，但是为了染色，领完奖励，我还得接着抽那个卡池，根本就没有其他有价值的东西了。<br />——12.6——<br />再补充一下，自行车能不能改改？做个转轮很难吗？左右键，天呐，你该不会玩的是按键手机吧？玩了那么多游戏，从来没有玩过这么难骑的车。还有那几个的互动，来个长按直接换交互很难吗？<br />——12.5——<br />手游大世界一共三我全玩了，我都是手机玩的，同一个手机玩三个，都没有玩过内测。<br />先夸个优点，就是剧情中我和npc比帅气的服装，那个画面有我奇暖和闪暖的感觉了，很舒适，一星给这个，另外一星给暖暖。<br />接下来全骂：<br />🧗自由度：<br />不能爬墙，后面会有吗？反正目前我玩到的解锁功能是没有爬墙的，还没有游泳也是。有网上说是为了保护女儿，可你一个换装游戏完全可以变一个工装裤爬墙，潜水服游泳。<br />就算没有爬墙，你跳跃键能不能给我做好一点？就没有见过开场剧情的时候跳不过去，死很多遍，这好像是内测就人吐槽的问题吧，到正式服都没有解决。你跳跃的落脚点，能把人玩红温。<br />🎣交互丰富度：<br />采花采草那个交互键我就不说了，非得我点两下的感觉，感觉交互的那个位置不太对。<br />还有给动物刷毛毛，都要看你一堆动画是吧？每次都点跳过键，跳过键之后还有动画？咋的了？我们还得给你这游戏刷在线时长是吗？<br />战斗方面，你一个换装游戏披了大世界的皮，应该是个舒心的游戏，你战斗索敌，非要面对对方吗？这是800年前我玩剑网3才会遇到的事情，每次我打怪的时候，脑子里想起来的都是剑网3 的古老声音，请面对目标，请您面对目标，目标不在视线范围内。<br />最后，你们游戏公司是不是觉得女生的钱很好赚？这么敷衍的就给我端上来？我说的问题都是基本的问题，就不是什么玩法和建模。是你用户的体验，很多问题都应该在内测中解决。<br />到现在2024末了，几年前的大世界都比不过，我骂的时候都不好意思带着那个破游戏剧情建模一起骂。他现在还没凉，纯靠同行衬托呀？,126,2024-12-06 08:13,未提供
442053738,夜雨☆梦,4,怎么云玩能玩下载下来玩不了了？？？<br />玩着感觉还可以还不错，有些地方比较容易jio滑卡住算得上也算不上是吐槽🤔玩了大概快一个月多了吧，我主要想知道掉到一个地方回不去了怎么办🙂在线等！很急也不急～就特别高的一个山崖下面我拿那许愿星的时候在旁边那位置试一试玩呢，看看任务有没有别的啥提示啥的👀🤔然后就…然后就…手滑点错了技能，好像正漂浮的我的时候取消了没来得及再点，再点就掉半山腰了，然后然后最下面位置有点地能落，但是这一落就完蛋了！不会回去了（才发现能传送回到那上面🤓我真的会谢🤓我咋才知道😧🤕）,,2025-03-11 22:24,华为荣耀8X
472228272,西红柿罩的猫,3,🎮可玩性：<br />小游戏很红温<br />🌃画面音乐：<br />画风不错<br />🧗自由度：<br />只能跳，习惯了还好<br />🎣交互丰富度：<br />可以，但交互设计希望再优化<br />🔖运营服务：<br />很烂，社区更烂，喜欢装死，偷偷摸摸更新，引导玩家互相攻击，不在意的可以玩,,2025-03-11 22:23,Vivo Pad3
516806656,w,1,为什么我的暖暖打不开啊？一进去就退出了…这一星是对暖暖好看的评价，由于我进不去就没有玩，所以其他的不好评价,2,2025-03-11 21:31,华为GLK-AL00
611233612,雨年,1,因为我这个根本就没法玩，我的手机是荣耀畅玩20的,1,2025-03-11 19:09,荣耀畅玩 20
460433099,瑶瑶,5,超好玩！但是我太非了…,1,2025-03-11 16:17,iPhone 14 Pro Max
22446382,200斤的柒柒,5,我喜欢最近的本，音乐不错,1,2025-03-11 16:07,华为MIS-AL00
36729991,🍼,5,休闲可玩，没有操作压力,1,2025-03-11 14:39,未提供
547913246,嗨嗨害,1,不是哥们，你告诉我这能玩？😡,2,2025-03-11 13:48,Vivo X200 Pro卫星通信版
434466353,红红火火恍恍惚惚陌心,5,开服玩到现在，感觉玩法还是偏少了，换装方面做得很好，但大世界内容挺空的，彩蛋和互动都很少。这个游戏最大的彩蛋就是各种出片bug<br />主要时间都是去各个风景拍照出片，但是照片又没人看，什么时候能端社交联机或者照片社区上来,1,2024-06-08 17:53,未提供
418991477,时祺,5,🎣交互丰富度：<br />爽!就是手机端卡卡的,,2025-03-11 12:45,Vivo V2048A
17570104,卡哦米,5,首入坑暖暖，之前单纯换装刷关卡实在是没什么兴趣，大世界做的不错，剧情党满意，就是移动端控制太鬼畜了，希望改进，衣服质量挺好，知道为啥玩家群体这么广了，希望到了之后开了别的地图有新风格,,2025-03-11 12:41,CMDC SP300
467772486,小火慢炖,5,最近两个版本福利还挺多的。希望扩充玩法，加入扫雷五子棋做饭等小游戏。现在的纸鹤系列，俄罗斯套娃系列没意思还难。,,2025-03-11 12:37,华为 Mate40
611687925,爱,5,好玩，画质有点糊,,2025-03-11 10:51,华为畅享MAX
426910461,Z,2,今天在过一个花焰岛的一个有坏人上热气球的剧情老是卡退，也是没谁了，服了,,2025-03-10 20:16,HONOR 100
412229612,User412229612,5,网络社恐狂喜。大世界爱好者狂喜。<br />可肝可不肝，可氪可不氪（我觉得氪的话体验感更好，不氪也有好多漂亮衣服搭，这个游戏肝和氪都源于自己的欲望，逼是逼不了我的）。对于我来说非常适合养老（超级期待家园，绝对可以玩一辈子了）<br />各方面都没有太大毛病（希望移动端优化的更好，我是移动端的，平时没时间抱着个电脑玩）。社群氛围也很好，大部分玩家都是比较友善的，个别小坏蛋影响不了我的热情。<br />玩游戏嘛，最重要的就是开心啦，相信无限暖暖还会继续进步的（因为急着抬上来，其实还有好多没有完善的地方）～暖暖无限可能～在大世界里会有很多“不可思议”，终于把我小时候的想象变得更具象啦，暖暖宝贝也很开心吧😊,13,2025-03-11 08:20,Vivo X100 Ultra
688320176,时妤Adventure,5,第一次认真玩大世界探索游戏，总结起来就是一个字：爽！<br />暖暖系列玩了4年多，无限暖暖的可玩性属实是超出预期了，整体来说也比较好上手，对新手也比较友好<br />暖暖系列非常尊重女性，各种小细节都会让我感到很舒适，对于正常玩家非常友好，官方对暖暖的隐私保护也挺到位的<br />无论是热爱探索/摄影/搭配的朋友都非常适合。画面温馨，探索难度适中，以跳跃为主，地图也挺大的，偶尔会有一些挑战，按休闲的玩法可玩性很高。背景音乐特别好听！！！<br />摄影板块自由度还可以，功能强大，参数模块做的很好，自由度很高，缺点就是动作比较少，坐姿还给修复了挺无语的，官方说会抬竖屏和视频功能，但目前还没什么消息，大概会在一个月？<br />衣服真的非常精美！而且挺多都是可以免费获得的，对于普通玩家来讲不咋逼氪，PC端细节无敌了，跑图的时候经常忍不住停下来欣赏大裙子，有几套给我的感觉就是很惊艳，缺点就是裤子比较少，按照闪暖的衣柜来讲可以尝试的风格不是很多，但毕竟开服没多久，相信以后会有更美的衣服<br />说说缺点<br />版本间隔时间较大，每抬一个小版本给到的探索的内容不多，但对于我这种喜欢摄影没事瞎逛的人来说还是挺适合的<br />移动端PC端差距很大，但是目前也有在优化，不知道啥时候能优化好<br />无限暖暖毕竟才开服几个月，游戏的底子很不错，以后肯定是会往好的方向发展的，祝无限暖暖越做越好！,66,2025-03-11 06:58,Honor X50 
688288066,清月栀白,5,特别喜欢暖暖，好玩爱玩！,,2025-03-11 06:47,未提供
697746913,郁离,5,特别喜欢暖暖🥰,,2025-03-11 00:14,小米13
34555940,游戏界老八,4,12.5就玩了，马上70级，目前游戏体验还不错，轻轻松松几分钟解决日常，关卡也简单，抽卡欧非都一样要补160拿挂件。叠纸快点把家园端上来吧，天天太无聊了。每次更新活动一会就肝完了，最后晒两张随便拍的。,1,2025-03-11 00:02,未提供
707881422,yyy,5,超级漂亮,,2025-03-10 23:11,iPhone 15
399496412,纪,5,战斗模式都没有深空好玩，打人都打不到，技能单一。无语死了😓😓😓😓😓😓😓😓😓😠😠😠😠😠😠😠<br />更新之后，技能可以锁定了。对于我这种手残党来说好太多了。喜欢无限暖暖的风景，还有休闲模式。现在唯一比较困难的就是抓虫子了😭😭😭😭<br />换手机后不仅画面好看，而且花也变多了。感谢无限暖暖让我加速换手机的时间。嘿嘿嘿<br />暖暖真好看。,,2024-12-08 15:23,Vivo IQOO Neo9S Pro+
588106729,罗木,5,作为一个十几年的ip，暖暖系列真的很耐玩，充满正能量，休闲又美丽，女儿的笑脸能赶走所有的不开心,,2025-03-10 22:49,未提供
64319233,读你,3,🔖运营服务：<br />不推荐手机玩，手机玩会黑屏,3,2025-03-10 20:55,华为DMG-W00
454255376,卡白,5,🧗自由度：蛮高的，休闲逛大地图主要就是找风景拍照，捡材料做衣服<br />🌃画面音乐：非常喜欢超爱的，音乐跟地图适配度很高，最爱的是小石树田村那块，背景音乐一想起来就想起很多番了，特别想穿进去跟暖暖一块旅行啊啊啊啊。就是希望后面官方可以出一个分离音效跟背景音乐的，每次给动物洗完澡，出来的音效会打断背景音乐,4,2025-03-10 20:43,Vivo V2059A
365083856,小崎,4,2025年，哇哈哈我终于买了一个带的动的手机，不错。玩法很棒，福利也多。不太肝。<br />高楼层没有攀爬套装，跳跃很累，文字很小，看着眼疼。😐,7,2024-12-05 14:18,Vivo IQOO Neo10
24713145,手机用户24713145,1,暖暖的妈妈粉现在非常愤怒，已经变成后妈。。。。。悲惨银蕊之心任务，连续要求我去坐呜呜火车10天，10天！！！我是逃票还是怎么的？逮着我一个人坐火车！！！我这种怂货想想算了，没准只是我倒霉，找客服问问，想知道这个是bug还是正常，大战人机客服之后完全无法得到一个回答，反反复复说空话，绕开问题。虽然我只氪了小几千，也不是什么超r，也不用这么对我吧，好歹说让技术排查下忽悠我下呢？？？？？,1,2025-03-10 19:19,未提供
687246302,？,5,暖暖很萌值🖐🏻星，pc端画质太美了,,2025-03-10 19:14,未提供
367349243,Luna.,5,「亲爱的乌托邦」<br />我曾见过这小小世界中的许多冲突，它们大多来源于我们心中的冲突。<br />因为这冲突，我们不敢面对心之所向，也将心里的那个人隐藏。那么我的愿望是——<br />我希望这世界能够架起桥梁，消弭所有的冲突和隔阂，沐浴同一片太阳。<br />毛线汪汪跑啊跑，让伤口的疼痛追不上。<br />毛线汪汪跑啊跑，风灌进耳朵里也发烫。,1,2025-03-10 17:04,Huawei Nova 10
582096681,溶血性贫血,1,气死了，从来没玩过这么红温的游戏，策划你自己玩过吗，啊！姚润昊你是打算把游戏卖给谁😡😡😡😡😡,2,2025-03-10 16:58,未提供
538979451,嗷呜嗷呜,4,其实还挺好玩的，每个版本都会送个10抽，动物和怪也很可爱，衣服也漂亮，就是任务太少了，能拿钻的地方太少了，长草期会有点长,,2025-03-10 16:33,OPPO K7x中国版
434004749,User434004749,5,蛮喜欢这种的画风，还有超级超级喜欢里面的衣服好吧,,2025-03-10 14:56,Huawei Enjoy 20 Pro 5G
632099337,姜姜,5,这游戏除了会卡屏，其他的绝了，手游诶，人物精致，画面精致，还有故事，各种任务想接就接，地图超大，还可以解锁新地图，tmd，对比一下同类所谓开放游戏，这款真的必玩，只要配置够，都给我冲。目前没充一分钱，但是却玩的飞起。玩法多样，目前除了不盖房子，其他的都特别喜欢，自由度100%，收集爱好者的天堂。,3,2025-03-10 12:13,Vivo X80 Pro天玑9000版
2242995,不等号海大鱼,5,二编：虽然手机跑图的时候糊糊的，但是拍照界面拍出来还算清晰（p3），又打算继续氪礼包了。<br />本来还拍了一张开心暖暖，但是忘记去相册里下载到手机了，所以可以加一个拍完照就有保存到手机的选项嘛，点开相册才能存有些时候光顾着跑图就忘记了w<br />三编：迫切需要增加怪物指引！找孤僻布袋找了满世界都不够用。还有希望跳过能完全一点按了跳过还是会被硬控两秒，像洗澡这个只需要第一次洗这个物种时看过就行了后面再遇到可以点击完全跳过。<br />四遍：某些喷的点太让人无语遂改五星，明明可以提建议让改，一味辱骂只会让社区环境变得更糟糕。<br />————————————————<br />玩了一天游戏时长是一点儿妹给我记啊。目前进度:主线做到今天上限，10级，蓝龙2，心原day1已完成。<br />操作上个人觉得没什么难度，跳跃长按蓄力这些还挺丝滑的，打怪有点卡手，因为一般都在单击，但是这里感觉长按要好打怪一点。<br />对于我来说觉得最大的问题是移动端的优化，当然也是我设备跟不上的问题，开的推荐，都是中，本来是主打换装+大世界，但是基本看不太清衣服细节，抽衣服界面看着美美的，实机穿上后很糊，导致抽到衣服也没有那么开心。月卡小充一下，礼包完全不打算买了，对于懒人来说能开移动端肯定不会去开电脑的，玩了一天感觉一直在绿绿的马赛克间奔跑跳跃，还挺难受的。还有在山地界面总会有一些卡脚，在城镇里还好。<br />交互上换装钓鱼抓昆虫清洁各种功能还挺丰富的，但是希望右上每个图标指示性与代表性更明显一点，玩着玩着就忘记右上谁是抽卡谁是奇想星了。<br />然后一想到移动端优化还有很长一段路有点想等优化完或者换设备后再来玩。,3,2024-12-05 22:37,小米 12
35428598,莉莉Lillyanne,5,🧗自由度：非常好<br />🎣交互丰富度：游戏元素玩法很丰富，画风也很喜欢！<br />从暖暖自第一代一直玩到现在第五代！非常喜欢暖暖Ip ！个人觉得比以闪好玩！以闪语音少，画风也不喜欢！,,2025-03-10 11:01,Vivo S18
356510396,User356510396,3,作为一个原神公测开服老开放大世界玩家，不得不说无限暖暖刚开始特别合我的胃口，收集挑战+短剧情(本人非剧情党，对于原神又臭又长的剧情一直很无奈）让我一度沉迷。但是无限暖暖的后继无力的缺点也是异常明显。开服地图内容没多少，一旦你肝完了就会进入看不见头的空档期，新版本内容做完了每天上线花个5分钟刷完日常就能下线，继续在线也做不了什么。体力严重不足导致零氪玩家后期时装制作周期特别长，从噗灵到熟练度到材料，无一不需要体力。总结一句，无限暖暖适合只有碎片时间的玩家玩，如果你有每天有很多休闲时间游戏，建议再找点别的游戏一起玩。,6,2025-03-10 10:57,小米24117RK2CC
404132565,水星冲浪手,5,好玩！期待开新地图😋,,2025-03-10 10:56,Redmi Note 12 Turbo
