用户ID,用户名,评分,评论内容,点赞数,发布时间,设备型号
679901418,我还活着,5,细节满满，拍照也很好（前提是你PC端或画质调高）操作可难可简（洗动物钓鱼捉虫演奏飞翔，平台跳跃和物理解谜，有各种各样的小游戏）1.4版本剧情挺好就是短。福利一般，不过抽个四星阁可还行，抽五星阁的要么囤三个版本要么肝要么氪（感觉四星和五星的质量差不多，算然五星有能力，但四星也有小彩蛋)<br />我不同意“真心予你商城”只有三期 ಠ╭╮ಠ<br />家园联机快上线！,2,2025-01-24 19:37,小米Xiaomi Pad 6
646364941,HHKKY,4,首先那个优化就是个很大的问题，玩儿法的话，行，开始其实还行的，但等主线推完了就很无聊，每天上线就做个日常领个月卡，几分钟的事情，希望能加一点常驻玩法吧，要不然平时确实不怎么玩，而且零氪的话，一般情况下根本肝不出来一套主题衣服,,2025-03-28 10:25,Vivo IQOO 13
46171946,雪梨梨,5,被这次妄想季的活动剧情感动到了！！截了好几张图不知道怎么就剩一张了，总之很为这次心愿精灵追逐自己梦想的剧情感动！！好评！,,2025-03-28 10:00,未提供
595014518,狐妖,5,这游戏不能调帧数吗？,,2025-03-28 09:28,未提供
694874808,肆儿,4,开局评分3⭐（7年老暖粉，评分仅个人观点）<br />241211｜可玩性极低；巅峰赛逼氪；长草期过长；衣服出的差强人意；探索内容较少；剧情非常短；支线不多；地图还小；遇水即溶；还卡体力；移动端bug特别多，拍照也不友好；优化稀烂；双端画面差距巨大；大世界不匹配换装玩法。之前期待太高了，结果暖5上线还是半成品。总的来说，暖粉还是会一直玩（我会一直玩的），如果不是IP粉不建议入坑，你们去玩点好的吧，闪暖比无暖强。<br />250203｜更新评分3⭐→2⭐，新年剧情哥k暖暖的人头，剧情稀烂，乖女儿毫无参与感。烟花套进化更换词条，1套变2套，不抽烟花套的根本不知道，抽230气球套的人家情何以堪？巅峰赛愈加逼氪，卡词条，官方装死。<br />250228｜更新评分2⭐→3⭐，目前巅峰赛动画可以跳过了，3分钟打完8场，长草期每天上线5分钟，一键清体力，2分钟过每日+通行证。巅峰赛评分这次没有堆砌数值，也没有卡词条，目前来看官方还是在改的。起码在长草期，暖5是不强制卡上线时长了，安静长草护肝不氪，这点运营很听劝。2⭐→3⭐给运营。<br />250326｜1.3版本池子抽了180，四星也拿了，工作太忙，没更新评价，1.3我还是挺喜欢的，净化大招好评，摩托车好评。<br />1.4版本更新评分3⭐→4⭐，巅峰赛跳过功能给删除了差评，新池太戳我了，好评，玩偶很好看，技能只能跳不能走路差评，但是好看，忍了。清洁套终于不进动画了好评。美鸭梨改版改了个寂寞，UI更丑了差评。<br />官方开始搞抽象，长腿大喵笑麻了，好评，什么时候出个长腿大喵的衣服就更好玩了。两组头套很抽象，也行吧，我家暖暖也是颠颠的。<br />｜持续待更新中，5⭐好评或1⭐弃坑停更……,4,2025-01-11 16:37,未提供
25982399,叶影,5,无所谓，我会溺爱暖暖。,,2025-03-27 23:29,iPhone 13
707198123,海浔花鉴💫,2,更新完变卡了卡的不要不要的完全玩不了了,2,2025-03-27 22:49,Vivo X200
4636938,Schatten.,4,手机端玩家，懒癌患者。<br />衣服还是有喜欢的，还可以。<br />还是希望叠纸把功夫花在更新主线剧情，充实原有的地图上，目前比较空洞。个人感觉1.4版本更新和1.2版本异曲同工，1.3版本的剧情较为一般。<br />更新周期可以长，不要糊弄文学即可。,1,2025-03-27 22:32,Vivo IQOO 13
364441033,User364441033,1,这次就更新了几个台子？拍照那几个动作都腻了，无聊，太无聊了，这点更新让我一个月都无聊吗？染色和家园也不端，就知道画饼，优化也是越来越差,4,2025-03-27 21:34,未提供
687502678,彼岸^0^,1,还没进去呢，就闪退了，还不止一次，一直闪退,,2025-03-27 20:02,未提供
29035093,莞凌,5,暖暖宝宝最可爱了！,,2025-03-27 19:42,未提供
649482222,陈一,5,全世界最好的暖暖🥰🥰🥰🥰🥰🥰,,2025-03-27 17:28,华为BKY-W10
335697,POLAR,4,2025/3/27 妄想季更新<br />活动非常欢乐 长条大喵和节日氛围很好 难得一乐<br />再说问题<br />优化：还是优化问题 pc没啥问题 除了还是没有热切换 体验上没问题 手机端玩的真难受啊<br />1 ui更新之后 红点长亮 第二天已加补丁修复<br />2 发热 新版本后手机端发热很严重<br />3 搭配比拼的跳过键取消了一半 只有第二次重复搭配才有跳过键 深渊也是<br />4 图鉴更新后花烟群岛3个气球怪不显示 必须重新打一遍以上 进入漫长长草期<br />————————————————————————<br />2025/3/6 1.3 传说季更新<br />先说优点<br />遗迹的剧情演出有两点改进：<br />1 玩家终于有点事做了 加了简易的追逐战<br />2 三件物品的开门 不是黑屏 加了一点交互 尽管动作明显是复用的<br />3 活动跳跳乐 地块开始叠加了 混合了战斗玩法 比上次活动的星空背景纯跳跃有意思 不是那么无聊了 而且不限时不强迫挺好<br />4 新副本场景不错 好看 全新设计的开门机制 难度也不高引导也不错<br />遗留问题，从1.0开始就没改进的：<br />1 剧情还是老样子 8分的故事演出加对话 观感能降成4分<br />2 进入副本方法怎么又是加载 你的大世界优势呢？除了青蛙副本 其他都是房子 行 新开的是地洞 跳下去怎么不能无缝加载 而且其他副本可以直接拉传送门 完全可以改进黑屏<br />3 优化<br />手机端 拍照加了柔光特效 跑图还是cs画质 一个字糊<br />加自定义键位 任务栏很容易误触<br />pc端 热切换和自定义键位已经说累了<br />4 洞察圣堂 短信对话每次一模一样 接任务耗时建议调整任务点位<br />总结：这次活动剧情是目前为止最可惜的一回 良好的底子 结果效果很差 我建议对话加跳过键 这样双方都不用受折磨<br />-——————————————————————<br />2025/2/19 主线8章＋花焰群岛<br />如果有pc 推荐试试<br />在此前提下还喜欢换装类 或拍照 不管是角色还是风景党 都建议尝试 喜欢大世界的也可以试试看<br />如果只有手机 不建议玩 不用试 画质奇差 iphone的几个机型 可能有针对优化 但在叠纸完全优化好移动端前 仍不建议手机玩家尝试<br />如果对手机处理器很有信心 为了您的身心健康 不要用手机玩小游戏orz 涉及到限时的跑图游戏都很极限<br />下图有手机端的照片和跑图画面效果 图1正常跑图视角和bug 图2活动bug 图3全高画质拍照<br />🎮可玩性：<br />先说优点（注：没提手机端默认为在pc的体验）：<br />1 副本（青蛙 纸鹤 酒窖 列车）场景和引导都做的不错 尤其是第一次游玩 有点任天堂做跳跳乐的感觉了<br />2 风景打卡点很漂亮 特别是教堂 断头女神像 皇宫遗迹 打卡的位置做的很有感觉 可以体验光线移动后的夕阳美景 还有炫光彩虹<br />3 能力套装做的有点意思 延展性好 后边可以出很多能力<br />4 boss 尽管boss和材料本仍然是换皮 但是引导做的很不错 一看就知道怎么玩<br />现阶段问题（也有仍然存在的老问题）：<br />1 优化<br />1）手柄连pc就一个词 凑合 很明显没有做好适配 键位无法改 从其他游戏过来就很难受<br />没有热切换 选衣服 搭配 在制作衣服的界面 闪光精灵 很明显鼠标一点就很轻松 但手柄就得先把框移动到想选的衣服上 然后按住rt 有时候是r3 才能查看详情<br />2）手机端很明显了 一就是贴图<br />尽管现在种了花 加了栅栏 画质仍然很差 可视距离做了专门的设置 结晶加深了颜色 在手机端仍然体验很差 在花焰群岛（新地图）的热气球上 是完全看不到空中的结晶<br />二就是随处可见的bug 仅供手机玩家使用 图1的bug贴图从1.23开始 这个bug就没修过 一眼看穿地底<br />图2堪称bug连发 新的小活动里进入热气球跳跃的关卡bug修复是敷衍的治标不治本<br />首先，从图1可以看到虚拟摇杆离任务栏位置很近 所以很容易误触 如果进入关卡前点到任务栏 进入关卡就会卡死 这时候怎么退出呢 所有按键都无法点击 只能清内存 再登 然后就会陷入在空中刷新掉落死掉的场景<br />这块叠纸的解决方案就很凑活 诶嘿 进入关卡前黑屏就可以了 这样加载完全后就不会出bug了 哈！可是现在bug还能重现 因为黑屏不是在加载 这时点击屏幕中有图标在的位置不仅有点击音效 还能出现对应页面 属于修复了个寂寞<br />3）数值问题<br />深渊逐渐向细分词条偏斜<br />而近期的烟花套装的词条在进化后有变化 是个很不好的预兆<br />能力点数如清洁 采集等 无限之心现在已经可以开启2万3的锚点 银月莺要求1万8 后续的点数要求可能相当高<br />4）剧情 概括为想写成人童话 写成了6＋小故事<br />整个剧情只有左手的支线写的不错 其他都只是能看甚至对话太多的水平<br />5）演出效果仍然停留在5年前<br />站桩对话加播片模式 播片是用的实机演算 但是演出就是拉远景 有两个人在对话 好镜头拉进 暖暖穿的漂亮衣服看一下 表情看一下 好 看对面的人拉一圈 暖暖说话看暖暖 有人说话看他 大喵说话镜头看大喵 一轮说话完就结束<br />既然如此 没必要写那么多对话 来个跳过键吧(눈‸눈)<br />就算是播片也没有什么吸引人的内容 毫无参与感 玩家什么都做不了 那剧情可以直接做成超长电影 至少整个播片不会截成一段段的 做完任务才能看一小节<br />最后做总结：<br />pc党 可以一试 如果感兴趣<br />手机端仍不建议 如果想玩手机端 看看图1 图3 能接受的话可以一试,25,2025-02-19 16:16,Redmi Note 12T Pro
709352157,西红柿,5,移动端的画质虽然一直比不上pc端，但随着每一次更新，移动端的画质都会有肉眼可见的提升。这说明叠纸也是在认真的优化，看得到玩家的诉求！<br />玩过暖暖的其他系列，奇迹暖暖和闪耀暖暖，这两个暖暖一个是2d，一个是3d平面，都很不错，衣服设计的都很好看，这里重点夸一下奇迹暖暖的蝴蝶月卡套和烟花套（感觉像无暖的烟花2d版），美的很啊！这次无限暖暖的妄想季。主五星的一进真的非常戳我！可惜我的钻刚抽完八音盒，准备肝一个季节，然后等1.5的爆料再决定下不下池子😸，其实无限暖暖最值得留住我的。是她的画面很童话，色彩很舒服，不会让我视觉疲劳。玩暖暖就像遇到了小时候的我，总是对事物充满了好奇心，总是乐观积极向上的看待世界，许多人都说暖暖幼稚，可她身上的这种善良乐观勇敢的、积极向上的品质，正是我所积极向往的，温暖的剧情，有的时候真的看得我心软软😿<br />我是iqoo z9 turbo 我是极致拉满的，拍照的储存分辨率也是2k，自我感觉虽然比不上pc端，但是也还是比以往清晰了（图是传说季的时候拍的）,68,2025-03-27 14:25,Vivo IQOO Z9 Turbo
9511610,是真的6,3,入坑还没有一个月，就觉得很无聊了，更新也基本上是拍照跑地图，毫无新意，刚开始挺好玩的，后来感觉没有创新玩法的话会退坑,,2025-03-27 13:30,红米 K70
55711104,winter,5,成于虚幻5，败也虚幻5，目前已知的手机端最吃配置优化最差的网游，手机处理器过几年还没有大的突破移动端流水是别想涨了。,,2025-03-27 12:18,未提供
4749963,世界は,4,pc端体验玩家来了，首先我设备不是特别好所以玩的时候画质也很一般。pc端倒是很流畅，转视角有点过于丝滑了让人有点晕，而且能不能自由缩放然后固定视角，要不然真的很晕。<br />我的优化建议：<br />①我建议直接暂时放弃战斗，开自动。因为本来就是轻度玩家偏多，大家其实只想换换衣服拍拍照，大世界里逛一逛，你的战斗对轻度玩家太难，对喜欢战斗型的玩家太简单，不如直接放弃开自动可选择留住轻度玩家，留到后期优化。<br />②当务之急是优化衣服和清晰度，我身边抽到好看衣服的人很少，没有漂亮衣服留不住人，清晰度也很糊，换装界面自由缩放也不如闪暖自由，闪暖开服起码还有幻阁几套抽一抽而且裙子也是好看的，现在衣柜里真没什么好看裙子。移动端和pc端不是一个体验，砍得太多了，甚至我pc端没办法玩高配糊糊的看到别人极致的图也会感叹真的是一个游戏吗…对于低配玩家游玩体验太差了。<br />③物价实在是太高了，与物价不匹配的是你游的体验感，300一套四星只能拍拍照，前作甚至还能看到衣服数值之类的，抽完了还能打打竞技过过主线，还是那个问题，前作只要有衣服就不会卡你，无限暖衣服和主要玩法实在不挂钩还很贵，作为拍照党我下不去手氪金，作为游戏党我没办法为了一个只能看的衣服氪金，技能也没什么花样，净化就是净化，飘浮（飞）就只是飘浮，只要有基础套装就能玩，拿高配的体验也没什么差别，让人没有氪金买衣服的欲望。<br />④抬家园，我觉得染色都无所谓主要是家园，你游现在基本上单机，NPC也没那么有趣，大世界有点空，但是有家园就可以弥补这部分，好友一起建造一起种花什么的，然后卖卖花挣挣噗灵，这样其实会好很多，也会让玩家拉好友一起玩，比现在上帝视角一个人看暖暖玩好很多。<br />其实大家只想要一个走出小屋的闪暖而已，希望你知道自己面对的是什么样的玩家群体，优化不好就选择性的先把重点优化了，还是希望暖五越做越好<br />补充：我现在觉得固定视角，自动索敌，就是死了之后回到上一个点很重要啊啊啊啊<br />补充：我又回来玩了，确实比较好玩啊，战斗上手了也很简单，最近68一套四星我觉得是可以接受的，衣服也有变好看，希望做大做强吧（拍照有进步吧！）,4,2024-12-06 11:48,未提供
457064188,华子,3,卡死了，一直在闪退，我刚刚充了月卡，就这么对我，有没有哪个好心人告诉我该怎么办？,,2025-03-27 11:13,Huawei MatePad Pro 10.8
432479926,此人已被NIJISANJI绑架,5,一起来和暖宝玩呀,,2025-03-27 10:56,iPhone 14 Pro
654479834,Yopbsn.,5,🧗自由度：<br />很好玩<br />🎣交互丰富度：<br />一般<br />🎮可玩性：<br />丰富<br />✍🏻建议：<br />如果可以和朋友一起玩有互动就更好了，自己有点孤独的感觉,,2025-03-27 10:45,小米Xiaomi 14
26477461,马猴烧酒大蛇丸,3,开服萌新，之前都没怎么玩过换装类游戏（主要是在怪物猎人，永劫天刀逆水寒之类的游戏里面玩换装）<br />平时玩的大多是单机，主流的大型网游mmo或者一些手游也都玩过，所以要求可能会比较高。接下来讲下我的无限暖暖游戏体验（主要是pc端）<br />因为是换装游戏所以用以闪亮之名对比下（这两游戏我都是萌新，以闪亮之名还是玩了无限暖暖才发现）<br />首先是服装的贴图分辨率也就是清晰度：<br />暖暖⭐️⭐️⭐️⭐️<br />以闪⭐️⭐️⭐️⭐️⭐️<br />虽然暖暖的清晰度已经非常高了，但以闪的清晰度确实更上一层<br />服装材质渲染效果：<br />暖暖⭐️⭐️⭐️⭐️<br />以闪⭐️⭐️⭐️<br />依托于虚幻五引擎的强大功能，暖暖的材质渲染拥有更好的表现，水晶和宝石更透，金属质感更好<br />服装物理及细节处理<br />暖暖⭐️⭐️⭐️⭐️<br />以闪⭐️⭐️⭐️<br />虽然暖暖和以闪都有纸片贴图的首饰和服装装饰，但暖暖明显更少。多亏了以闪的极繁主义，以闪每套六星（对应暖暖五星套）都有大量的首饰配饰，这也导致了以闪几乎每套衣服都有纸片贴图首饰配饰的问题<br />换装搭配及配套玩法等：<br />暖暖⭐️⭐️⭐️<br />以闪⭐️⭐️⭐️⭐️<br />在服装搭配上暖暖和以闪都没什么好说了，全看个人搭配，但暖暖目前不能染色只有换色套装，一个换装游戏不能染色真的有点（我怪物猎人还能染色啊，大佬！）<br />福利及运营：<br />暖暖⭐️⭐️⭐️⭐️<br />以闪⭐️⭐️⭐️<br />福利这点没得说，暖暖即使零氪靠活动和日常送的钻也能抽不少五星（不抽四星的前提下）至于以闪，每次活动送的钻屈指可数，个位数的染色卡，难怪以闪的老玩家都叫以闪“扣子”<br />场景建模及场景渲染光影等：<br />暖暖⭐️⭐️⭐️⭐️<br />以闪⭐️⭐️<br />多亏了虚幻五让轻松实现高品质画面表现成为了可能。在非拍照模型下暖暖的光影可以说是毫不起眼，但在拍照模式设置光影效果后暖暖终于发挥出了虚幻五该有的效果。<br />至于以闪，光影和背景绑定，所以光影效果的表现也参差不齐，有完美打光也有死亡光影。虽然以闪的拍照场景更丰富但需要付费。至于以闪的那个家园的光影和渲染效果，虽然不至于说惨不忍睹也只能是差强人意（所以虽然我玩以闪，但我对以闪画的大世界的饼并不看好）<br />服装设计：<br />暖暖⭐️⭐️⭐️⭐️<br />以闪⭐️⭐️⭐️⭐️<br />这点就完全看个人喜好了，我个人感觉两款游戏的服装设计都挺不错的，所以就都给四星了。只是相对来说暖暖目前并没有让我眼前一亮的服装（玩的游戏太多了哈哈，暖暖最喜欢的还是免费的【银夜莺】和【金蔷薇】）<br />但以闪的【发条之心】和【瓷心傀儡】确实越看越惊艳，新六星【烬蔷祈焰】的维多利亚哥特风吸血鬼女王完全是我的好球区！期待暖暖也出点这种！<br />综合来看，无限暖暖的基础质量毋庸置疑是比以闪亮之名好的。<br />玩法方面暖暖主打开放世界加换装，以闪算是换装加房屋建造。<br />具体玩法方面，无限暖暖主要是换装和平台跳跃夹杂这一些小解密，但是说实话无限暖暖的平台跳跃玩法是比较无聊的，如果你期待马里奥或者星之卡比那样的游戏体验只能说想多了。明明做成动森那种模拟经营玩法会更好，属实想不通为什么要做个平庸的平台跳跃玩法。<br />至于解密，简单又无聊，也可能是我要求太高了，本身就对解密类游戏不感兴趣，战神里面的解密都让我烦，这种简单又无聊的解密越多越让我烦，纯浪费时间。还是塞尔达的解密做的有意思。<br />至于以闪的家园建造玩法，玩法本身没什么太大的问题，但是！前面就说过以闪的家园渲染和光影真是让人一言难尽。那个十年前的手游操作模式也让人抓狂！角色的跑走跳等动作一个比一个僵硬，整个家园系统都显的非常劣质，基于这种质量实在是不敢让人对接着来的大世界抱有期待。<br />剧情，暖暖的剧情没什么好说的纯纯的负分项，幼儿园式的文本和对话让我这种剧情党只能疯狂的按跳过，剧情CG更是看的人头皮发麻尬的抠出一栋楼。我不明白童话故事里面的角色也不会是这种幼儿园对话啊？文案去看看冰雪奇缘和疯狂动物城吧！<br />至于以闪的剧情，也尬，但还没尬到暖暖社死的那种程度，能跳过就好。至于几个男主卡牌，典型画的精细但人体画错，尤其脖子和肩膀等结构更是重灾区。<br />大概就是这些了，无限暖暖的底子还是不错的，加个动森那样的模拟经营和家园玩法估计会有意思很多，希望尽快修复目前存在的一些问题，祝无限暖暖越做越好！,58,2025-03-08 13:39,未提供
422069526,陈亚东,5,首先能让我坚持玩下去的前提是不骗氪，每月的打折抽、1.2版本的三倍128、6元的伞等等，都让我有不错的微氪体验。每个版本的福利不少，游戏也不肝，搭搭衣服拍拍照也不会有强度焦虑。运营优化方面也一直在听玩家意见改进，值得一玩。,,2025-03-27 09:59,未提供
570038014,Napat,5,开服之后一直在玩，对于我来说这款游戏还不错，可能手机端拍照会糊一点，移动端好很多，对于氪金不强制，衣服很多，蛮好看，细节也不错,,2025-03-27 09:41,小米13 Pro
349228654,世木,1,多的话不说了,,2025-03-27 09:16,小米Xiaomi 14 Pro
536003529,三七,1,昨天更新完之后一直这样，今天上线了还是没有修复，人工客服也只是一味让你提交反馈，想要移动端一起做就做好，别又想赚，又拿出这么垃圾的东西,2,2025-03-27 08:07,Vivo X200 Pro Mini
665692483,漫漫,3,😭为啥华为这玩能不了，我超级想玩呜呜🥺,,2025-03-27 04:32,华为荣耀20S
336885229,你是哪块小饼干？？？,5,挺好的，加油，剧情略显低龄，不够饱满,,2024-12-08 04:22,小米24122RKC7C
34019151,塞西莉亚,4,前排吐槽:手游和端游真的是同一款IP游戏吗<br />🎮可玩性：<br />大世界探索还不错，不喜欢刷副本或者练角色强度的话可以试试，基本单纯看搭配数值，一些低星衣服也能搭出高分<br />🧗自由度：<br />还不错，就是比较吃关键道具（奇想星）收集程度，基本要求就是收集一大半，不过靠近就有透视还蛮不错的<br />🌃画面音乐：<br />抛开手游画质谈不了，抛开端游画质不用谈<br />🎣交互丰富度：<br />个人端游80小时玩下来体感其实还行，大世界的很多地方都可以交互，就是比较吃剧情解锁<br />作为暖爸，对于开放世界换装游戏还是蛮新颖的，能把换装和开放世界结合成这样……嗯……已经算还不错了<br />服装上的话，还是会有一些一直存在的套装能看到的，在这里就不细讲喽，玩端游的话倒是可以清清楚楚的看到服饰的纹理，不太推荐手游游玩，端游的画质和操作都会比手游好很多<br />不过端游玩了80小时左右，该做的剧情基本都做完了，倒后面其实就是看你对女儿的喜爱咯，把地图解锁过后基本没有什么新的玩法了，就等哪个版本会出你喜欢的衣服咯,1,2025-03-27 01:52,未提供
510745508,铃繁,3,别的不清楚，玩儿的有一段时间了，删了下下了删，我给他的评价是游戏自由度不太高。给我一种上线去玩就是在肝。里边儿有小游戏没，尤其是这几个版本的活动我开服的，但是我是属于那种这个游戏它就是给我提供情绪价值的，提供不了，那就换个游戏。然后别的我不说，我就说一次这两次版本，因为第一次版本的活动我就没怎么参与。就拿这两次活动来讲，就是那个上一次秘境闯关，还有这一次刚才我在玩儿的那个小游戏，怎么着？世界难度你高点儿就高点儿，无所谓，我心情好了，拿个攻略再来找。你一个版本的小游戏你弄那么难干什么？要上天呀，我是那种纯摆的玩家，那上次那一关我过不去也就过不去了，这次你又给我整这个。告诫大家一句，像我这种手残又纯摆不推荐，然后如果你真想去玩大世界的，随便找一个。那种其他类型的他们也能换装。,,2025-03-27 00:46,未提供
6599458,彼岸葬送喵,5,看得出游戏很诚心在改了，送了这么多免费漂亮衣服，灰色未开锚点也加了，搭配赛也没有不抽当期过不了。这个抽象钻石头真是丑的牛逼，不能不买。希望家园赶紧端上来，暖暖连个床都没有好可怜的。,6,2024-12-05 21:41,Vivo IQOO 10
20629942,ikol,4,希望美呀梨里面进化的红点能点掉！常驻池想等其他套装抽齐再进化啊！,1,2024-12-30 23:30,小米13 Pro
25527842,星野与荧,4,虽然还不错，但版本更新后的加载是真挺恶心人的，慢的一批，不知道是我这样，还是都这样，这加载能不能优化下啊,,2025-03-26 23:42,一加手机PHP110
707852652,柒妤,5,可以带女儿去各种地方拍照,,2025-03-26 23:32,Vivo V2072A
707468713,小喵咪,5,很好玩，就是人太少了。希望能开一个大厅，专门让玩家交朋友🙂🙂,,2025-03-26 22:06,华为FIN-AL60
338298345,肚肚,2,为什么每次一更新就打不开，上次打不开浪费好几天月卡，卸掉重下才好，更新一次又打不开了，难道每次都要重下吗😑,1,2025-03-26 20:58,小米24018RPACC
