用户ID,用户名,评分,评论内容,点赞数,发布时间,设备型号
118320915,废土客,5,什么时候出不同衣着的大喵周边😏😁😁,,2025-04-05 19:08,未提供
704664235,琅泠,2,许愿星关卡设置太难了，游戏是用来玩开心的，不是越玩越气的,,2025-04-05 18:17,Honor 70
44756731,衣拾寺,1,你优化的什么鬼东西，1.4之前我玩的好好的，更新之后就开始频繁卡闪退，真是气笑了。,,2025-04-05 18:12,红米 K70
369840983,002,4,暖暖的衣服还是非常美丽的，就是长草期太长了，直白的说我想要的是我可以不干事但我不能没事干，这个就属于我没事干了，每天做任务就没别的了，赶紧端联机吧,,2025-04-05 16:23,OPPO Find X7
602741890,呆呆,1,为什么会闪退啊？,,2025-04-05 15:23,华为Nova 4e
658759805,花影,1,为啥我进不去啊？,1,2025-04-05 15:18,Huawei Enjoy 20 Pro 5G
15678590,Nikki丶暖暖,5,画质顶级，植物超级多，植被密集度放眼全球也是顶尖的存在。还有就是暖暖超级好看超级可爱超级美！！！,,2025-04-05 13:01,三星Galaxy S21 Ultra 5G
649043066,隔岸葙,2,就想问这游戏下载要多大的内存，为什么我刚下到界面就黑屏退出，后面我把内存清到一半多还是这样，而且我手机也没坏ʕ⊝⍛⊝ʔ**原本下这个游戏就是想看看它的画质如何，结果云玩打破了我的心。那云玩一会儿卡的，而且那个画质模糊的像一坨大。鬼知道我充的vip会员有啥用，刚才又试了一遍还是这样，那画质我能玩到吐。(´இ皿இ｀)你说它占内存，难不成他的内存比某二字游戏大？下了某二字游戏我手机也没事，轮到他见有事了？并且我还把某二字游戏删了。我真是给你脸(✘_✘),1,2025-04-05 10:41,华为FGD-AL00
709344390,冕少,5,无限暖暖很好玩，还可以自己穿喜欢的衣服，还可以去做任务，解锁好看的衣服，无限暖暖有长的好看也很好玩。,,2025-04-05 07:12,荣耀 X30i
3346954,多古拉星喵子の忧郁,4,2025.4.5<br />我是小丑🤡<br />零零散散的氪，一边玩一边骂。<br />但是叠，新地图呢？新宝箱呢？新图纸呢？大世界做个开头就不做了？玩家找地儿凹照片是玩家的事儿，你的摄影棚该搭还得搭起来啊！到现在全是田园小清新场景配田园风的衣服，帅气一点都市一点的衣服要咱怎么拍？嗯？Looking my eyes👀，回答我，怎么拍？光靠卡黑背景吗？<br />……………………<br />2024.12.30<br />算了，散了散了，只能说谁氪金谁🤡<br />新版本又是坨大的<br />………………<br />2024.12.23<br />工作日移动端打日常打破防过来吐槽<br />（顺便晒一下最近的图）<br />打个石头人疯狂卡退，叠你到底更新了啥，本来能正常玩的现在连正常游玩都做不到了？？本来就不想打这破本现在还闪退，素材本模型简化又没人在乎你到是保证一下流畅性啊，手感稀烂没有自动瞄准已经很折磨了打到最后一下还卡退，是非得人骂才觉得爽吗？<br />大世界卡退衣柜卡退素材本也卡退，这更新说是提高了移动端画质但玩不了不是白更新，诶呦真是脑袋疼。<br />pc的拉进镜头也是如有，把那个见鬼的自动进入拍照删了！烦死了我想拍照我自己会开相机(งᵒ̌皿ᵒ̌)ง⁼³₌₃<br />拍照界面的动作调整能不能学一下狒狒食柿的重复上一个动作以及原地行走冲刺balabala，我想拍跑步或者冲刺的感觉但是完全按不出来，只能硬凹踢腿动作，想拍捕虫动作之类的也没法好好拍只能截图，既然做了动作模组就让我用啊！！！！不然我抽能力套干嘛！！！<br />………………<br />做完了金蔷薇，也正好到周末有空用回pc，过来更新一下评论（顺便晒图）<br />终于开始认真拍照的我，有被相机不能拍竖屏这一点无语到。怪不得都在吐槽脖子扭着玩游戏，是真的扭着玩。<br />以及拍照的时候如果能移动暖暖的位置而不是只能旋转方向就更好了，有时候就差那么一点点距离，如果退出拍照调整位置就要重新调整角度光照滤镜，实在恼火。<br />………………<br />首先叠甲:<br />玩《原神》，开服玩家玩到现在以下略。玩《以闪亮之名》，开服玩家玩到现在以下略。要针对这两个游戏的不用查成分了我直接写在前面了🙌<br />但同时我也玩《塞尔达》，两部的卡带都买了也都打了。玩《爱丽丝疯狂回归》， 买了，打了。暖暖从换装物语到无限都玩了，不可以说我不配吐槽哦🤭<br />那么就以上述四个游戏为参考进行吐槽！<br />正片开始:<br />猛肝一个星期，当前进度是金蔷薇只差一件，看不懂的说明你游戏进度打得没我多，回去玩儿自己的吧！<br />☆画面（pc端4060）很好看，操作（键鼠）也比较丝滑，大地图跑起来非常愉快，某种意义上来说弥补了在一些游戏里不能美美拍照的遗憾，作为摄影棚是非常合格的，可以美美出片！<br />战斗（键鼠）难度很低，对于平时会打游戏的人来说可以说是宝宝难度，新手玩家适应起来应该也不会有太大问题……吧？<br />解谜难度不高，8+<br />衣服（pc端）质感相当不错，没事就喜欢扒拉扒拉衣柜，虽然最后总觉得自己在大地图上穿得像是要去抓宝可梦，事实上也确实是去抓虫抓（洗）动物。<br />剧情没看，不做评价。<br />★pc跟移动端的画质有多割裂在这里就不多赘述，不管是引擎问题还是优化问题都不是玩家应该考虑的，消费者不应该为厂家问题买单。在移动端优化完成之前游戏营收不会好看，这是叠应得的。<br />平时不想开电脑拿手机做做日常，问题一下子就爆发了，抛开画面模糊、服装颜色显示错误、地图灰暗分不清物品之类的问题不谈，跑图的时候会有卡顿、误触、不能边跑边捡东西等等等等各种令人火大的情况，并且可能在任何时候表演一个闪退重启，包括衣柜。<br />战斗（移动端）就是一坨，毫无准星的攻击配上稀烂的操作手感，本来很简单的战斗变得异常困难，手感奇差。包括跳跳乐部分，完全找不到落脚点，顺便一提心愿仓库关卡的收集亮光在移动端显示异常，记得修！！！别说可以不打，做衣服要打材料的，叠，一键过关，懂？也别说什么打一次领一堆，我一次都不想打。一键过关，懂？<br />关于服装，一个换装游戏起家的公司做的换装类游戏，我都不吐槽大世界不能放大这个莫名其妙的设置，你衣柜的放大也不好使啊。而且距离拉得也不够近，想仔细看看蕾丝跟镂空都做不到，隔壁换装游戏的pc端都能贴在布料上观察了，你凭什么不能？<br />另外，跳过键能不能真的跳过，包括剧情和采集动画，跳过能不能跳干净点，闹心。本来以为采集能挂机了结果一看还有必须手动还概率出的精粹，闹心。<br />总之，我会评价《无限暖暖》是服装特化版本的《爱丽丝疯狂回归》，作为单机跳跳乐是一款非常合格的游戏，但作为标着轻度游戏的多端互通【手游】，非常不合格。融合了神庙和神瞳的奇想星使整个游戏的肝度非常、非常高。远远超过一般休闲玩家能够接受的程度，更不谈还有灵感露珠。放在单机/主机里可能很好，放在【优化很差的手游】里就是噩梦。<br />以上，一些主观游玩体验，先这么写着以后再补。<br />🧗自由度：如自由，山不能爬水不能游<br />🎣交互丰富度：你是来采材料的吧？,131,2024-12-11 15:03,Redmi K60
487149571,纪时,2,冷静下来，感觉都无所谓，无论是以闪也好暖暖也罢，她们本质上也都只不过是游戏而已，想玩就玩，没必要去趟浑水，谁知道背后到底是资本家还是玩家，别人说的再难听或者好玩，也只不过是道听途说，还是要自己玩<br />讲一下就是，手机端的画质一般般吧，不至于很惊艳，但是有的地方确实挺糟糕的，还有就是衣服竟然不能放大，不知道出这个服装功能是干什么的，都不能欣赏，电脑端一些很简单的东西到手机端又会变得很困难，不太能理解，感觉手感很差，比较影响深刻的就是，每次完成任务，只要我手稍微一滑，我就掉下去了，掉下去就算了，他又要从头再来，关键就是我又卡在那里，我好不容易过去了，他竟然给我这样搞，很搞我心态啊，官方的态度很难评，给人一种高高在上的感觉，既然要求玩家自行去买更高的配置啊玩这个游戏，而不是自己去改善，这款游戏的研发时间应该也蛮长了吧？我看他不是不能改，只是不想费时费力费金钱罢了，嗯，我感觉，玩家对这个游戏厂商挺宽容的，换了玩别的游戏骂的比这还狠，感觉就没什么好想到的了，具体我又没有看，都是一直按跳过，不评价，玩法确实有点枯燥，现在基本上就是每天换成日常就好了，拍拍照，在手机端感觉就是不能很好体验风景一般般吧<br />优点的话，就他的那个相机非常的好，其他就没怎么感觉出来了，毕竟在手机端上都那样吧,27,2024-11-30 03:57,Honor V40
575845842,夕照,5,真的超爱，从环暖、奇暖再到立体的闪暖，现在看着暖暖在大世界里跑跑跳跳真的好感动，任务目前大体上走的轻松童话风，主要玩法是换装和平台跳跃，里面的小游戏关卡我感觉不是很难，可能是有一部分比较难让人红温，但是大部分活动都是比较简单的，就是产能实在有点低，太长草了，有点无聊，还有最关键的画质问题，我只能说移动端和pc的奇迹大陆简直就是俩地方，PC画质有时候甚至让我幻视三次元。移动端那画质，就emmm，虽然有进步但是还是很一般，电脑上爽玩,15,2025-04-05 01:44,华为GOA-AL80
548622744,可爱的芙宁娜,1,进也进不去，老是闪退，还没看过分面,,2025-04-05 00:59,华为 荣耀 X10
428953405,厄塔,5,老是闪退卡退的，别卡退了，我快疯了，快整整吧，叠纸！,,2025-04-04 23:30,小米Xiaomi 12S
634519211,唯你,3,不知道一天天更新什么东面一直更新更新一看游戏里0个,,2025-04-04 23:20,一加手机PHP110
647887173,猫宁.,1,下载后咋闪退啊，一直进不去,,2025-04-04 23:15,华为荣耀9X
678039703,芸杉,2,一直在优化，但感觉没什么用，平板连过剧情都会直接卡退，不是高配置的pc端的画质就比平板好一点，过副本，打怪时还会卡顿，太影响游戏心情了。直接卸载了,1,2025-04-04 22:48,Huawei MatePad 11
688091560,显眼包,1,不知道为什么进不去一进去就闪退出来,1,2025-04-04 18:09,Vivo V2031A
44683380,有靈,3,非常不喜欢主控的脸 就是很西方的芭比娃娃脸 没有人脸真实感。<br />很自由 不知道干嘛 风景也没啥好看的 实在不行把故宫和布达拉宫搬到游戏里 我还能自己逛逛。<br />感觉玩法还能做出很多 养殖种植做饭盖房子等。。。这样看来这游戏将来可能得有一百G,,2025-04-04 17:50,Huawei Mate 60 Pro
376493224,言芜之风,2,梦镜仓库怎么跑,,2025-04-04 16:49,红米Note 8 Pro
450428923,小雪花,3,这个游戏，我做到那个花烟岛的任务直接给我卡退出了，然后就一直重复那个任务，带卡退再进去，再卡退重复，希望官方能优化一下，不要让我玩不了。,,2025-04-04 16:17,小米Xiaomi Pad 6 Pro
578314785,白日过TAP,2,我建议重新打磨，优化很差，可玩性不高，我希望这个游戏越来越好，但是现阶段很难玩。<br />更新版本后，对于bug反馈是不理会的，连续好几天的搭配赛bug，客服跟人机一样！并且ui换来换去！玩法很少，剧情稀碎！感觉策划就是想要钱，其他什么都不管！,,2024-12-05 17:03,Vivo X200 Pro卫星通信版
574920863,南鸢,3,为什么打不开啊,,2025-04-04 15:57,华为荣耀8X
690158977,椿,3,太吃设备了，手机端直接卡死，还会掉帧,,2025-04-04 15:27,华为Mate 20 Pro
704884175,晚安L,1,帧率都没得调？,1,2025-04-04 14:51,Vivo V2426A
704777,茗若兮风,3,"2025.4.4评测：<br />个人状态：主支线全完结，新出的妄想季活动几乎3小时不要就全打完，当期奇旅23颗星，强制需要甜美复古属性的古典乐章上期UP才抽了4散件导致没法满星，没啥玩长草也很难再肝到抽卡红钻来个吐槽——<br />不难发现暖暖公测四个月以来，一直在砍PC画质，而移动端优化依旧又糊又卡；活动模板从新年开始几乎定型开始套娃，常驻玩法和多人联机内容是没有的，资源获取不挑池子的话不氪战令月卡一轮几乎一套都拉不满，已经是上线5分钟清完日活就下线的巨长长草期；<br />成也虚幻5败也虚幻5，抛开PC这个换装休闲跳台解密游戏游玩的体验从画质到操作都可以不用谈，本来就不该上移动端的，至少5年后的芯片能不能带动高画质的暖暖都是未知数，小氪一点也是希望叠纸早日把《百面千相》和《万物契约》端上来，急于回收成本也罢，还是希望叠纸继续打磨目前的PC端，尤其界面UI，早日支持一键隐藏，暖暖没什么战斗强度，不用看UI的，上了PC还搞四边UI图标拉满过于唐了；多人玩法和家园系统也尽快上线，真没什么能玩的新内容继续杯水车薪的节日活动套娃很劝退。<br />写于2024.12.05公测前：<br />问配置要求的朋友太多了，置顶解答一下，暖暖官网配置要求图+目前最新手机CPU性能排行可跳转：<a href=""https://www.taptap.cn/moment/613498026392028358"">https://www.taptap.cn/moment/613498026392028358<a><br />安卓最低配置要求：运存8GB以上，处理器：骁龙888或者天玑8100max以上（设置-关于手机or设备里可看自己参数，华为麒麟处理器和鸿蒙系统很大可能首发不配适）；<br />ios最低配置要求：运存4GB以上，iPhone11或者ipad air5代以上，搭配芯片在A14以上（设置-通用-关于本机里看参数）；<br />PC推荐配置要求：CPU12代i5-12400以上，运存16GB以上，显卡GTX1080以上（设置-关于电脑里看参数，显卡可以点任务管理器-性能页面或者设备管理器-显示配置器看到，）；<br />🍀🍀🍀🍀🍀🍀🍀🍀🍀🍀🍀🍀🍀🍀🍀🍀🍀🍀<br />不了解处理器参数的可手机设置-关于手机（设备）里看处理器一栏，浏览器搜索自己处理器相当于骁龙多少就可以自行判断结果了；<br />骁龙处理器最低是888，推荐是8gen2，拉满上8至尊，手机端画面拉满最多1080p高清画质，大世界帧率稳不了60，密林区包卡的，因为pc都掉帧。<br />🎄🎄🎄🎄🎄🎄🎄🎄🎄🎄🎄🎄🎄🎄🎄🎄🎄🎄<br />游戏在安卓和ios、pc、ps5上都有，内测只知道了PC和手机端互通，主机不清楚；<br />手机端预下载9GB左右，可预留15GB左右储存用于解压后占用，配置不够可tap云玩，已经上了云玩功能的，不过公测人多排队，而且对网络要求高，消耗流量快；<br />PC版请浏览器搜索无限暖暖官网，在官网下载启动器安装后即可打开进行预下载，预下载25GB左右，可预留50GB左右储存用于解压后占用；<br />🎅🎅🎅🎅🎅🎅🎅🎅🎅🎅🎅🎅🎅🎅🎅🎅🎅🎅<br />参加了重逢之约，也就是终测，先下个定论：移动端开放大地图玩法的又一大突破，休闲冒险党福音，如果后续做好多人互动和大世界探索的推料，必是叠纸跻身大热门顶流的黑马之作。<br />当然目前除了顶配旗舰骁龙8至尊和天玑9400，大家都是又糊又卡就对了，所以降低期待要不用PC玩，用了上个5年的神U骁龙870反正大世界读条载入基本会卡退，全高帧率20帧上下，且出现贴图材质载入错误丢失的问题很严重，优化比上一个二游天花板还糟糕；<br />玩法主打一手跳台解密收集，战斗为辅，清体力的设计很不错，和传送柱交互，以物易物就清空每日体力了，简单来讲就是把大世界捡到的低品质物品加工成了衣服的制作原料；<br />跳台部分有明显参考2011年经典神作《爱丽丝：疯狂回归》，二段跳+滞空转向以及自动修正跳高位置很照顾动作跳台萌新手感；战斗就是魔法弹对轰，难度极低，而且可喘气回血；<br />大世界探索基本无缝，除了有门的小镇房屋，山洞这种都是无缝连接，地图边界用了无法进入的密林灌木做空气墙；<br />随主线推进可以解锁不同功能的套装，用于飘浮跳跃、战斗踩踏、清洁、捕捉、钓鱼等等，平时租个自行车大世界骑行拾荒，收集解锁天赋点的奇想星——通过挑战类似野炊神庙的无缝空间跳台或者平台解密，利用清洁套装和大鸟互动可以乘坐大鸟进行固定路线飞行以取得半空的星星，战斗魔法弹消灭箱子周边的全部怪物可以拿到星星或者衣服图纸等等都让喜欢探索世界的我不由发出好多有趣的玩法啊！<br />不多剧透了，说下除了手机端优化外的爆雷点：<br />①画面无法自由缩放，只能拍照模式拉近镜头；<br />②脚步音效和没有一样，很怪异；<br />③大世界传送时，自行车会停留在原地，只传送暖暖过去；<br />④深水区遇水即溶，没有水下和游泳内容，直接暴毙黑屏传送回岸边，如果喵币怪被魔法弹击飞到深水区，捡那一大推喵币多难受，跳一次死一次，捡完4条命都没了😂<br />看公测怎么改吧，终测也没玩到多人玩法，这游戏多人可以互动，限时活动做成糖豆人跳台玩法完全不是问题，平时多人有双人成行的跳台解密或者动森的家园建造互动拍照啥的那直接起飞！和npc装扮比拼除了数值有个QTE或者音游玩法互动会更有趣些，最好能跳舞，“你们不用再打了”这种装扮SHOW未尝不可，既然已经有了路人和阵营挑战，学点宝可梦加道馆挑战，追求刺激那就请贯彻到底，我要看二游狠狠卷！",1111,2024-11-20 00:39,未提供
529571986,fafa,1,每次都差一点点，根本跳不过去，做的什么垃圾。<br />也是从开服玩到现在了，玩不下去了，对养别人的oc没兴趣，我辛辛苦苦肝钻石还有充钱都是给别人的oc穿上好的衣服这衣服还是oc主人自己设计的。产能不足内容少占的内存可不少，大世界设计出来是为了给苏暖暖一个摄影棚。我不想当工具人也没变态到当一个有自己父母和姐姐的少女的父母，让她按自己的喜好穿衣服，控制她只能和一只猫一起玩。玩家不允许被带入暖暖，暖暖不允许和其他人交朋友，剧情里已经因为经常转学的原因没朋友了到了奇迹大陆还不允许交朋友，比起游戏角色暖暖更像一个二次元的明星，饭圈文化真是有够明显的。,3,2024-12-05 15:30,Redmi Note 11T Pro
24087300,今夕何夕,2,移动端基本放弃了。有高配电脑的可以玩，配置高的机器上画面表现很好。<br />也不想说什么了，提一下希望改进的吧<br />1.能力套装在靠近捕捉、清洗、钓鱼、电力这几个的时候可以自动识别。现在采集个材料来回切换太麻烦了。<br />2.清洗，钓鱼动画跳过。现在半跳不跳的。<br />3.支持玩家自己修改键位！！<br />4.小台阶这些都能自己迈上去！有些地方还没脚高得地形硬是能卡着我真是无语了。<br />5.移动端操作优化。接花球的那个小挑战给我整红温了😅以及总是有跳上去了，暖暖又走一小步掉下来的情况！<br />6.大世界可以放大缩小镜头。看不了脸看不了衣服细节也是醉了。<br />7.自行车骑行优化！把左右前后扣了，用方向转轮控制。走路正常，自行车再搞个操作模式干嘛呢？这么闲继续搞优化啊。<br />8.未激活的锚点地图显示。<br />9.可采集的物品，包括小蜜蜂，蚂蚱这些增加特效提示。移动端全程马赛克了，看不清。<br />10.找星星那个奇想星挑战增加一个距离星星图案距离的提示。还是移动端根本看不清。花园镇那个在布上的移动端找亖都看不到<br />其他想到再编辑吧。这些很多都是付费测的时候就提过的，真的完全没改，可能是什么底层代码吧😅<br />以及这是第一款把我玩到晕3d的游戏。总算知道什么是晕3d了，感谢叠纸😊<br />放几张付费测的图吧，现在根本没有拍照的欲望了，心疼自己付费测的时候充的钱🙃,2,2024-12-08 19:37,HONOR PTP-AN70
60609981,贝贝zzzZ,1,md你移动端的自行车做的像石，交出这种游戏自己有没有上手玩过啊<br />为什么一到这个钓鱼点就闪退啊，啥时候一切正常，在这个钓鱼点闪退了六七次了,,2024-12-29 18:15,未提供
102657726,手机用户102657726,1,怎么打不开啊?求解,,2025-04-04 13:44,Vivo Y78m
648014245,秋海,4,暖暖好，yrh坏，手机画质真的不太行只能怼脸拍照。剧情太无聊概率看个人，叠纸懂得都懂太扣了🙄💅,,2025-04-04 13:15,Vivo IQOO Neo9S Pro
678378506,荷包蛋,1,为什么老是闪退？是我的问题吗？,,2025-04-04 11:40,Honor Pad 7
44574122,罗修,1,我手机太垃圾了，进都进不去,,2025-04-04 09:35,未提供
710484237,isslu,5,好好玩，暖暖太美了❤️,,2025-04-04 08:44,Vivo V1965A
